Organization Name,Organization Name URL,Website,Industries,Industry Groups,Description,Full Description,LinkedIn,Hub Tags,Twitter,Facebook
CarCareKiosk,https://www.crunchbase.com/organization/carcarekiosk,http://www.carcarekiosk.com,"Automotive, Lighting, Video","Hardware, Media and Entertainment, Transportation, Video",CarCareKiosk is a video car repair manual that provides free auto repair videos that are vehicle specific.,"CarCareKiosk is a video repair manual for your car.  It provides free auto repair videos that are vehicle specific. Users of CarCareKiosk enter their vehicle type and can watch a free video that shows them how to change the oil, replace a cabin air filter or change a headlight, tailight or turn signal among other repairs on their specific car.  The site offers over 60 different repair procedures for each car. At the time of its website launch in November 2011, CarCareKiosk had over 8,000 videos in its library.  CarCareKiosk produces videos in-house and claims to add new auto repair videos on a weekly basis.",,,http://twitter.com/CarCareKiosk,
CarCharging,https://www.crunchbase.com/organization/carcharging,http://www.carcharging.com/,"Automotive, Electric Vehicle, Transportation",Transportation,Car Charging Group develops electric car charging stations.,"Car Charging Group develops electric car charging stations. The Company develops charging stations for building owners, parking garages, municipalities, sporting venues, and other public areas. The company owns and operates stations in various states including California, Florida, Maryland, New York, and Virginia. CarCharging was founded in October 2009.",http://www.linkedin.com/company/carcharging,,http://twitter.com/CarCharging,http://www.facebook.com/Car.Charging
CarChat24,https://www.crunchbase.com/organization/carchat24,https://www.carchat24.com/,"Automotive, Enterprise Software, Messaging, Software, Web Apps","Apps, Information Technology, Internet Services, Messaging and Telecommunications, Software, Transportation",Live chat software and support service provider for the automotive sales industry.,"CarChat24 helps automotive dealerships sell more vehicles by converting more website visitors into leads.  A well trained staff, state-of-the-art live chat software, and our proven proactive chat process create a positive experience for dealership website visitors.  Since June of 2007, CarChat24 has been helping car dealers improve sales and customer service on the Internet.",https://www.linkedin.com/company/carchat24,,https://twitter.com/CarChat24,https://www.facebook.com/CarChat24
CARCHEX,https://www.crunchbase.com/organization/carchex,https://www.carchex.com,"Auto Insurance, Automotive","Financial Services, Transportation",Provider of extended vehicle protection for used/older cars.,"Carchex offers extended vehicle protection plans for its clients to ensure that their vehicles are in good mechanical condition and to help them avoid expensive repair bills. Its vehicle protection plans are completely transferable and increase the resale value of its users’ vehicles. Advantages of Carchex include twenty-four hours of roadside assistance, towing benefits, and rental car service. The company provides its clients with customizable vehicle protection plans that allow them to choose a repair location as well as an affordable payment plan. Carchex has earned an A+ rating with the BBB and is endorsed by Pat Goss of PBS’s automotive series MotorWeek.",https://www.linkedin.com/company/carchex,,https://twitter.com/carchex,https://www.facebook.com/carchex/
carClub,https://www.crunchbase.com/organization/carclub,http://www.carclub.com/,"Automotive, Consumer, Web Browsers","Internet Services, Other, Software, Transportation",A membership club that provides savings on most car-related expenses,"At carclub.com, Their mission is to provide automotive consumers with the best car owning experience they will ever have. We're committed to building their business based on what customers want and how they like to be treated. Whether by web or by phone, they aim to offer comprehensive selection, unprecedented savings, and state of the art service.",,,https://www.twitter.com/vamosautoamigo,https://www.facebook.com/autoamigounivision
CarcodeSMS,https://www.crunchbase.com/organization/carcodesms,http://www.carcodesms.com,"Automotive, Messaging, Mobile, SMS, Software","Information Technology, Internet Services, Messaging and Telecommunications, Mobile, Software, Transportation",Text messaging platform for car dealerships.,"CarCode is a cloud-based SMS texting platform, tailored specifically to the needs of car dealerships, allowing them to receive and respond to customers via text messages directly from their mobile phones. Participating dealers will receive text message leads from Edmunds and have the opportunity to also add a ""Text Us"" button on their own mobile sites -- which has proven to drive high levels of engagement from car shoppers. Dealers can manage their conversations with buyers with a simple interface, showing unanswered messages and average response time.",,,http://twitter.com/carcodeme,
Carcopia,https://www.crunchbase.com/organization/carcopia,http://www.carcopia.com,Automotive,Transportation,CarCopia is an online platform that enables users to purchase used vehicles from nationwide auctions.,"CarCopia is an online platform that enables users to purchase used vehicles from nationwide auctions. The vehicles do not carry any inventory costs, marketing costs, and sale commissions, and are available for manual inspections. CarCopia was launched in November 2012.",,,https://twitter.com/carcopia,https://www.facebook.com/carcopia
CarData Consultants,https://www.crunchbase.com/organization/cardata,http://www.cardataconsultants.com,"Automotive, Logistics, Management Consulting","Professional Services, Transportation",CarData Consultants provides an efficient alternative to traditional vehicle fleet and in-house car allowance programs.,"CarDATA is a North American vehicle reimbursement service company who take all of the hassle out of managing a company’s vehicle fleet. By systematically tracking and monitoring all aspects of a company’s vehicle fleet, CarDATA’s system will save an average of 30% on vehicle fleet costs. It will overcome such problems as driving a company vehicle in personal time, unproductive admin time, fluctuating gas prices and limited auto allowances. CarDATA track fuel prices across North America on a monthly basis. They then refresh driver reimbursements to take into account the changes in gas prices in a company’s location and sales territory. Their vehicle reimbursement programs are in compliance with the Internal Revenue Service (IRS) and the Canadian Revenue Agency (CRA). This may be a fixed variable and rate (FAVR), and accountable plan or a Standard Mileage Reimbursement. CarDATA also provide safety training, DMV License Checking and Direct Driver Payment. The CarDATA system reduces a company’s risk management. Company provided vehicles, whether owned or leased, give the employer 100% responsibility for the vehicle 24 hours a day, 7 days a week. By shifting to a system where they are using an employee provided vehicle, the risk and liability for the company is greatly reduced as the driver owns the vehicle. A well designed and properly maintained reimbursement program provides the employee with a fair and accurate vehicle use reimbursement while removing the company from liability when the vehicle is driven for personal use outside of business hours, providing a win-win for bother employer and employee.",http://www.linkedin.com/company/cardata-consultants,,http://twitter.com/CarDATA_Social,http://www.facebook.com/CarDATA-Consultants-Inc/1804987186
"CarData, Inc.",https://www.crunchbase.com/organization/cardata-inc,https://www.cardata.us,"Automotive, E-Commerce","Commerce and Shopping, Transportation","Complete Inventory Merchandising solutions for Automotive dealerships. Inventory Photography, Videos, Spin360 services to sell more cars.","CarData, Inc. is a full service vehicle merchandising company. We specialize in ""on the lot"" services ranging from professional photography to live walk-around vehicle videos. With 9 out of 10 customers going online before they ever step foot into a dealership, it has become more important than ever to WIN in the ever competitive online marketplace. WE HELP DEALERS WIN! - Full Time Dedicated Account Representatives - Professional Digital Photography - Full Motion Vehicle Videos + Full Video Syndication -  360 Walkarounds - Exterior+Interior Shopper controlled experience - TextUps Reseller - Simple Text Lead generation  Our Mission is to provide superior products & services to our clients through attention to detail, pride, integrity & intensity in all we do!",https://www.linkedin.com/company/cardata-inc-,,https://www.twitter.com/cardata_us,https://www.facebook.com/cardataus
CarDog inc.,https://www.crunchbase.com/organization/cardog-inc-49da,https://cardog.us,"Automotive, GPS, Information Technology, Parking, Software","Hardware, Information Technology, Navigation and Mapping, Software, Transportation","Touchless all-in-one payment service for car drivers and self-driving vehicles to pay for parking, tolls, drive thru restaurants, gas, etc..","CarDog is a payment service for drivers. Parking, gas, tolls, drive-thru businesses.  CarDog is designed to be used via mobile app for manual payments and automatically, hands free via pay-by-car.",,,https://twitter.com/CarDog_inc,https://www.facebook.com/cardoginc
CarDomain Network,https://www.crunchbase.com/organization/cardomain-network,http://www.cardomain.com,"Automotive, Internet, Social Media","Internet Services, Media and Entertainment, Transportation",CarDomain Networks is a database tracking the behavior and purchasing patterns of automotive enthusiasts.,"CarDomain Network was founded in 1998 and based in Seattle, Washington. CarDomain operates the web's largest community for auto enthusiasts with two million registered users and 650,000 custom rides profiles.   CarDomain has built the largest database tracking the behavior and purchasing patterns of automotive enthusiasts.",,,https://www.twitter.com/cardomain,https://www.facebook.com/6299899676
Cardone Industries,https://www.crunchbase.com/organization/cardone-industries,http://www.cardone.com,"Automotive, Logistics, Manufacturing","Manufacturing, Transportation",remanufacturing automotive parts,"CARDONE Industries, Inc. engages in remanufacturing automotive parts. The company offers brakes, drive train, electronics, motors, pumps, electrical, power train, engines, and steering components. It also offers automotive tools and accessories. The company was founded in 1970 and is headquartered in Philadelphia, Pennsylvania.",http://www.linkedin.com/company/cardone-industries,,http://twitter.com/cardoneparts,http://www.facebook.com/pages/Cardone-Industries/283384408494
carDonkeys.com,https://www.crunchbase.com/organization/cardonkeys-com,http://cardonkeys.com,"Automotive, E-Commerce, Marketing, Marketplace, Retail","Commerce and Shopping, Sales and Marketing, Transportation","carDonkeys second hand market place that enables its clients to sell used cars, phones, computers, and more.","Traditional second hand vehicle sales is on its way out. It’s time to introduce more transparency, trust, and consistency into this 50 year old model. carDonkeys uses technology to minimize our overhead costs and maximize your vehicle sales price potential. We provide local car experts to handle the entire car selling process for you. You’ll save time because we do all the work, and you can keep driving your car until it’s sold. We do the dirty work so you don’t have to. Our technology automates advertising and contact with potential buyers. Your carDonkey agent will then take care of all test drives and negotiating. Cha-ching! You get paid! Get up to 30% more than dealer trade-in without any hassle or haggling. Selling a car doesn’t get any easier than this!",,,,https://www.facebook.com/cardonkeys
CarExchange,https://www.crunchbase.com/organization/carexchange,http://www.carexchange.com/,"Automotive, Autonomous Vehicles, Marketing Automation","Sales and Marketing, Software, Transportation",CarExchange.com is dedicated to facilitating and enhancing the relationship between dealers and consumers.,"CarExchange facilitates and enhances the relationship between the vehicle dealers and consumers. It lets its users to search, negotiate prices, inspect the vehicles, pay, and deliver their next car directly to their driveways. CarExchange is headquartered in the United States and the company was founded in 2011 by Tim Ryskin.",,,https://www.twitter.com/carexchangecom,https://www.facebook.com/carexchangecom
Carfax,https://www.crunchbase.com/organization/carfax,https://www.carfax.com/,"Automotive, E-Commerce, Information Technology, Shopping","Commerce and Shopping, Information Technology, Transportation",Shop for a used car with the right history on carfax.com. Buy with confidence with CARFAX vehicle history reports. Show Me the CARFAX!,Shop for a used car with the right history on carfax.com. Buy with confidence with CARFAX vehicle history reports. Show Me the CARFAX!,https://www.linkedin.com/company-beta/10616/,,https://twitter.com/CarfaxReports,https://www.facebook.com/carfax/?ref=page_internal
CarFinance.com,https://www.crunchbase.com/organization/carfinance-com,http://www.carfinance.com,"Association, Automotive, Logistics","Other, Transportation",We help auto dealers meet the needs of today's non-prime customer.,We help auto dealers meet the needs of today's non-prime customer.,,,http://twitter.com/carfinancecom,http://www.facebook.com/CarFinanceCom
CARFIT,https://www.crunchbase.com/organization/carfit,http://www.car.fit,"Artificial Intelligence, Automotive, Autonomous Vehicles, Big Data, Database, Information Technology, Internet of Things","Artificial Intelligence, Data and Analytics, Information Technology, Internet Services, Science and Engineering, Software, Transportation",CARFIT leverages car's vibrations with data science to anticipate maintenance needs,"CARFIT is a self-diagnostic & predictive maintenance platform in the connected car space that provides the dealers/service companies with customized lead generation and car owners with individualized predictive maintenance info on their car. CARFIT blends NVH [Noise, Vibration, and Harshness] automotive science with artificial intelligence to create the most comprehensive library on car's vibrations.",https://www.linkedin.com/company/carfit-corp./,,https://twitter.com/car_fit,https://www.facebook.com/Carfit-1490496867934767/
CarForce,https://www.crunchbase.com/organization/thecarforce,https://www.thecarforce.com/,"Automotive, B2B, Big Data, Internet of Things, Machine Learning, Predictive Analytics, SaaS, Software","Artificial Intelligence, Data and Analytics, Internet Services, Other, Software, Transportation",CarForce is a multi-brand enterprise software platform that delivers real-time vehicle health insights using EDGE computing and ML,"Customer Problem: There are 162 million used vehicles on the road today equipped with complex maintenance systems but without embedded telematics or diagnostic connectivity.   Consumers driving these vehicles may see a check engine light go on in their car, but they are dependent and distrustful of the mechanic. Dealers are in the dark, having zero awareness or information about the issue. Resultantly, dealers are leaving money on the table from missed service revenue and OEM customer loyalty incentives.  Solution: CarForce has developed a complete end to end solution that leverages after market telematics to provide real time updates on the health of consumer vehicles. Service centers now have the ability to see service opportunities in real time enabling them to serve their customers by having first right of refusal, order parts more quickly, and offer their customers an on-demand concierge experience. Management: CarForce was founded by Jessika Lora, the former Head of Automotive Partnerships and GM of eBay’s Vehicles C2C business. While at eBay Motors, the world’s #1 automotive marketplace, she managed strategy and operations for a $7.3 billion dollar business and led the turn around of eBay’s $1.6 billion dollar consumer-to-consumer vehicle sector with double-digit growth. She developed her results driven track record as a management consultant for Deloitte Consulting and is a Stanford BS and MS graduate with 10+ years of automotive and e-commerce experience.",https://www.linkedin.com/company/carforce,,https://twitter.com/thecarforce,https://www.facebook.com/TheCarForce
CarGalaxies at BorSystems,https://www.crunchbase.com/organization/autogalaxies-at-borsystems,http://www.cargalaxies.com/,"Automotive, Classifieds, Internet, Search Engine","Commerce and Shopping, Internet Services, Transportation",For All Car Enthusiasts,"CarGalaxies.com - a one-stop place for all drivers: from interactive online driver license training in your native language (English, Spanish, Portuguese, Turkish, Russian and Japanese languages supported) to advanced zip code/radius based search for driving schools, DMVs and traffic lawyers in any area coast to coast.  Get instant direct online quotes from leading auto insurance providers. Find best gas prices in your location. Save you money avoiding red light tickets with our red light camera locator. Buy, Sell or Trade your vehicle with AutoGalaxies.com - post your vehicle in AutoGalaxies.com auto classified channel for free. Enjoy our unlimited listing editing service - update your vehicle ad when and if you want at no charge. Re-post your free classified month-by-month at no charge as many times as you want.",,,,
CarGear,https://www.crunchbase.com/organization/cargear,http://www.CarGear.com,"Automotive, Electronics, Manufacturing, Product Design","Consumer Electronics, Design, Hardware, Manufacturing, Transportation","CarGear was formed in 2008 by a group of automotive and business enthusiasts who wanted to make automotive accessories for your car, truck,","CarGear was formed in 2008 by a group of automotive and business enthusiasts who wanted to make automotive accessories for your car, truck, or motorcycle easier to find online. Although CarGear itself is relatively new, the founders of CarGear have been in the automotive industry for more than 25 years. We are based in California so we are surrounded by all of the latest trends and are known for high quality, product innovation, great value, fast order processing, and always having the latest, coolest products. You will experience a wide range of products from purely functional to high performance to the latest styling and design products for your car and truck.  We are also one of the largest suppliers of Automotive Collision Lighting (Headlamps, Tail Lamps, Mirrors, and OE Style Wheels). We hope you haven’t had an accident, but in case you did, we are a great source for the Collision Lighting and Mirror products needed to get your car or truck back on the road.",http://www.linkedin.com/company/3996711,,http://twitter.com/CarGear_com,http://www.facebook.com/CarGearDOTCOM
Cargigi,https://www.crunchbase.com/organization/cargigi,http://www.cargigiautos.com/,"Advertising, Advertising Platforms, Automotive, Consulting","Advertising, Professional Services, Sales and Marketing, Transportation",Cargigi provides advertising and marketing solutions on classified websites.,"Cargigi offers automotive industry with advertising and marketing services. Cargigi offers ADAM, a software platform that enables its users to manage data and promote their inventory across multiple advertising platforms. It offers inteliPost that enables its users to promote their inventory on classified websites. Its inteliPhoto offers photography creation services for their marketing campaigns. And its inteliProfit enables businesses to obtain analytics and information about vehicles. Cargigi was founded in 2009 by Tony Haong. And it is based in Irvine, California.",https://www.linkedin.com/company/cargigi,,https://twitter.com/cargigi,https://www.facebook.com/pages/Cargigi-Autos/156531627735107
Cargo,https://www.crunchbase.com/organization/cargo,http://www.cargo.ai,"Automotive, Developer APIs, Internet of Things","Internet Services, Software, Transportation",Cargo is an open auto platform enabling developers to create apps for the car without worrying about complicated hardware or infrastructure.,"Cargo is an IoT platform enabling developers to create automotive focused applications without worrying about the hardware or cloud infrastructure required to “plug in” to the car’s massive data store. This allows developers to focus on quickly bringing new apps to market in all vectors of the automotive industry. Developers can focus on the apps they are experts at instead of building complex hardware, negotiate with data carriers, deal with long and costly certification processes, and navigate thousands of automotive standards in the 30,000 permutations of cars between 1996 and today. Cargo participated in the Highway1 accelerator Fall 2014.",,,http://twitter.com/cargolabs,https://www.facebook.com/cargolabs
CargoBot,https://www.crunchbase.com/organization/cargobot,https://www.cargobot.io/,"Automotive, Internet, Logistics, Railroad, Software, Transportation","Internet Services, Software, Transportation","Cargobot is an innovative, reliable, and efficient technology platform for shippers and carriers.","CargoBot is a powerful and dynamic way of connecting shippers and carriers. It is the innovation and evolution of managing efficiency in a new era of ground transportation. They allow shippers and carriers to work directly with one another through a free platform that pilots business under an auction like format. Shippers enjoy the ability to negotiate rates with multiple carriers, have real-time tracking of their shipments, lower costs, and work with a trusted pre-screened network of carriers. Carriers can now make more money for every mile, receive immediate payment, and manage their own business.CargoBot facilitates the process for both carriers and shippers by creating a platform that is user friendly, cost effective, transparent in its business, guarantees cargo insurance and freight payment, and eliminates the broker from the equation.",https://www.linkedin.com/company/18009919/,,https://twitter.com/_cargobot_?lang=en,https://www.facebook.com/cargobot.io/
CarGurus,https://www.crunchbase.com/organization/cargurus,http://www.cargurus.com,"Automotive, Classifieds, Price Comparison, Shopping","Commerce and Shopping, Transportation",CarGurus is an online automotive destination that assists users in contacting sellers and comparing local listings for new and used cars.,"A comparison shopping site for automobiles that uses proprietary pricing algorithms to analyze millions of new and used car listings to help consumers find the best deals and avoid bad deals in their local area. Users share information, including reviews of dealers, mechanics, and cars and advice on other car topics.",https://www.linkedin.com/company/cargurus/,,http://twitter.com/CarGurus,http://www.facebook.com/cargurus
CarHistoryIndex,https://www.crunchbase.com/organization/carhistoryindex,http://www.carhistoryindex.com/,"Automotive, Information Services","Information Technology, Transportation",High Quality Vehicle History Records,"CarHistoryIndex.com is here to help you make sure that you don't get ripped off when you buy a used car. Shopping for a used car can be a real challenge – because traditionally, the seller knows more about the car than you do. They change that by giving you access to information about that particular vehicle you wouldn't otherwise be able to find easily.",,,,
Carhoots.com,https://www.crunchbase.com/organization/carhoots-com,http://www.carhoots.com,"Automotive, Marketplace, Social Media","Commerce and Shopping, Internet Services, Media and Entertainment, Transportation",Carhoots is an online community marketplace for car buyers.,"Carhoots is a community and marketplace for car buyers, aiming to disrupt the $10 billion online automotive advertising market. With a community of over 2 million, Carhoots connects car users with quality content that empowers them to make more informed decisions, providing them with everything they need in one simple, fun and trusted destination!",,,http://twitter.com/Carhootsapp,http://www.facebook.com/carhootsuk
CarHopper (Acquired),https://www.crunchbase.com/organization/carhopper,https://carhopper.co,"Automotive, Marketplace, Rental, Transportation, Travel","Commerce and Shopping, Transportation, Travel and Tourism","CarHopper is an online marketplace to rent luxury and exotic cars from trusted local providers. On March 10th 2020, CarHopper joined Turo.","CarHopper is a beautifully simple online booking platform for luxury car rentals, giving you access to the most unique cars in the world; from Ferraris to Bentleys, Lamborghini to McLaren. Whatever the experience you want to drive, we have the cars to make it happen. On March 10th 2020, CarHopper joined Turo.",https://www.linkedin.com/company/carhopper,,https://twitter.com/carhopperapp,https://www.facebook.com/carhopperapp
