Organization Name,Organization Name URL,Website,Industries,Industry Groups,Description,Full Description,LinkedIn,Hub Tags,Twitter,Facebook
AmpUp,https://www.crunchbase.com/organization/ampup,https://ampup.io/,"Automotive, Electric Vehicle, Software, Transportation","Software, Transportation","AmpUp is an electric vehicle (EV) software company that enables drivers, hosts, and fleets to charge stress-free.","AmpUp is an electric vehicle (EV) software company that enables drivers, hosts, and fleets to charge stress-free. Our technology gives businesses and property owners the ability to efficiently manage multiple charge stations in one place. Advanced features, such as smart scheduling, dynamic access control and energy optimization provide site hosts more flexibility and affordability for their charger investment. Our community and fleet management system also allows site hosts to participate in AmpUp's peer-to-peer charging network, the largest and fastest growing in the world.  Ampup was founded in 2018 and incubated at YCombinator.",https://www.linkedin.com/company/nad-grid-corp,,https://twitter.com/ampup_io,https://www.facebook.com/ampup.io
AMS Vans,https://www.crunchbase.com/organization/ams-vans,http://www.amsvans.com/,Automotive,Transportation,AMS Vans is a provider of economy priced wheelchair accessible vehicles (“WAV”).,"AMS Vans is a provider of economy priced wheelchair accessible vehicles (“WAV”). We have been a leader in the mobility industry since 1999 as one of the first WAV providers to offer new and used Dodge, Chrysler, Honda, Toyota, and Volkswagen vans for sale with delivery nationwide at affordable prices.",https://www.linkedin.com/company/994917/,,https://twitter.com/amsvans,https://www.facebook.com/amsvans/
Amsoil Dealer - S.O.S. Sales LLC,https://www.crunchbase.com/organization/amsoil-dealer-s-o-s-sales-llc,http://1gr8oil.com,"Automotive, Oil and Gas","Energy, Natural Resources, Transportation","S.O.S Sales LLC is an Amsoil Dealer in Ogden, Utah.","Amsoil provides premium synthetic motor oils for all types of cars, diesels, boats, motorcycles, RVs, ATVs, and more. Browse our selection of fluids, lubricants, additives and oils, or request a free catalog.",,,,https://www.facebook.com/AMSOIL-SYNTHETIC-OIL-SALES-LLC-303021539429/
Amsted Rail,https://www.crunchbase.com/organization/amsted-rail-2,http://www.amstedrail.com/,"Automotive, Information Technology, Logistics, Transportation","Information Technology, Transportation",Amsted Rail is an engineered system solutions provider.,"For more than a hundred years, the heavy haul world has turned to Amsted Rail to keep their railcars rolling in the world’s most challenging environments. Their track record innovating performance-driven solutions continues to push the limits for reliability, allowing railroads today to haul heavier loads over greater distances.",https://www.linkedin.com/company/amsted-rail-inc,,,
AmTex Insurance,https://www.crunchbase.com/organization/amtex-insurance,http://amtexinsurance.com/location-finder/houston/bissonnet/,"Automotive, Consulting, Insurance","Financial Services, Professional Services, Transportation","AmTex Insurance offers a range of automotive, commercial, homeowners, renters, and motorcycle insurance packages and surety bonds.","AmTex Insurance is a customer-focused company that strives to satisfy any coverage needs. At Amtex , we customize coverage to benefit personal demands and budgets. We are aware that auto insurance is required by law, therefore it should be affordable. We keep our customers safely covered, confidently legal, and completely happy with our prices.",https://www.linkedin.com/company/amtex-auto-insurance,,https://www.twitter.com/amtexinsurance,https://www.facebook.com/amtexinsurance
Anagy,https://www.crunchbase.com/organization/tamatura-inc,http://www.anagy.io,"Aerospace, Automotive, CleanTech, Hardware, Marine Transportation, Transportation","Hardware, Science and Engineering, Sustainability, Transportation","Anagy is a unique electric propellentless technology for aerospace, marine and automotive.","Anagy is a unique electric propellentless technology for aerospace, marine and automotive.",https://www.linkedin.com/company/anagy/,,http://twitter.com/tamatura1,
Anaheim Mitsubishi,https://www.crunchbase.com/organization/anaheim-mitsubishi,https://www.anaheimmitsubishi.com,Automotive,Transportation,"Mitsubishi Dealerhsip anaheim,Automotive, Auto dealers ","Mitsubishi Dealership. Whether you are looking for a new Mitsubishi or pre-owned car or truck, Anaheim Mitsubishi is here to help. If you don't see what you are looking for, click on CarFinder and simply fill out the form. We will let you know when vehicles arrive that match your search!  If you would rather discuss your options with our friendly sales staff, click on Directions for interactive driving directions. We are conveniently located at 1300 South Auto Center Drive. You can also reach Anaheim Mitsubishi any time by filling out our contact form or calling us. The entire staff at Anaheim Mitsubishi looks forward to serving you! Address: 1300 South Auto Center Drive Anaheim, CA 92806 ",,,https://twitter.com/anaheimmitsu,https://www.facebook.com/AnaheimMitsubishiCars
Analog Rails,https://www.crunchbase.com/organization/analog-rails,http://www.analograils.com,"Automotive, Consulting, Electronics, Simulation","Consumer Electronics, Hardware, Professional Services, Software, Transportation",Analog Rails offers automation of systems on a chip (SOC) design and circuits with analog and RF content.,"The mission of Analog Rails is to automate the design of systems on a chip (SOC). The goal for non-commodity ICs is to be first to market, and the Analog Rails design environment was created to do just that.  Their product name, Analog Rails, was chosen for a reason. The ""Rails"" refers to a well structured framework, and their niche is automation of circuits with ""Analog"" and/or RF content. They also have digital place and route, enabling completion of the entire SOC.",,,http://twitter.com/analograils,
Anderson Metals Corp.,https://www.crunchbase.com/organization/anderson-metals-corp,http://www.andersonmetals.com/,"Automotive, Manufacturing","Manufacturing, Transportation","Anderson Metals Corp. manufactures brass fittings, pipe nipples, brass and plastic valves, and cast brass pipe fittings.","Anderson Metals Corp. manufactures brass fittings, pipe nipples, brass and plastic valves, and cast brass pipe fittings. It offers automotive fittings, including air brakes for copper and nylon tubing, hose ends, drain cocks, fuel line valves, grease fittings, inverted flares, and truck valves; compression fittings, including chrome plated, evaporative coolers, long nuts, plastic tubes, self alignings, standard compressions, threaded sleeves, and transition fittings; flare fittings, including inverted flares, range connectors, space heaters, and standard flares; and hose fittings, including automotive hose barbs, garden hoses, push on hose barbs, reusable hose fittings, standard hose barbs, and welding hose fittings. The company also provides pipe fittings; drain cocks, fuel line needles, polished air cocks, saddle and tank valves, and shut off cocks; and CPVC transition fittings, evaporative cooler fittings, fusible plugs, hose clamps and ferrules, plastic tube cutters, and refrigeration fittings.",,,,
Angelic Air,https://www.crunchbase.com/organization/angelic-air,http://angelicac.com,"Automotive, Hardware, Logistics, Transportation","Hardware, Transportation","Angelic Air offers the most affordable, competitive AC & Heating Repair & Installation Pricing here in Central Florida, just ask anyone in","Angelic Air offers the most affordable, competitive AC & Heating Repair & Installation Pricing here in Central Florida, just ask anyone in the area! frank@angelicac.com 700 S Smith Ave, Inverness, FL 34452",,,,https://www.facebook.com/citruscountyacrepair
Ann Arbor Infiniti,https://www.crunchbase.com/organization/ann-arbor-infiniti,https://www.annarborinfiniti.com/,"Automotive, Autonomous Vehicles, Logistics",Transportation,Ann Arbor Infiniti is committed to caring for your vehicle.,"Ann Arbor INFINITI is committed to caring for your vehicle for as long as you own it. We have state-of-the-art service facilities and use the latest diagnostics to maintain and repair your INFINITI at a competitive price. We offer many convenient amenities such as Express Service to make your visit with us pleasurable. At Ann Arbor INFINITI, we use only genuine INFINITI parts, so you can be sure your vehicle will perform as well as the day you got it.",,,,
Annex Manufacturing,https://www.crunchbase.com/organization/annex-manufacturing,,"Automotive, Manufacturing","Manufacturing, Transportation",Annex Manufacturing manufactures and markets climate control products.,"Annex Manufacturing distributes a variety of temperature control products for the automotive aftermarket. Annex Manufacturing offers aluminum and steel accumulators and receiver driers; expansion valves; heater cores; hose assemblies (fluid transfer), such as AC, coolant, and engine and transmission oil cooler hose assemblies; series wound motors; and switches, sensors, and transducers.",,,,
Answer Financial Inc.,https://www.crunchbase.com/organization/answer-financial-inc,http://www.AnswerFinancial.com/,"Automotive, Insurance","Financial Services, Transportation","Answer Financial is your original insurance comparison company, where you can get quotes and buy auto and home insurance all in one place.",Answer Financial offers shoppers the opportunity to compare prices and purchase auto and home insurance from top companies through its award-winning website or customer call center.,http://www.linkedin.com/company/answer-financial,,http://twitter.com/answerfinancial,https://www.facebook.com/AnswerFinancial/
Ant Robotics,https://www.crunchbase.com/organization/ant-robotics,https://antrobotics.tech,"Automotive, Electronics, Industrial Automation, Industrial Manufacturing, Manufacturing, Robotics, SaaS","Consumer Electronics, Hardware, Manufacturing, Science and Engineering, Software, Transportation",Vendor-Independent Platform to Team-Up Incompatible Robots for Industrial Material Handling,"The main product is the SaaS platform to team-up incompatible industrial transport robots. It is the tool for vendor lock-in risk mitigation for factories and warehouses exploiting robots. It also adds flexibility to the production processes, as well as delivers inexpensive, piecemeal, and zero downtime robot fleet upgrades.",https://www.linkedin.com/company/antrobotics/,,,
Antenum,https://www.crunchbase.com/organization/antenum,https://www.antenum.com/,"Automotive, Manufacturing","Manufacturing, Transportation",Antenum is an electronics company that specializes in the manufacturing of different varieties of an antenna.,"Antenum is an electronics company that specializes in the manufacturing of different varieties of an antenna. It offers all the relevant bands needed for the Connected Car: 3G/4G, 2X2 MIMO, 5G - sub 6, SDARS, WiFi, GNSS, V2X, and Bluetooth. It even offers AM/FM allowing for the elimination of the expensive antenna in the rear windshield. All in one small 5in X 5in package. The company was founded in 2017 and headquartered in New Hampshire, United States.",,,,
Antioch Chrysler Jeep Dodge,https://www.crunchbase.com/organization/antioch-chrysler-jeep-dodge,http://www.antiochchryslerjeepdodge.com,Automotive,Transportation,Car dealer,"Our car dealership in Antioch, CA is proud to provide our extensive new inventory and used inventory to our Concord, CA area residents. With new models like the rugged new 2017 RAM 1500 pickup truck and the 2017 Jeep Cherokee, we have something for every preference and need. Come visit us to see our new and used vehicles and take one for a test drive. If you're looking for a Certified Pre-Owned car near Concord, CA, we can assist you there as well. Take a look at our large collection of pre-owned cars, trucks and SUVs. Antioch Chrysler Jeep Dodge is not just your trusted Antioch car dealership, we also provide a full line of services dedicated to our CA customers. From car repairs and service in Antioch, CA performed by expert mechanics, to OEM Chrysler, Dodge, RAM, and Jeep auto parts to Walnut Creel, CA area car loans and leases, our dealership is the smart choice for your automotive needs in Antioch, California. Come in and say hi! We're located at 1810 Auto Center Drive in Antioch or you can call us at (888) 311-2606. We look forward to taking care of all you automotive needs!",,,https://www.twitter.com/antiochdcj,https://www.facebook.com/antiochcjd
Anvl,https://www.crunchbase.com/organization/anvl,https://anvl.com,"Analytics, Automotive, Construction, Enterprise Software, Industrial Manufacturing, Logistics, SaaS, Software","Data and Analytics, Manufacturing, Real Estate, Software, Transportation","Anvl modernizes frontline worker productivity with one easy to use platform for safety, quality and operational processes.","Anvl promotes worker engagement and efficiency with an easy to use mobile application that provides in-the-moment guidance through smart, dynamic workflows. The flexible platform supports safety, quality and operational processes with a configurable user interface, flexible content,  triggered process steps and configurable alerts. The application collects and acts on real-time data issuing leading indicator prompts and notifications to both the frontline worker and management when proactive interventions are needed.  Leaders benefit from a live feed of data, real-time alerts and remote monitoring of all in-progress and completed workflows. Dashboards, standard and custom reports deliver actionable insights to support continuous improvements and positive cultural changes.",https://www.linkedin.com/company/anvl/,,https://twitter.com/anvlapp,https://www.facebook.com/AnvlApp
Anzael LLC,https://www.crunchbase.com/organization/anzael-llc,http://www.anzael.com/,"Automotive, E-Commerce, Robotics, Software","Commerce and Shopping, Hardware, Science and Engineering, Software, Transportation",Anzael is an established and innovative web & software development company from Delware USA.,"Anzael LLC is a digital automotive aftermarket parts catalog creator that builds an online presence of the Selection group of automotive parts. With over 1 million auto parts, 1 million picture and 20 million pieces of information, we make catalog for cars, sports car, motorbike, light truck , , heavy duty, and alternative motive. Anzael LLC provide many feature for AAIA Customer one click to access Data mapping, data validation, Data Consultation, Catalog Printing, data entry etc  For the popular auto parts brand, we create the unique auto parts functioning website, build customer satisfaction, reduce lost auto sales in market and increase customer profit.   ",https://www.linkedin.com/company/anzael-llc/,,https://www.twitter.com/anzaelllc,https://www.facebook.com/Anzael-LLC-1721094658188563/
AOK RVs,https://www.crunchbase.com/organization/aok-rvs,https://www.aokrvs.com/,"Automotive, Consumer Goods, Retail","Commerce and Shopping, Consumer Goods, Transportation","AOK RVs offers new and pre-owned RVs, parts, and service.","AOK RVs offers new and pre-owned RVs, parts, and service. The company is a family-owned and operated business built on old fashioned hard work and customer satisfaction.",,,,https://www.facebook.com/aokrvs/
AP Auto Spa,https://www.crunchbase.com/organization/ap-auto-spa,http://apautospa.com/,Automotive,Transportation,Established over 20 years as the specialists in auto body.,"Why choose us? We have technicians that are trained on all the latest technologies and have the most up-to-date diagnostic equipment to pinpoint any faults in your car as quickly and as accurately as possible. At Absolute Perfection we provide economic, honest, and high quality auto body repairs that have indeed made us popular in San Diego. Fender bender? Major accident? Or just a simple door ding? No problem! Absolute Perfection is here to assist you every step of the way! v High Quality v Cost Effective v Efficientv Convenient We cover the entire auto body repair process from representing you in dealing with the insurance companies as your own private liaison, to arranging a rental car, physically repairing your vehicle to the highest possible standards, and delivering your vehicle back to you fully detailed and backed with a lifetime warranty.  Absolute Perfection’s high standards of automobile painting and repair are far superior to that of our competitors due to our high quality products, repair procedures and level of integrity. AP specialists are capable of repairing everyday wear and tear to your car paintwork. We believe in delivering you a unique and deep auto body repair finish for your vehicle making you proud of your vehicle. We can save you both time and money.",,,https://www.Twitter.com/apautospa,https://www.facebook.com/apautospa
AP Exhaust,https://www.crunchbase.com/organization/ap-exhaust,http://www.apexhaust.com/,"Automotive, Consumer Electronics, Consumer Goods, Manufacturing","Consumer Electronics, Consumer Goods, Hardware, Manufacturing, Transportation","AP Emissions Technologies manufactures a complete line of automotive, light truck, and heavy-duty exhaust, and emissions products.","For decades AP has engineered and manufactured a wide range of automotive exhaust and emission systems and components.  AP’s assortment of products has grown to include mufflers, exhaust and tail pipes, catalytic converters and related installation and cosmetic-accessories.  AP has manufacturing processes which meet the needs for high-quality, Muffler, Tube Product and Catalytic Converter production.",https://www.linkedin.com/company/ap-exhaust-technologies,,https://www.twitter.com/apexhausttech,https://www.facebook.com/apexhausttech
Apache Oil Company,https://www.crunchbase.com/organization/apache-oil-company,http://www.ApacheOilCompany.com,Automotive,Transportation,"Apache Oil Company provides emergency fueling service during hurricanes, national disasters, and chemical plant shut-downs.","Apache Oil Company provides oil products, oil related services and hardware nationwide. You can count on us to be there for you in your time of need! We're just a call away.",,,,http://www.facebook.com/ApacheOilCompany
Aparc Systems,https://www.crunchbase.com/organization/aparc-systems,http://aparcsystems.com,"Automotive, Software","Software, Transportation",Aparc Systems is a leading supplier of integrated parking and enforcement solutions.,"Aparc Systems is a leading supplier of integrated parking and enforcement solutions. We improve the efficiency and profitability of parking operations by combining industry leading hardware with proprietary business management software to create innovative, real-time solutions. With hundreds of active installations, long-term partnerships with industry leading hardware manufacturers, and the industry’s first real-time, digital enforcement solution operating in some of North America’s largest cities, Aparc has a depth of experience second to none for maximizing revenue and parking operation efficiency.",,,http://twitter.com/AparcSystems,
APC Automotive Technologies,https://www.crunchbase.com/organization/apc-automotive-technologies,http://apcautotech.com/,Automotive,Transportation,APC Automotive Technologies is an automotive replacement parts supplier.,"AP Exhaust and Centric have come together to create APC Automotive Technologies, a world-class automotive aftermarket company providing a trusted, one-stop-shop solution for Technicians and Performance Enthusiasts.",,,,
Aperia Technologies,https://www.crunchbase.com/organization/aperia-technologies,http://aperiatech.com,"Automotive, Enterprise Software, Hardware, Mechanical Engineering","Hardware, Science and Engineering, Software, Transportation",Aperia Technologies provides automatic tire inflation devices that help improve the safety and efficiency of commercial vehicles.,"Aperia Technologies provides automatic tire inflation devices that help improve the safety and efficiency of commercial vehicles. It offers Halo Tire Inflator, a ring-shaped device that utilizes a wheel's rotational motion to pump air and maintain optimal tire pressure.  Aperia Technologies was incorporated in 2010 and is based in San Francisco, California.",http://www.linkedin.com/company/aperia-technologies,,http://twitter.com/aperiatech,http://www.facebook.com/Aperiatech
Apex.AI,https://www.crunchbase.com/organization/apex-ai,https://www.apex.ai/,"Artificial Intelligence, Automotive, Autonomous Vehicles, Operating Systems, Software, Transportation","Artificial Intelligence, Data and Analytics, Platforms, Science and Engineering, Software, Transportation",Apex.AI is building an operating system for autonomous vehicles.,Apex.AI is building an operating system for autonomous vehicles that never fails.,https://www.linkedin.com/company/apex-ai/,,https://twitter.com/ApexAI_Inc,
Aphrie,https://www.crunchbase.com/organization/aphrie,http://www.aphrie.com,"Automotive, Big Data, Hardware","Data and Analytics, Hardware, Transportation","Aphrie offers futuristic technology solutions for automotive industry that makes driving experience much better, and safer.",Aphrie provides futuristic technology solutions for automotive industry.,https://www.linkedin.com/company/aphrie,,https://twitter.com/aphrie_io,https://www.facebook.com/aphrie.io/
APL Logistics,https://www.crunchbase.com/organization/apl-logistics,http://www.apllogistics.com/,"Automotive, Logistics, Supply Chain Management",Transportation,"APL Logistics is a global supply chain specialist in the automotive, consumer, industrial and retail verticals.","APL Logistics offers supply chain engineering services to its clients. The company’s range of solutions include automotive, consumer, industrial, and retail. Its range of supply chain services consists of order management, import and export management, international hub management, freight management, and warehousing and distribution management. Its technology services include optimization, supply chain collaboration, transport management, and visual intelligence. APL Logistics is based in Florida.",https://www.linkedin.com/company/apl-logistics,,https://www.twitter.com/apllogistics,https://www.facebook.com/apllogistics
Aplands Auto Body,https://www.crunchbase.com/organization/aplands-auto-body,http://www.aplandsautobody.com,"Automotive, Manufacturing","Manufacturing, Transportation",Our Hassle Free National Limited Lifetime Warranty means that you can drive off with confidence.,"We’ve Got You Covered! Our Hassle Free National Limited Lifetime Warranty means that you can drive off with confidence, knowing the work we did on your vehicle was done to factory specifications, From state of the art frame equipment to ensure the safety of your vehicle to Factory matched paint colors in our climate-controlled downdraft spray & bake booth. Apland’s Auto Body guarantees that the workmanship of repairs to sheet metal, refinishing & stripping for as long as the vehicle remains under present ownership. The estimate will meet or exceed the generally accepted standard for proper repairs as recognized by the automobile repair business. This warranty only applies if the vehicle is driven under normal driving conditions, and not subject to misuse & or abuse. This warranty is our pledge to you, our customer. This written warranty is void if the repair work is altered, adjusted or tampered with by anybody other than Apland's Auto Body.",,,,https://www.facebook.com/AplandsAutoBody/
AplusB Software Corporation,https://www.crunchbase.com/organization/aplusb-software-corporation,http://www.aplusbsoftware.com/,"Automotive, Software","Software, Transportation",SimuRide Professional Driving Simulator Software Products helps beginners and commercial drivers,AplusB Software Corporation founded in 2003 is an e-learning software development company that specializes in driver’s education. Best known for the SimuRide series of innovative driving simulation programs.,,,https://www.twitter.com/simuride,
Apollo,https://www.crunchbase.com/organization/apollo-voice,http://www.okapollo.com,"Artificial Intelligence, Automotive, Autonomous Vehicles, Consumer Electronics","Artificial Intelligence, Consumer Electronics, Data and Analytics, Hardware, Science and Engineering, Software, Transportation",Apollo Voice is a voice assistant device built for any car.,"Apollo Voice is an independent AI voice assistant. Voice assistant performs as well as Google Assistant (due to collaboration), and better in certain domains. Currently working with the auto industry.",https://www.linkedin.com/company/apollo-voice/,,,
