Organization Name,Organization Name URL,Website,Industries,Industry Groups,Description,Full Description,LinkedIn,Hub Tags,Twitter,Facebook
034Motorsport,https://www.crunchbase.com/organization/034motorsport,https://store.034motorsport.com/,"Automotive, Manufacturing","Manufacturing, Transportation",034Motorsport is a leading manufacturer of high-quality performance upgrades and tuning for Audi and Volkswagen vehicles.,"034Motorsport was founded in 2005 with a passion for bringing motorsport-quality performance upgrades and tuning to Audi and Volkswagen vehicles. The company has since evolved and grown to meet the expanding needs of enthusiasts, but the underlying passion for innovation, performance, and quality remains. We are dedicated to providing our customers with only the best performance products, tuning, and service for their Audi or Volkswagen.",https://www.linkedin.com/company/034motorsport/,,https://twitter.com/034motorsport,https://www.facebook.com/034Motorsport/
"1 Stop Driver Improvement Clinic, LLC",https://www.crunchbase.com/organization/1-stop-driver-improvement-clinic-llc,http://www.1stopdic.com,"Automotive, Logistics, Transportation",Transportation,Stop Driver Improvement Clinic provides services in driving to it's customers.,"Accidents, reckless mistakes and traffic tickets will be things of the past when you enroll at the 1-Stop Clinic. We offer updated and comprehensive courses to help you improve behind the wheel.",https://www.linkedin.com/in/onestopdic,,,https://www.facebook.com/onestopdic
1-800 Radiator & A/C,https://www.crunchbase.com/organization/1-800-radiator-a-c,http://1800radiator.com,"Automotive, Logistics, Manufacturing","Manufacturing, Transportation",1-800 Radiator & A/C is an automotive company that provides and manufactures radiators.,"1-800 Radiator & A/C is an automotive company that provides and manufactures radiators. It offers radiators, car lights, bumpers, mirrors, crate engines, OEM rims/wheels, air conditioning parts, and rebuilt transmissions. The company also provides fuel pumps, under-car parts, and additional collision parts.",https://www.linkedin.com/company/1-800-radiator-and-ac/,,https://twitter.com/1800radiators,https://www.facebook.com/1800radiator/
12 Volt Travel,https://www.crunchbase.com/organization/12-volt-travel,http://www.12volt-travel.com,"Automotive, Travel","Transportation, Travel and Tourism",12Volt Accessories for Semi-Trucks & RV Motorhomes,"We provide high quality products for semi-trucks and RV motor-homes. 12Volt-Travel has a full support team available to our customers from 9am till 6pm eastern Mon - Sat.  12Volt-Travel carries 12V DC TV's that are digital ready, 12 volt refrigerator/freezers that draw very little 12V power, 12volt coffee makers and much more. Stop by today and see what we have for you!",,,http://twitter.com/12VoltTravel,https://www.facebook.com/travel12volt
121 Mobile,https://www.crunchbase.com/organization/121-mobile,http://my121mobile.com,"Automotive, Database, Digital Marketing, Direct Marketing, Mobile Advertising, SaaS, Social Media Marketing","Advertising, Data and Analytics, Sales and Marketing, Software, Transportation",Mobilizing Marketing Across All Media Measuring & Tracking Users from Online Marketing to Physical Store Location Providing true ROI insight,"1-2-1 Mobile uniquely solves one of the key challenges that marketers face today – measuring and tracking a conversion that starts with online marketing and ends in a physical store location. It provides a granular true ROI insight, tracking customer’s unique ID from banner’s clicks, to promotions’ download, all the way to redemption at the shop. It provides a crystal-clear transparency of sourced traffic by identifying each customer’s true ID and source, at a time when more than 52% of online traffic is BOT based and ad fraudulent activity is widespread and causing billions of dollars in losses, particularly in paid traffic advertising. 1-2-1 Mobile is a cloud based platform that mobilizes marketing across any media form. The platform uniquely closes the marketing loop by mobilizing each ad campaign's ""call to action"" across any media. It constantly monitors all mobile, online and offline customers' engagements, and thus enables unique pairing of online KPIs with physical customer response at the point-of-sale. Moreover, throughout the entire customers' engagement cycle, it is automatically capturing and building a database of the engaged customers' mobile numbers, all of which can be integrated into any customer’s existing POS or CRM systems.  1-2-1 Mobile has partnered with top-tier automotive groups, is a CDK Global Partner and has deployed its solution with great success at hundreds of automotive dealerships and retailers nationwide. It delivers an unparalleled performance and ROI, consistently outperforming all other marketing channels and has become best in class marketing mobilization solution. ",https://www.linkedin.com/company/121-mobile-inc-,,,
1st Choice Auto Sales,https://www.crunchbase.com/organization/1st-choice-auto-sales,http://1stchoiceautosalesjoliet.com,Automotive,Transportation,"Used Cars in Joliet, IL","Address: 201 N Center St, Joliet, IL 60435, USA",,,,https://www.facebook.com/1stchoiceautosalesjoliet/
20/20 Auto Glass Spartanburg,https://www.crunchbase.com/organization/20-20-auto-glass-greenville,http://www.2020glass.com/spartanburg-sc/,Automotive,Transportation,"Auto glass shop, auto repair shop","Mobile and in-shop windshield repair & replacement and auto glass service in Spartanburg, SC. Auto glass repair and auto glass replacement are our specialty. Our attentive technicians and Unbelievable Guarantee will set your mind at ease. OEM brand windshields and auto glass. BBB.org accredited with an A+ rating. Address:  251B S. Pine St.  Spartanburg, SC 29302",,,https://www.twitter.com/20_20autoglass,https://www.facebook.com/2020autoglass
24 Hr Towing,https://www.crunchbase.com/organization/24-hr-towing,http://www.24-hr-towing.com/index.php,"Automotive, Logistics, Transportation",Transportation,Towing Service,"USA Service Leads LLC. dba. 24 Hr Towing is a referral service offering assistance for Towing, Roadside Service, Jumpstarts, Flat Tire Change and Long Distance Towing. 24 Hour Towing has many affiliations with flatbed trucking companies in your local area, so we will show up in 15 minutes to an hour or less in most cases.",,,,
2WheelPros,https://www.crunchbase.com/organization/2wheelpros,http://www.2wheelpros.com,"Automotive, E-Commerce","Commerce and Shopping, Transportation",Motorcycle Parts and Accessories,2WheelPros is the best place to find motorcycle parts and accessories. Our online motorcycle parts finder makes it easy for you to find all the parts that fit your motorcycle in three easy steps. Visit us at www.2WheelPros.com.,,,https://www.twitter.com/2wheelpros1,http://www.facebook.com/2WheelPros
3 Kings Automotive,https://www.crunchbase.com/organization/3-kings-automotive,http://3kingsautomotive.com,Automotive,Transportation,"Auto Repair in Sierra Vista, AZ","Address: 1501 E Fry Blvd, Sierra Vista, AZ 85635, USA",,,,
3-Dimensional Services Group,https://www.crunchbase.com/organization/3-dimensional-services-group,http://3dimensional.com,"3D Printing, Automotive, Manufacturing","Manufacturing, Transportation","3-Dimensional Services Group is a design and build prototypes with manufacturing intent in mind, and we do it faster than you can imagine.","The 3-Dimensional Services Group, consisting of 3-Dimensional Services, 3-Dimensional Services Europe, Urgent Plastic Services and Urgent Design & Manufacturing, provides rapid manufacturing services that allow them to design, engineer and build functional prototype parts and low-to-medium volume production parts up to 70% faster than industry standards. Their capabilities include virtually all manufacturing processes, including: CNC machining, stamping, laser cutting and welding, plastic injection molding, robotic and spot welding, waterjet, hydroforming, tube bending, vibration welding, casting and pattern fabrication, RIM tooling, SLA, and SLS rapid prototyping, to name some.",https://www.linkedin.com/company-beta/1179727/,,https://twitter.com/3DMServices,https://www.facebook.com/3-Dimensional-Services-Group-1596997707233015/
"360Converge, Inc",https://www.crunchbase.com/organization/360converge-inc,http://www.360converge.com,"Automotive, Information Technology, Mobile Apps, SaaS, Software","Apps, Information Technology, Mobile, Software, Transportation",360Converge is a next generation SaaS communication platform for the automotive industry.,"360Converge is a dealership communication platform designed to deliver workflow automation through machine learning, relationship intelligence and data analytics.",https://www.linkedin.com/company/360converge/?viewAsMember=true,,https://www.twitter.com/360converge,https://www.facebook.com/360converge
3A Auto Repair,https://www.crunchbase.com/organization/3a-automotive-repair,http://www.3aautorepair.com/,Automotive,Transportation,3A Automotive Service is a provider of auto repair facility with a team of knowledgeable service advisors and certified technicians.,"3A Automotive Service is a family owned auto repair service in Phoenix Arizona. Founded in 1975, 3A Automotive provides top quality repairs for cars, trucks, diesels, trailers and RVs. They also have a 24 hour towing service.  The types of services include general repairs, such as: engine replacement; transmission replacement; electrical diagnostics and repairs; heating and cooling services; engine repair; brake jobs; tune-ups and a large range of other services.  3A was founded by Jim and Earlene Alauria, with the purpose of helping individuals and fleets find an honest and reputable repair shop. The shop's service areas include: Phoenix, Glendale, Scottsdale, Tempe, and Chandler.",,,http://twitter.com/3aauto,https://www.facebook.com/3aautorepairphoenix
3Discovered,https://www.crunchbase.com/organization/3discovered,http://www.3discovered.com/,"3D Printing, Automotive, Commercial","Manufacturing, Other, Transportation",3Discovered is a commercial-grade market exchange platform for 3D printable designs currently under development.,"3Discovered is a commercial-grade market exchange platform for 3D printable designs currently under development. It is a start-up venture between Liberty Investment Ventures and Ocean Tomo, and incorporates rights management, design authentication, automated price quote algorithms, and robust search and transaction functionality. 3Discovered's platform connects (i) design owners, (ii) customers, and (iii) 3D printing service bureaus, thereby accelerating the commercial adoption of 3 dimensional printing for consumers and commercial customers.",http://www.linkedin.com/company/3discovered,,https://www.twitter.com/3discovered,https://www.facebook.com/3discovered1
3Gtms,https://www.crunchbase.com/organization/3gtms,http://www.3gtms.com,"Automotive, Logistics, Software","Software, Transportation","3GTMS develops software that simplifies complex transportation management for shippers, brokers and 3PLs.","3GTMS develops software that simplifies complex transportation management for shippers, brokers, and 3PLs. They have created a scalable TMS suite that manages the full transportation lifecycle from the rating, routing (including multi-stop and pool distribution optimization), tendering, tracking, tracing, and settlement in a single system.",https://www.linkedin.com/company/3gtms/,,https://twitter.com/3gtms,https://www.facebook.com/pg/3Gtms
3IS,https://www.crunchbase.com/organization/3is,http://www.3isinc.com/,"Automotive, Consumer Electronics, Electronics","Consumer Electronics, Hardware, Transportation",The 3IS navigation structure is configured specifically for the automotive electronics industry.,"The 3IS navigation structure is configured specifically for the automotive electronics industry. Linked to the navigation are a multitude of public and private domain industry specific databases. This combination produces the most accurate, comprehensive and relevant search results for technical or commercial data in the global automotive electronics industry.",https://www.linkedin.com/company/3is-inc/,,,
3M,https://www.crunchbase.com/organization/3m,https://www.3m.com,"Automotive, Electronics, Enterprise Software, Manufacturing","Consumer Electronics, Hardware, Manufacturing, Software, Transportation","3M operates as a diversified technology company, manufacturing more than 55,000 products, including adhesives, laminates, and many more.","3M operates as a diversified technology company, manufacturing more than 55,000 products, including adhesives, abrasives, laminates, passive fire protection, dental and orthodontic products, electronic materials, medical products, car-care products, electronic circuits, and optical films. The company operates in the industrial and transportation; health care; safety, security and protection services; consumer and office; display and graphics; and electro and communications businesses. Its industrial and transportation business serves a range of markets, such as appliance, paper and packaging, food and beverage, electronics, automotive original equipment manufacturer, and automotive aftermarket. 3M has operations in more than 65 countries that include 29 international companies with manufacturing operations and 35 companies with laboratories. Its products are available for purchase through distributors and retailers in more than 200 countries, and online directly from the company. 3M was founded in 1902 by [Joshua Jones](https://www.crunchbase.com/person/joshua-jones) and is headquartered in Saint Paul, M.N.",http://www.linkedin.com/company/3m,,https://twitter.com/3M,http://www.facebook.com/3M
4AutoInsuranceQuote,https://www.crunchbase.com/organization/4autoinsurancequote,http://www.4autoinsurancequote.com,"Auto Insurance, Automotive, Insurance","Financial Services, Transportation",Compare auto insurance quotes from multiple companies to find the cheapest option for you and your family.,"Compare auto insurance quotes from multiple companies to find the cheapest option for you and your family.  340 E 29th St #14C New York, NY 10016 (401) 580-727",http://www.linkedin.com/company/4autoinsurancequote-com,,http://twitter.com/4insurenet,http://www.facebook.com/4autoinsurancequote
4Home,https://www.crunchbase.com/organization/4home,http://www.4home.com,"Automotive, Clean Energy, Cloud Computing, Internet, Software, Wireless","Energy, Hardware, Internet Services, Mobile, Software, Sustainability, Transportation",4Home offers an XML-based software and services platform that enables OEMs to deliver applications and services to the connected home.,"4Home has developed an XML-based software and services platform that OEM hardware vendors and service providers can use to deliver compelling applications and services into the connected home. 4Home's suite of solutions allows users to automate almost any application they want: remotely monitor their homes, get Web-based content on the TV, control home systems from their mobile phones, control all home devices and digital media in one unified user-interface, and track their home energy usage down to the device level.  The company feels that ""home control services"" are the next suite of services to be offered by major broadband providers (after the trifecta of voice, video, and data), and consists of home monitoring, media & entertainment management, home health, and energy management. 4Home received five CES 2008 Innovation awards.",,,,
4Knines,https://www.crunchbase.com/organization/4knines,http://4knines.com/,"Automotive, E-Commerce, Internet","Commerce and Shopping, Internet Services, Transportation","4Knines makes premium, heavy duty seat covers for your pets that make traveling with your best friend easier.","4Knines® offers 36 items that are backed with a 100% satisfaction guarantee. They are currently available via their website, www.4knines.com. HCP is already developing plans to expand the line into the commercial automobile market, specialty pet stores and popular online e-tailers.",,,https://www.twitter.com/4knines,https://www.facebook.com/4kninesProducts
4WheelOnline,https://www.crunchbase.com/organization/4wheelonline,http://4wheelonline.com,"Automotive, Consumer, E-Commerce, Hardware","Commerce and Shopping, Hardware, Other, Transportation",4 Wheel Online offers the best truck accessories for all of your off-road needs with the lowest prices and free shipping.,"4WheelOnline offers a wide array of aftermarket Truck and Jeep Accessories as well as ATV and Motorcycle Accessories. Whether you're looking to enhance torque, add personal style, or just increase the overall functionality of your ride, 4WheelOnline has just the product you need.",http://www.linkedin.com/company/3346794,,http://twitter.com/4WheelOnline,http://www.facebook.com/4wheelonline
4x4 Group Buy,https://www.crunchbase.com/organization/4x4-group-buy,http://4x4groupbuy.com,"Automotive, E-Commerce, Logistics","Commerce and Shopping, Transportation",An Automotive & Tyre Company.,4x4 Group Buy are a discounted 4wd parts and accessories business. By purchasing items in quantities they are able to pass along substantial discounts to the consumer. With them there is no waiting to get a group together to receive your savings.,https://www.linkedin.com/company/4x4-groupbuy-com/,,https://twitter.com/4x4groupbuy,https://www.facebook.com/4x4groupbuy/
5 Guys Transportation,https://www.crunchbase.com/organization/5-guys-transportation,http://5gtkc.com/,Automotive,Transportation,Kansas City Airport Shuttle Service and Taxi Cab Company,5 Guys Transportation is a proudly local and licensed Kansas City airport shuttle service and taxi cab company. Point-to-point private car services are also available to anywhere in the KC metro.,,,,https://www.facebook.com/FiveGuysTransportation
5 Horizons Group,https://www.crunchbase.com/organization/5-horizons-group,http://www.5horizonsgroup.com,"Automotive, Consulting, Information Technology, Legal, Manufacturing","Information Technology, Manufacturing, Professional Services, Transportation",5 Horizons Group provides solutions and technology that enable consumer product companies to achieve their global strategies.,"5 Horizons Group provides solutions and technology that enable consumer product companies to achieve their global strategies. 5 Horizons' suite of services covers global sourcing, product design and development, manufacturing, quality assurance, supply chain logistics and market entry. 5 Horizons also works with organizations to optimize their international operations, combining innovative thinking and domain expertise to create a strategic roadmap that covers the organizational, legal, financial, procedural and personnel considerations.",http://www.linkedin.com/company/206084,,,http://www.facebook.com/pages/5-Horizons-Group/133078686759507
5by2,https://www.crunchbase.com/organization/5by2,http://www.5by2parking.com/,"Automotive, Parking, Real Estate","Real Estate, Transportation",5BY2 is an independent supplier of automated parking garages.,"5BY2 is an independent supplier of automated parking garages.  It was originally establised in the late 1980s as a department of EWW Technische Bedrijven, where the first fully automated garage was delivered in 1992. This garage is still operational.  5BY2 was incorporated into a seperate legal entity in 2003. In January 2013, 5BY2 was sold to its management in a management buy out as the strategic direction of 5BY2 with international ambitions did not match with those of Protechnum, its former parent. 5BY2 has built 30 garages with its technology and is with such number of installations the leading supplier of automated garages in the Netherlands. Its recent ambition is to expand internationally with focus on Europe, Middle East and North America. 5BY2 wants to capitalise on its strong position in the Netherlands and utilise the expertise gained to provide similar high quality automated parking systems. Through its own maintenance team, it can provide excellent end-to-end services, and with that extremely high availability for the end users.  An area that is often forgotten during the purchase. The investment into an automated parking garage, is a purchase for 20+ years.",https://www.linkedin.com/company/5by2,,https://twitter.com/5by2,
777 Exotic Car Rental,https://www.crunchbase.com/organization/777-exotic-car-rental,http://777exotics.com,"Automotive, Car Sharing, E-Commerce, Transportation, Travel","Commerce and Shopping, Transportation, Travel and Tourism",Exotic Car Rental Company In Los Angeles California,"Los Angeles preferred exotic car rental company located at 2900 South Robertson Blvd. Los Angeles CA 90034.  Take a look at the luxury car models from Lamborghini, Ferrari, Rolls Royce and more.  Access new cars for daily, weekly and monthly rental.  Drive from Los Angeles to Las Vegas and tour California in a Classic Car Rental from 777exotics.com",https://www.linkedin.com/company/777-exotic-car-rental,,https://twitter.com/777exotics,https://www.facebook.com/losangelescarrental/
A & A Auto Recycling,https://www.crunchbase.com/organization/a-a-auto-recycling,http://aaautorecycling.com,Automotive,Transportation,"Used Auto Parts Store in Bradenton, FL","Address: 5507 9th St E, Bradenton, FL 34203, USA",,,,
A 1 COLLISION NY & AUTO CARE,https://www.crunchbase.com/organization/a-1-collision-ny-auto-care,https://www.a1collisionny.com/,Automotive,Transportation,"A 1 Collision NY & Auto Care is located in Manhattan, New York, and is an auto repair company. A 1 Collision NY.","A 1 Collision NY & Auto Care is located in Manhattan, New York, and is an auto repair company. A 1 Collision NY & Auto Care provides Car Painting, Auto Repair, Auto Body Work, and Repair Service in Manhattan NY (NYC). A 1 Collision NY & Auto Care offers auto repair services to Manhattan, Queens, Brooklyn, Bronx, and Staten Island. Regardless of any issues you are facing, A1 is available to help you in your time of need by sending one of our trained technicians to assist you twenty four seven. Since 1972, A 1 Collision NY served all auto body and auto repair needs of New York City from our auto body shop in Hell's Kitchen which is located at 528 West 39th Street in New York, NY. We provide thorough collision repairs, general auto repairs, and auto painting services to customers from all around New York City. This includes: Manhattan, Queens, and all surrounding metro areas.",,,https://www.twitter.com/a1collisionnyc,https://www.facebook.com/a1collisionny
A Cheap Body Shop,https://www.crunchbase.com/organization/a-cheap-body-shop,http://www.acheapbodyshop.com,"Automotive, Insurance","Financial Services, Transportation","auto body repair, auto body shop","We Do Not Do Insurance Quotes, but call me with yours and I'll BEAT it by a lot!",,,https://www.twitter.com/acheapbodysh,https://www.facebook.com/a-cheap-body-shop-341403649398757
A#1 Air,https://www.crunchbase.com/organization/a-1-air,http://www.rightdayornight.com,"Automotive, Computer, Consumer Electronics, Electronics, Logistics, Real Estate","Consumer Electronics, Hardware, Real Estate, Transportation","A#1 Air is a provider of air conditioning, plumbing, and electrical services.","A#1 Air is an air conditioning and heating company located in Lewisville, Texas and services the entire DFW Metroplex. They are a family owned and operated business and are located at 601 E Corporate Dr, Lewisville, TX 75057.",http://www.linkedin.com/company/a-1-air,,http://twitter.com/anumber1air,http://www.facebook.com/anumber1air
A&P Auto Parts,https://www.crunchbase.com/organization/a-p-auto-parts,http://www.apautoparts.com/,"Automotive, Logistics",Transportation,A seller of quality used car parts,"A&P Auto Parts is a distributor of high quality used car parts. It was created by Bill and Cathy Abold as a way to greenify the car industry by offering recycled parts. Today, the company continues to adhere to environmentally friendly ways by offering customers cash for their used parts as well as vehicles. Customers can search its wide selection of used parts on the company's website.",,,,https://www.facebook.com/apautopartsinc
A&R Auto Parts,https://www.crunchbase.com/organization/a-r-auto-parts,,"Automotive, Manufacturing","Manufacturing, Transportation",A&R Auto Parts is a privately held company that operates a recycled OEM automotive replacement parts facility.,"A&R Auto Parts is a manufacturer and supplier of an automotive parts and accessories. Located between Spartanburg and Greenville on forty acres of land near Duncan, South Carolina, A&R will service the greater Spartanburg and Greenville markets and provide a strategic link within LKQ's network of recycled parts facilities.",,,,
A-1 Auto Transport,https://www.crunchbase.com/organization/a-1-auto-transport,https://www.a1autotransport.com/,"Automotive, E-Commerce, Logistics","Commerce and Shopping, Transportation",A-1 Auto Transport are door to door car carriers & movers.,"Shipping your vehicle has never been easier. With a network of 40 terminals and 30 modern carriers, you can get your vehicle where it needs to be -- quickly and safely. We’re available for car shipping Sales and Customer Service (vehicle shipment tracking, etc.) via phone at: 800.452.2880",https://www.linkedin.com/company/a-1-auto-transport,,http://twitter.com/a1autotransport,http://www.facebook.com/a1autotransport
A-1 Automatic Transmission Service,https://www.crunchbase.com/organization/a-1-automatic-transmission-service,http://a-1autotransmission.com,Automotive,Transportation,"Engine Repair in Boston, MA","Address: 914 Huntington Ave, Boston, MA 02115, USA",,,,
