Organization Name,Organization Name URL,Website,Industries,Industry Groups,Description,Full Description,LinkedIn,Hub Tags,Twitter,Facebook
AutosnapLive,https://www.crunchbase.com/organization/autosnaplive,https://www.autosnaplive.com/,"Automotive, Big Data, E-Commerce","Commerce and Shopping, Data and Analytics, Transportation",AutosnapLive is a Provider of an online marketing services.,"AutosnapLive is dedicated to dealers. They pride theirselves on creating effortless solutions that help you sell more cars, without taking your time and attention away from your business.  Your customers deserve an easy online shopping experience that allows them to view your inventory on whatever platform they prefer. At Autosnap, we focus on you, so you can focus on growing your business.",https://www.linkedin.com/company/autosnaplive/,,https://twitter.com/AutosnapLive,https://sv-se.facebook.com/AutosnapLive/
Autosoft Online,https://www.crunchbase.com/organization/autosoft-online,http://www.autosoftonline.com,"Automotive, Insurance, Security, Software","Financial Services, Privacy and Security, Software, Transportation",AutoSoft Online is a new shop management software specifically designed for the administration of auto repair shops.,AutoSoft Online is a new Shop Management Software specifically designed for the administration of Auto Repair Shops. This System is currently submitted to a constant process of revision and update in order to comply with the market’s needs. Autosoft Online strives to incorporate the best practices and newest technologies into its program so they can make available the required functionality for you to control and administer your business in the most effective way possible.,,,,
AutoSource Motors,https://www.crunchbase.com/organization/autosource-motors,https://www.myautosource.com/,"Automotive, Autonomous Vehicles, Retail","Commerce and Shopping, Transportation",AutoSource Motors deals with the selling of used branded title vehicles to smart buyers.,AutoSource has a passion for selling used vehicles to smart buyers.  We have the best prices in America.  AutoSource vehicles have Histories! That's why we picked them.  We specialize in sourcing our vehicles differently than traditional dealerships. We use a network of expert re-builders across the country who are make and model specific.  We hand pick only the best used vehicles with histories and inspect them through our 151 point inspection.  All vehicles pass and exceed our stringent quality and safety standards,https://www.linkedin.com/company/autosource-motors/,,,https://www.facebook.com/autosourcehq/
Autospies,https://www.crunchbase.com/organization/autospies,http://autospies.com/,"Automotive, E-Commerce, Lifestyle, Social Network","Commerce and Shopping, Community and Lifestyle, Internet Services, Transportation",AutoSpies.com is the insider’s social network to the world’s finest automobiles and luxury lifestyle.,"AutoSpies.com is an insider's guide to the world's automobiles and luxury lifestyle. The website features automotive news, dealer reviews, free classifieds, and images. AutoSpies.com was founded by Greg Flores.",http://www.linkedin.com/company/autospies,,http://twitter.com/autospies,http://www.facebook.com/pages/Auto-Spies/12497989215
Autospix,https://www.crunchbase.com/organization/autospix,https://autospix.com,"Automotive, Autonomous Vehicles, Content, Information Technology","Information Technology, Media and Entertainment, Transportation",Autospix (autospix.com) is an online automotive news and magazine in the United States.,"Autospix (autospix.com) is an online automotive news and magazine in the United States. We provide the latest information from the automotive world which contains the latest news, the most recent rumors, the concept car that will be released in the future, providing vehicle specifications for comparison and much more automotive news on this website. Autospix is ​​an independent media and not affiliate media.",https://www.linkedin.com/company/autospix,,https://twitter.com/autospix,https://www.facebook.com/autospix
Autosport Labs,https://www.crunchbase.com/organization/autosport-labs,http://autosportlabs.net/Main_Page,"Association, Automotive, Software","Other, Software, Transportation",Open Source Technology for Race and Street.,"Autosport Labs is dedicated to develop innovative, flexible and cost effective automotive performance systems and components. We present them to the enthusiast community as 'Experimental', and involve many with testing and feedback. Each project eventually ends up as a flexible and capable piece of automotive technology. Typically the design, stability and reliability of various projects developed by Autosport Labs improves over time as they mature, passing through Inception, Design, Prototype, Internal Testing, Field Beta-Testing and finally made available to the general enthusiast community. Regardless of the maturity of the project, there will always be occasions where flaws are discovered- sometimes by the Autosport Labs community of users; other times by the Autosport Labs R&D staff. The ""open"" nature of these projects allows for these flaws to be identified, evaluated and potentially rectified in an efficient and effective way.",https://www.linkedin.com/company/autosport-labs,,https://twitter.com/AutosportLabs,https://www.facebook.com/AutosportLabs
AutoSport USA,https://www.crunchbase.com/organization/autosport-usa,https://autosport-usa.com/,Automotive,Transportation,AutoSport USA is an authorized Morgan motorcar distributor in the United States.,AutoSport USA is an authorized Morgan motorcar distributor in the United States.,,,,
AutoStream,https://www.crunchbase.com/organization/autostream,http://fastlanedaily.com,"Automotive, Racing, Video, Video Streaming","Content and Publishing, Media and Entertainment, Sports, Transportation, Video",Premium Internet Automotive Programming,"AutoStream is a TV network for the web, which licenses, creates and produces its own original entertainment and content across mobile, UGC video sharing sites, premium content marketplaces and broadcast television. AutoStream Programing can be found on SPEED Channel, iTunes Music Store, Tivo and video sharing sites across the Internet.  Sponsors are given product placement inside AutoStream Shows and across the network.",,,http://twitter.com/autostream,http://www.facebook.com/fastlanedaily
AutoStride,https://www.crunchbase.com/organization/autostride,http://autostride.com,"Automotive, Internet, Marketplace","Commerce and Shopping, Internet Services, Transportation",The first Smart TV automotive marketplace.,"AutoStride is the first of its kind, enabling auto dealers to push their vehicle inventory feeds to our Smart TV channel. End users submit their credentials (w/ one click of a button) and its passed directly to an automotive CRM (database), which provides dealers and their BDCs with quality, unique car buyer leads.",,,https://www.twitter.com/autostride,https://www.facebook.com/autostride
Autotalky,https://www.crunchbase.com/organization/autotalky,http://autotalky.com/,Automotive,Transportation,Autotalky - For a More Social Car,"In 2008 when gasoline hit a high of $4 per gallon,  programmers under ABRS Tech took the initiative to innovate ways in looking for ways for ways to increase MPG for their commute cars to dampen  the cost of travelling from home to work. Bern Mutia, with the help of Rama Bollu and Avery Keyes created the GreenFuelBooster, a Platinum-anode-based electrolysis device to generate hydrogen from water and improve fuel burn. As the project required engine data monitoring, a Java application was developed to monitor OBD2 parameters affecting fuel burn. Presently, this application has been developed to a full web-enabled platform to do predictive trend diagnostics in cars. It has opened the possibility of cars as social entities by allowing it to communicate back to their vehicle owners and their Trusted Mechanics. The car’s engine data is its digital signature. This vision has come true with the help of bluetooth-enabled OBD2 plugins and data loggers in smartphones. Cars can now be better understood which only a few years ago was only within the realm of auto mechanics. Their platform hopes to help the ordinary consumer to save money by prolonging the lifetime of cars and hopefully encourage them to be responsible stewards of the environment. With the quantification of self, the use of fuel in transportation, they hope their platform can help the community, families and individuals plan and build for a better future.",,,,
AutoTraker,https://www.crunchbase.com/organization/autotraker,http://www.autotraker.com,"Automotive, Industrial, Point of Sale, Software","Commerce and Shopping, Manufacturing, Software, Transportation",AutoTraker Inc. specializes in windows point of sale solutions for the automotive repair industry.,"AutoTraker Inc. specializes in Windows point of sale solutions for the automotive repair industry. On this web site you will find information on their products. Customized solutions are also available by contacting their programming department.  They have products and solutions suitable for all sizes of automotive repair facilities, from small one bay garages to large multi-location or franchise locations.  Their sales department can help in finding the right combination of point of sale and information software, hardware, and peripherals for your automotive repair facility.",,,,
Autotropolis,https://www.crunchbase.com/organization/autotropolis,http://www.autotropolis.com/,"Automotive, Customer Service","Other, Professional Services, Transportation","Autotropolis offers solutions to search for new and used cars, hybrids, sedans, SUVs, and trucks.","Autotropolis.com has experience in the auto industry for over 20 years. Founded by retired car salesmen, they understand the in's and out's of the car buying process and have started this web site so that you, the consumer, can be educated on the automobile you are looking to buy, in addition to connecting you with the dealerships who strive to be the most competitive and customer service oriented in the industry.",,,,
AutoUnite,https://www.crunchbase.com/organization/autounite,https://autounite.com,Automotive,Transportation,AutoUnite is a vehicle research website which gives people a platform to share prices and other auto related experiences.,"Welcome to AutoUnite which is a vehicle research platform that has been created to empower you, the customers, with the correct and up to date prices and information on new and used vehicles, provided to us by people just like you. Due to our automotive industry background, we understand the frustrations and hardships you guys have to go through each time you set out to search for reliable and useful auto-related information. We realized that there is a lot of biased and misinformation which puts auto customers at a disadvantage, we also know that many of the popular automotive information websites provide dealerships controlled pricing, which usually benefits the dealers and not the buyers. AutoUnite changes all of this by facilitating customer to customer exchange of auto-related information to empower new and used car buyers to make well-informed purchasing decisions. Here, on AutoUnite you will be able to search out information about your desired vehicle within seconds, we have designed the platform to be easier to use and quicker than all other vehicle information research methods out there. We want you to save the needless hours of research time, so you can spend more time enjoying your new ride. Use the exclusive AutoUnite automotive information search tool to find about ""Out the Door Prices"", Lease Payments, F&I, Service, Parts & Accessories and actual reviews of vehicles by customers not paid authors.  The AutoUnite website and its concept are the products of Kenny Smith and Jino Song, who have a combined experience in the automotive industry for over 25 years. They currently manage one of the premier top 100 dealerships in the country, therefore are well-versed with the ins and outs of this particular industry. They founded AutoUnite in the year 2015 and wanted the platform to combine their own knowledge of the industry, social media, forums, blogs and an auto research center all into one site. Their vision for this platform was to give people the power to share prices and information on new vehicles to help others. Our mission is to provide the public with a platform where they can share their personal auto related experience to help other buyers make an informed purchase decision We invite you to take a look at our streamlined website, feel free to share your experiences and information with us and our readers. www.facebook.com/autounite Like us on Facebook www.twitter.com/autounite Follow us on Twitter  www.linkedin.com/organization/auto-unite Follow us on LinkedIn https://www.linkedin.com/pulse/answer-best-price-out-door-kenneth-smith Email us if you have any questions at info@autounite.com",https://www.linkedin.com/company/auto-unite,,https://www.twitter.com/autounite,https://www.facebook.com/autounite
AutoVino,https://www.crunchbase.com/organization/autovino-menlo-park-california,http://auto-vino.com/,"Automotive, Collectibles, Collection Agency, Leisure, Wine And Spirits","Administrative Services, Commerce and Shopping, Community and Lifestyle, Food and Beverage, Transportation","AutoVino collects rare, expensive, and vintage cars as well as wine.","AutoVino collects rare, expensive, and vintage cars as well as wine. Buff Giurlani founded it in 2006, with its headquarters in Menlo Park in California.",https://www.linkedin.com/company/autovino/,,https://twitter.com/auto_vino,https://www.facebook.com/Auto-Vino-337773788039/
AutoVitals,https://www.crunchbase.com/organization/autovitals,https://www.autovitals.com,"Automotive, Information Technology, Software","Information Technology, Software, Transportation","Automotive repair shop management software to help shop owners grow ARO, improve shop efficiency, and unleash their team's full potential.","The AutoVitals’ team is obsessed with enabling shop clients to achieve results never before possible with traditional paper-based methods.   The Digital Shop® Advantage delivers the most innovative and impactful products, a commitment to developing and instilling industry best practices in everything we do, and the automotive industry’s most thriving and collaborative online community.",https://www.linkedin.com/company/autovitals/,,https://www.twitter.com/autovitals,https://www.facebook.com/autovitalsupdate
Autoware,https://www.crunchbase.com/organization/autoware,http://auto-ware.com/,"Automotive, Software, Training","Education, Software, Transportation","Autoware is an automotive performance company and cover everything from computer software, to data acquisition, to online technical classes.",They are an automotive performance company and cover everything from computer software to data acquisition to online techinal classes and onsite race engineering,https://www.linkedin.com/company/autoware-technologies,,https://twitter.com/AutowareInc,https://www.facebook.com/Autoware-Inc-aka-Auto-Ware-103499111335/
AutoWeb,https://www.crunchbase.com/organization/autobytel-com-inc,http://www.autoweb.com,"Advertising, Automotive, Enterprise Software, Marketing","Advertising, Sales and Marketing, Software, Transportation",AutoWeb is a digital marketing company for the automotive industry.,"AutoWeb operates as an automotive marketing services company that helps automotive retail dealers and manufacturers that sell new and used vehicles through its Internet lead referral and online advertising programs. The company's lead programs include new vehicle lead program that allows consumers to submit requests for pricing and availability of specific makes and models, used vehicle lead program, which allows consumers to search for used vehicles according to specific search parameters, such as the price, make, model, mileage, year, and location of the vehicle; and finance lead program designed to provide consumers opportunity to obtain vehicle financing and other services.  Its consumer-facing automotive Web sites, which include Autobytel.com, Autoweb.com, AutoSite.com, Car.com, CarSmart.com, CarTV.com, and MyRide.com, provide consumers the information and tools to aid them in their automotive purchase decisions, and the opportunity to submit lead requests. The company was formerly known as autobytel.com Inc. AutoWeb was founded in 1995 and is headquartered in Irvine, California.",http://www.linkedin.com/company/autoweb-com,,https://twitter.com/theautoweb,http://www.facebook.com/autowebcom
"AutoWiser, LLC",https://www.crunchbase.com/organization/autowiser-llc-2,http://www.autowiser.net,"Automotive, Consulting, Lead Generation","Professional Services, Sales and Marketing, Transportation","The app fills a void in the services provided by the top 8 auto information companies by providing critical monthly ""cost of ownership .","The app fills a void in the services provided by the top 8 auto information companies by providing critical monthly """"cost of ownership""""  information for repairs, maintenance and fuel, about your car and comparing it to a new car looking into the future for 3 years.  The service allows the consumer to make smarter choices in vehicle buying for a new or used car.  Using this same technology and putting it into the hands of an auto dealer creates a paradigm shift in the industry changing the way they do business and making the customer interaction more meaningful and pleasant.",,,,
Autoz World,https://www.crunchbase.com/organization/autoz-world,https://www.autozworld.com,"Automotive, Transportation",Transportation,"International Auto Trading, Exporting, Importing and News Platform.","AutoZworld is an international auto trading platform for new, used car dealers, exporters and importers to list their new, used, luxury cars or heavy machinery for more exposure and become certified dealers to get more inquiries and sales. AutoZworld also offer agency services to source any car or machinery from any part of the world.",,,,https://www.facebook.com/AutoZworld/
AutoZone,https://www.crunchbase.com/organization/autozone,http://www.autozone.com/,"Automotive, E-Commerce, Retail, Sales","Commerce and Shopping, Sales and Marketing, Transportation",AutoZone retails and distributes automotive replacement parts and accessories.,"AutoZone is the nation's leading retailer and a leading distributor of automotive replacement parts and accessories with more than 6,000 stores in the US, Mexico, Brazil and Puerto Rico. Each store carries an extensive line for cars, sport utility vehicles, vans and light trucks, including new and remanufactured hard parts, maintenance items and accessories.  AutoZone, headquartered in Memphis, TN, is a growing Fortune 300 company with a deep commitment to serving our customers, communities and fellow AutoZoners. We have vast opportunities in our stores, distribution centers, field offices, specialty business units and Store Support Center and embrace diverse experiences, backgrounds, knowledge and ideas to strengthen our teams and business. Our team is connected by a deep commitment to our Pledge and Values, principles established more than thirty years ago that reinforce our priorities and team culture. In addition, we constantly innovate and aspire to best serve our customers, creating new and better tools, training and outreach to serve both DIY and the professional installer customers. From in-store tools to E-Commerce, training and development to recognition, our team has the tools to help you grow your career at AutoZone. See where your drive will take you!",https://www.linkedin.com/company/autozone/,,http://twitter.com/autozone,http://www.facebook.com/autozone/
AutoZone West,https://www.crunchbase.com/organization/autozone-west,,"Automotive, Retail","Commerce and Shopping, Transportation",AutoZone West operates a chain of auto parts and accessories.,AutoZone West operates a chain of auto parts and accessories.,,,,
AUTRA,https://www.crunchbase.com/organization/autra,,"Automotive, Finance, Financial Services, FinTech, Sales","Financial Services, Sales and Marketing, Transportation",Innovating consumer auto finance and sales.,"AUTRA is an entirely-mobile platform (save for back-end management) that pairs new auto buyers with newer-school lender(s), auto brokers, and their proprietary new vehicle inventory management system. The vehicle is financed and ""signed-for"" entirely via their app, and then a partner-broker delivers the new vehicle within 48 hours.  AUTRA has partnered with brokers and fintech associates to create a seamless purchase and lending experience with a select set of new models at negotiated prices, no extras pushed.",https://www.linkedin.com/company-beta/6615782/,,https://twitter.com/youandautra,
Autzu,https://www.crunchbase.com/organization/autzu,https://www.autzu.com,"Automotive, Car Sharing, Hardware, Ride Sharing, Software, Transportation","Hardware, Software, Transportation",Introducing drivesharing - the future of sustainable and efficient urban transport,"Autzu is developing the future of a sustainable, efficient, and safe shared urban mobility network.  Autzu aims to centralize rideshare vehicle control, by building an efficient infrastructure for autonomous fleet utilization. We are currently growing our operations in a number of major cities across the US and Canada.",https://www.linkedin.com/company/autzu/,,,https://www.facebook.com/Autzu/
Avenida Auto Sales,https://www.crunchbase.com/organization/avenida-auto-sales,http://avenidaautosales.com/,"Automotive, E-Commerce, Insurance","Commerce and Shopping, Financial Services, Transportation",Used Cars Santa Rosa CA - We offer easy financing options for no credit customers. Check out our online inventory and apply today.,"Used Cars Santa Rosa - Avenida Auto Sales is a Used Car Dealership in Santa Rosa, Ca. We offer easy auto financing for any type of credit situation. We have a wide selection of used cars in Santa Rosa. We provide sell used cars in Sonoma County, Rohnert Park, Petaluma, Healdsburg, Sebastopol, Windsor. If you are looking for a quality pre-owned vehicle, we can finance you today. All you need is a source of income, insurance and a down payment. We finance used cars for those with good credit, bad credit and no credit. If you need a used car loan, come visit us today!",,,,https://www.facebook.com/avenidaautosales
Average Car Insurance,https://www.crunchbase.com/organization/average-car-insurance,http://average-carinsurance.com,"Auto Insurance, Automotive, Insurance","Financial Services, Transportation",Average Car Insurance provides cheap car insurance quotes to help people find the best free vehicle insurance rates.,"Insurance is what we know. Insurance is what we’re good at. Car Insurance comparison site We compare a wide range of trusted household names for car insurance for your car insurance. You can be confident we will help you find a great deal. The quotes we find for you are not estimates – the price you see will be the price you pay. Average-carinsurance.com flourished because it simplified the process of finding people great car insurance quotes. Average-carinsurance.com is the car insurance comparison site of choice for thousands of online shoppers looking for car. Smart customers will likely compare auto insurance quotes to find out the best deals; or perhaps even they will seek advice from a couple of acquaintance in order to get a few guidance for who’s good and who’s not. However calling all over to compare the market auto insurance policies or firms is time consuming. While word of mouth is so important when thinking about whom exactly to insure your vehicle with, it really is not a guarantee of obtaining a great deal. Also just because some body you know has got a good deal along with a firm, does not mean that in fact firm is the right for you.",,,http://twitter.com/KellieBeaver,http://www.facebook.com/average.car.insurance
Avis,https://www.crunchbase.com/organization/avis,http://www.avis.com,"Automotive, Service Industry, Taxi Service","Other, Transportation","Avis Car Rental operates car rental brands with approximately 5,200 locations in more than 165 countries.","Avis Car Rental operates car rental brands with approximately 5,200 locations in more than 165 countries. Avis has a long history of innovation in the car rental industry and is one of the world's top brands for customer loyalty. Avis is owned by Avis Budget Group, Inc. (NASDAQ: CAR), which operates and licenses the brand throughout the world.",https://www.linkedin.com/showcase/avis,,http://twitter.com/avis,http://www.facebook.com/avis
Avon Automotive Holdings,https://www.crunchbase.com/organization/avon-automotive-holdings-inc,http://www.avonauto.com/,"Automotive, Manufacturing","Manufacturing, Transportation",Avon Automotive Holdings manufactures low-pressure rubber and silicone hoses and ducts.,"Avon Automotive Holdings manufactures low-pressure rubber and silicone hoses and ducts. Avon Automotive offers radiator hoses, heater hoses, and surge/degas assemblies; extruded rubber hoses, heat and abrasion resistant shielding, and manipulated plastic.",,,,
