Organization Name,Organization Name URL,Website,Industries,Industry Groups,Description,Full Description,LinkedIn,Hub Tags,Twitter,Facebook,CB Rank (Organization)
Citigroup,https://www.crunchbase.com/organization/citigroup,https://www.citigroup.com,"Banking, Credit Cards, Financial Services, Wealth Management","Financial Services, Lending and Investments, Payments",Citigroup is a diversified financial services holding company that provides various financial products and services.,"Citigroup is a diversified financial services holding company that provides various financial products and services. The company operates through two segments, Global Consumer Banking (GCB) and Institutional Clients Group (ICG). The GCB segment offers traditional banking services to retail customers through retail banking, commercial banking, Citi-branded cards, and Citi retail services. The ICG segment offers various banking, and financial products and services to corporate, institutional, public sector, and high-net-worth clients. This segment provides wholesale banking products and services, including fixed income and equity sales and trading, foreign exchange, prime brokerage, derivative services, equity and fixed income research, corporate lending, investment banking and advisory services, private banking, cash management, trade finance, and securities services. Citigroup Inc. was founded in 1812 and is based in New York, United States.",https://www.linkedin.com/company/citi,,https://twitter.com/citi,https://www.facebook.com/citi,6
Goldman Sachs,https://www.crunchbase.com/organization/goldman-sachs,http://www.goldmansachs.com/,"Banking, Finance, Financial Services, Security, Venture Capital","Financial Services, Lending and Investments, Privacy and Security","Goldman Sachs is a multinational financial services firm providing securities, and investment banking and management services.","The Goldman Sachs Group, Inc. provides investment banking, securities, and investment management services, as well as financial services to corporations, financial institutions, governments, and high-net-worth individuals worldwide. Its Investment Banking segment offers financial advisory services, including advisory assignments with respect to mergers and acquisitions, divestitures, corporate defense, risk management, and restructurings and spin-offs; and underwriting services comprising public offerings and private placements of a range of securities, loans and other financial instruments, and derivative transactions. The company’s Institutional Client Services segment provides client execution services, such as fixed income, currency, and commodities client execution related to making markets in interest rate products, credit products, mortgages, currencies, and commodities; and equities related to making markets in equity products, as well as executes and clears institutional client transactions on stock, options, and futures exchanges. This segment also engages in securities services business providing financing, securities lending, and other brokerage services to institutional clients, including hedge funds, mutual funds, pension funds, and foundations. Its Investing and Lending segment originates longer-term loans; and invests in debt securities, loans, public and private equity securities, real estate, consolidated investment entities, distressed assets, currencies, commodities, and power generation facilities. The company’s Investment Management segment provides investment products and services, as well as offers wealth advisory services, including portfolio management and financial counseling, and brokerage and other transaction services. The Goldman Sachs Group, Inc. was founded in 1869 and is headquartered in New York, New York.",http://www.linkedin.com/company/goldman-sachs,,http://twitter.com/goldmansachs,https://www.facebook.com/goldmansachs,76
BlackRock,https://www.crunchbase.com/organization/blackrock,http://www.blackrock.com,"Asset Management, Banking, Consulting, Crowdfunding, Finance, Financial Services, FinTech, Internet, Risk Management","Financial Services, Internet Services, Lending and Investments, Professional Services","BlackRock is an investment company that offers its services to institutions, intermediaries, foundations, and individual investors.","BlackRock's business is investing on behalf of our clients, from large institutions to parents and grandparents, doctors and teachers who entrust their savings to us. We work only for our clients—period. Our promise is to offer them the clearest thinking about what to do with their money and the products and services they need to secure a better financial future.  That's why investors of all kinds have made us the world’s largest asset manager, entrusting us with trillions of dollars, and it’s why companies, institutions and global governments come to us for help meeting their biggest financial challenges.  Important disclosures: http://www.blackrock.com/corporate/en-us/compliance/social-media-guidelines",http://www.linkedin.com/company/blackrock,,http://twitter.com/blackrock,http://www.facebook.com/BlackRock,120
Modern Treasury,https://www.crunchbase.com/organization/modern-treasury,https://www.moderntreasury.com/,"Banking, Finance, FinTech, Payments","Financial Services, Lending and Investments, Payments",Modern Treasury offers a payment operations platform used to simplify and modernize business payments.,"Modern Treasury enables its clients to marry bank statements with the company’s business logic to provide an enriched history of the company’s financial transactions. This view will empower the company’s finance teams to focus on solving the mission-critical problems of the business and not piecing together the jigsaw puzzle of bank transactions by hand. Modern Treasury will help answer those questions faster and with more confidence. The company's tools automate the full cycle of money movement—from payment initiation, through approvals, to reconciliation—and are accessible through a web application or API.",https://www.linkedin.com/company/modern-treasury/,,https://twitter.com/moderntreasury,https://www.facebook.com/moderntreasury/,123
MX Technologies,https://www.crunchbase.com/organization/moneydesktop,http://www.mx.com,"Banking, Finance, Financial Services, FinTech","Financial Services, Lending and Investments",MX Technologies is a fintech company that aims to connect people with their financial data in a way that automates their money experience.,"MX is a fintech data company that aims to connect people with their financial data in a way that automates their money experience. It enables fintech and all financial institutions with aggregating, enhancing, analyzing, presenting, and acting on financial data. MX enables banks and credit unions to achieve record-breaking growth by winning their competitor's most profitable account holders. As one of the fastest-growing fintech providers, MX drives customer-centric banking relationships by gathering and providing data upon which online and mobile banking partners and financial institutions can create and deliver next-generation banking applications and solutions. Founded in 2010, MX delivers data aggregation, data cleansing, auto-categorization, classification, money management, custom API, data analytics, marketing, UI, and more. In addition, MX offers an extensive array of client services, ranging from training to custom marketing services. MX currently partners with more than 600 financial institutions and more than 30 digital, online, and mobile banking providers — designating MX as a proven powerhouse in the fintech space.",https://www.linkedin.com/company/mxenabled/,Unicorn,https://twitter.com/mx,https://www.facebook.com/MXenabled/,131
Oxygen,https://www.crunchbase.com/organization/oxygen-5cc0,https://www.oxygen.us,"Banking, Financial Services, FinTech, Lending","Financial Services, Lending and Investments",Oxygen is a neobank that develop tools for consumers and small businesses through financial platform designed for the 21st century economy.,"Oxygen is a digital banking platform. It is the first and only challenger in the US that offers both personal and business banking. The bank of the 21st-century economy, serving consumers, small businesses, and freelancers. Available on iOS and Android, Oxygen users enjoy no monthly fees, no paperwork, early direct deposit, simple transfers, and cashback rewards on everyday purchases from approved merchants. Businesses can easily control their finances with solutions that are elegant, simple, and secure.",https://www.linkedin.com/company/getoxygen/,,https://twitter.com/OxygenBanking,https://www.facebook.com/oxygenbanking/,183
Circle,https://www.crunchbase.com/organization/circle-2,https://www.circle.com/en/,"Banking, Blockchain, Cryptocurrency, Finance, Financial Services, FinTech, Payments, Personal Finance","Financial Services, Lending and Investments, Other, Payments, Software","Circle is a global internet finance company, built on blockchain technology and powered by crypto assets.","Circle provides an online platform that enables users to send money quickly and easily. Circle uses blockchain technology with Circle Pay to ease and improve how users send money.  Circle expands its services with a crypto-currency investment product with Circle Invest, enabling anyone to buy and sell crypto assets. It provides crypto-coins and offer OTC trading services via Circle Trade. Its crypto-trading desk provides one of the largest global liquidity pools for digital asset trading and averages $2 billion in monthly volume. Jeremy Allaire and Sean Neville founded Circle in 2013. $140 million from investors including Jim Breyer (Facebook), Goldman Sachs, IDG Capital (Baidu, Tencent), General Catalyst (AirBnB, Snapchat) and Accel Partners backs the company, with its headquarters in Boston, and branches in New York, San Francisco, Dublin, London, and Hong Kong.",http://www.linkedin.com/company/3509899,Unicorn,https://twitter.com/circlepay,https://www.facebook.com/pg/circle/,274
Aura Financial,https://www.crunchbase.com/organization/insikt-inc-,http://myaura.com,"Banking, Financial Services, FinTech, Lending, Software","Financial Services, Lending and Investments, Software","Aura is a financial service company that provides affordable, credit-building loans to working families.","Aura is a technology-powered, Community Development Financial Institution that provides fair, affordable loans to working families in America. Aura's mission is to build financially healthy low-income communities, by providing empowering financial services to underbanked and unbanked. Aura uses its proprietary scoring algorithms to review and approve credit applications and offers free credit scores and personalized expense management guidance to borrowers, allowing the working population to access loans in a simplified manner. Aura was founded in 2014 and is headquartered in San Francisco, California, USA.",https://www.linkedin.com/company/my-aura/,,https://twitter.com/aura_fair_loans,https://www.facebook.com/aura.fair.loans/,347
BNY Mellon,https://www.crunchbase.com/organization/bnymellon,http://www.bnymellon.com,"Banking, Financial Services","Financial Services, Lending and Investments","BNY Mellon is an investments company provide investment management, investment services and wealth management.","BNY Mellon's history of providing distinguished service spans 225 years. Founded in 1784, soon after the birth of the new American republic, their history is inextricably woven into the broader history of the nation. BNY Mellon is a global leader in investment management and investment services. They are focused on helping clients manage and service their financial assets. BNY Mellon is the corporate brand of The Bank of New York Mellon Corporation. BNY Mellon is a global investments company dedicated to helping its clients manage and service their financial assets throughout the investment lifecycle. Whether providing financial services for institutions, corporations or individual investors, BNY Mellon delivers informed investment management and investment services in 35 countries and more than 100  markets.  As of December 31, 2013, BNY Mellon had $27.6 trillion in assets under custody and/or administration, and $1.6 trillion in assets under management. BNY Mellon can act as a single point of contact for clients looking to create, trade, hold, manage, service, distribute or restructure investments.",http://www.linkedin.com/company/bny-mellon,,http://twitter.com/bnymellon,http://www.facebook.com/bnymellon,455
Bank of America,https://www.crunchbase.com/organization/bank-of-america,http://www.bankofamerica.com,"Asset Management, Banking, Finance, Financial Services, FinTech, Small and Medium Businesses","Financial Services, Lending and Investments, Other","Bank of America offers banking, investing, and other financial and risk management services to individuals, SMBs and large corporations.","Bank of America is a financial institution, serving individual consumers, small- and middle-market businesses, and large corporations with a full range of banking, investing, asset management, and other financial and risk management products and services. They serve approximately 51 million consumer and small business relationships with approximately 5,300 retail banking offices and approximately 16,350 ATMs and award-winning online banking with 30 million active users and more than 13 million mobile users. It offers industry-leading support to approximately 3 million small business owners through a suite of innovative, easy-to-use online products and services. The company serves clients through operations in more than 40 countries. Bank of America is among the world's leading wealth management companies and is a global leader in corporate and investment banking and trading across a broad range of asset classes, serving corporations, governments, institutions, and individuals around the world. Bank of America Corporation stock (NYSE: BAC) is a component of the Dow Jones Industrial Average and is listed on the New York Stock Exchange. It was founded in 1998 and is headquartered in Charlotte, North Carolina, United States.",https://www.linkedin.com/company/bank-of-america,Crunchbase Venture Program,http://twitter.com/BofA_Help,https://www.facebook.com/BankofAmerica,572
Brex,https://www.crunchbase.com/organization/brex,https://brex.com,"Accounting, Banking, Credit Cards, Finance, Financial Services, FinTech, Life Science","Biotechnology, Financial Services, Lending and Investments, Payments, Professional Services, Science and Engineering","Brex is the financial OS for growing companies, with credit cards, cash management, and controls in a single account.","Brex is reimagining financial systems so every growing company can realize their full potential. With the financial OS, new customers can get up and running in minutes with corporate credit cards and cash management in a single, strategic account. Plus, companies save hours every month with built-in tools and integrations to track spend, and earn points on every card purchase. Launched in 2018, Brex has raised $315M in equity funding alongside $350M in debt financing, and is backed by the likes of Y Combinator Continuity, Kleiner Perkins, and the founders of PayPal. Headquartered in San Francisco, Brex also has offices in Vancouver, B.C. and the Salt Lake valley. Brex was founded by Henrique Dubugras and Pedro Franceschi, two engineers who previously founded Pagar.me, one of the largest payment processors in Brazil with over $1.5 billion in GMV.",https://www.linkedin.com/company/brexhq/,Unicorn,https://twitter.com/brexHQ,https://www.facebook.com/BrexHQ/,631
Neat Capital,https://www.crunchbase.com/organization/neat-capital-inc,http://www.NeatCapital.com,"Banking, Consumer Lending, Finance, Financial Services, FinTech, Lending, Real Estate","Financial Services, Lending and Investments, Real Estate",Neat Capital is a FinTech mortgage lender setting out to make financing a home as frictionless as using cash. ,"Neat Capital is a FinTech mortgage lender setting out to make financing a home as frictionless as using cash. It works directly with home buyers and also develops strong partnerships with real estate brokers, wealth managers, CPAs, and corporations. The company's platform cleans up the entire mortgage lending process and leverages technology for analyzing complex financial situations at a fraction of price, enabling clients to get home loans without any mess. Neat Capital is enabling clients to purchase homes with cash offers and close with financing in 10-15 days. It lends to clients with excellent credit profiles and sells these loans to investors.",https://www.linkedin.com/company/neat-capital-inc-,,https://twitter.com/@NeatCapital,https://www.facebook.com/neatcapital,666
Current,https://www.crunchbase.com/organization/current-6,https://current.com,"Banking, Finance, Financial Services, FinTech","Financial Services, Lending and Investments",Current is a leading U.S. challenger bank built to meet the needs of people who have been overlooked by the traditional banking industry.,"Current is a leading U.S. challenger bank built to meet the needs of people with unique lives who have been overlooked by the traditional banking industry. Our proprietary Current Core technology allows us to provide premium banking services for everyone, regardless of age or income, and improve the financial outcomes of our members without overdraft fees, minimum balance requirements, or hidden fees. We give members up to two days faster direct deposit paychecks, free overdrafts up to $100 with Overdrive™ , points on purchases redeemable for cash back, access to 55,000 free ATMs worldwide as well as 24/7 member support 365 days a year.",https://www.linkedin.com/company/current/,Emerging Unicorn,https://twitter.com/current,https://www.facebook.com/CurrentDebitCard/,752
nCino,https://www.crunchbase.com/organization/ncino,http://ncino.com,"Banking, Document Management, Enterprise Software, Finance, Financial Services, FinTech","Financial Services, Information Technology, Lending and Investments, Software",Ncino is a cloud-based bank operating solution for the financial services industry.,"NCino offers a cloud-based bank operating system created by bankers for bankers. The system helps increase profitability, productivity gains, regulatory compliance, and operational transparency at all organizational levels as well as across all lines of business. Following a process structure similar to a bank’s loan accounting system, the bank operating system offers combined services through its business process management, loan lifecycle, business intelligence, and document management solutions.",http://www.linkedin.com/company/ncino-inc-,Exited Unicorn,http://twitter.com/ncino,https://www.facebook.com/nCino.Inc,853
Airfox,https://www.crunchbase.com/organization/airfox,https://airfox.com/,"Banking, Cryptocurrency, Financial Services, FinTech, Mobile, Wireless","Financial Services, Hardware, Lending and Investments, Mobile, Payments, Software","To accelerate financial inclusion, Airfox's provides the financially underserved in emerging markets digital access to financial services.","Airfox is on a mission to accelerate financial inclusion for the underbanked within emerging economies. Airfox aims to create an entirely new financial services model for the underbanked that democratizes access to capital and financial services with a mobile-first solution. Airfox is a venture-backed, financial technology company based in Boston and São Paulo. To learn more about the future of decentralized digital banking, visit www.airfox.com.",https://www.linkedin.com/company/airfox/,,https://twitter.com/_airfox,https://www.facebook.com/AirfoxHQ/,997
Instnt,https://www.crunchbase.com/organization/instnt,http://www.instnt.org,"Banking, Financial Services, FinTech, Insurance, Software","Financial Services, Lending and Investments, Software",Instnt is the first fully managed onboarding platform for businesses with fraud loss liability insurance.,"Instnt Inc. is a public benefit corporation on a mission to bring inclusion and instant account opening experiences for businesses and their customers. It is a one-of-a-kind collaborative effort between industry thought leaders, technology vendors and the private and public sector to solve for both sides of the on-boarding problem with a “Stripe for on-boarding” service offering and a new, interoperable Open Trust Protocol to make instant consumer acceptance a global reality.",https://www.linkedin.com/company/instnt-inc,,https://twitter.com/Instnt_org,,"1,007"
Santander Bank,https://www.crunchbase.com/organization/santander-bank-2,https://www.santanderbank.com,"Banking, Finance, Financial Services","Financial Services, Lending and Investments",Santander Bank is a retail bank that provides its users with financial products and services.,"Santander Bank, N.A. All rights reserved. Santander Bank, N.A. is a Member FDIC and an Equal Housing Lender. Santander, Santander Bank, the Flame Logo, Santander Select (And Design), Santander Universities (And Design), Santander Shareholders (And Design), Santander Rewards, Bravo, Sphere, Express Cash Pack, Flexlock, Extra 20 and A Bank For Your Ideas are registered trademarks, and Santander Select, Santander Cash Rewards, Santander Universities, Santander Shareholders, Santander Advance, Santander Passport, Passport, I (Heart) My Bank, I Love My Bank, and Real Change, are service marks, of Banco Santander, S.A. or its affiliates or subsidiaries in the United States or other countries.",https://www.linkedin.com/company/santander-bank-na,,https://twitter.com/santanderbankus,https://www.facebook.com/SantanderBankUS/,"1,280"
Finicity,https://www.crunchbase.com/organization/finicity,http://www.finicity.com,"Banking, Big Data, Cloud Data Services, Cyber Security, Data Integration, Data Visualization, Financial Services, FinTech, Payments","Data and Analytics, Design, Financial Services, Information Technology, Internet Services, Lending and Investments, Payments, Privacy and Security, Software","Finicity provides open banking services, real-time financial data access and insights.","Finicity is a developer of a real-time financial data aggregation and insight platform used to drive financial decision making. It aims to help individuals, families, and organizations make smarter financial decisions through safe and secure access to fast, high-quality data. The company, which launched its first financial product in 2000, has since grown to provide financial data APIs, credit decisioning tools, and financial wellness solutions. Finicity partners with influential financial institutions and disruptive fintech providers alike to give consumers a leg up in a complicated financial world. It has played a key role in innovative solutions like Experian’s Boost and it helps Rocket Mortgage by Quicken Loans access consumer-permissioned data for mortgage decisions.",http://www.linkedin.com/company/finicity,,http://twitter.com/finicity,http://www.facebook.com/finicity/info,"1,306"
Aspiration,https://www.crunchbase.com/organization/aspiration,https://www.aspiration.com,"Banking, Financial Services, FinTech, Social Impact","Financial Services, Lending and Investments, Other",Aspiration a socially conscious fintech platform that offers a range of products oriented around conscious consumerism.,Aspiration is an online financial firm that offers retail banking and investing services built for everyone.  Aspiration delivers the financial products that people need in a consumer-focused model that empowers people to choose their fee and aligns the interests of Aspiration and its customers.  The company donates a dime of every dollar it earns to help Americans that work to climb the ladder of opportunity while making it possible for its customers to choose to give a portion of their profits to a charitable cause of their choice.,https://www.linkedin.com/company/aspiration-investments,,http://twitter.com/Aspiration,http://www.facebook.com/AspirationInvestments,"1,310"
Simple,https://www.crunchbase.com/organization/banksimple,http://simple.com,"Banking, Enterprise Software, Financial Services, FinTech","Financial Services, Lending and Investments, Software",Simple is a web and mobile application that unifies various accounts into one accessible bank card..,"Simple is a web and mobile application that unifies various accounts into one accessible bank card. Rather than making money from different fees, Simple plans to split the net interest margin with its partner banks (the difference between the rate they lend at and the rate they pay to depositors), thus eliminating the incentive to push more confusing products at consumers. Simple has more than 100,000 customers, processed $1.7 billion in annual transactions last year, and experienced 330% customer growth.  Simple was launched by Alex Payne, Shamir Karkal, and Josh Reich in January 2009 and is based in Portland, Oregon.",http://www.linkedin.com/company/simple-finance,,http://twitter.com/simple,http://www.facebook.com/simple,"1,338"
