Organization Name,Organization Name URL,Website,Industries,Industry Groups,Description,Full Description,LinkedIn,Hub Tags,Twitter,Facebook,CB Rank (Organization)
LoanMart,https://www.crunchbase.com/organization/loanmart,https://www.800loanmart.com/,"Banking, Finance, Financial Services","Financial Services, Lending and Investments",LoanMart devotes to customer service and addressing customer's needs.,"LoanMart devotes to customer service and addressing customer's needs. LoanMart offers auto title loans , the difference between them and other competitors is that they care about their customers and that is why they are the leading auto title loan lenders on the West Coast.",https://ca.linkedin.com/company/wheels-financial-group-dba-800loanmart,,https://twitter.com/Loanmart?ref_src=twsrc%5Egoogle%7Ctwcamp%5Eserp%7Ctwgr%5Eauthor,https://www.facebook.com/LoanMart/,"33,862"
Prime Trust,https://www.crunchbase.com/organization/prime-trust,https://www.primetrust.com/index.html,"Banking, Blockchain, Crowdfunding, Cryptocurrency, Financial Services, FinTech","Financial Services, Lending and Investments, Other, Payments, Software",Prime Trust is a blockchain-driven trust company that provides API-driven open banking solutions.,"Prime Trust is a technology-driven trust company unlike anything else in existence. We are doing to the traditional trust industry what Paypal did to merchant processing; completely disrupting it by writing software that brings services to the masses and that business partners can build on top of. As a chartered, regulated financial institution we are overseen by the banking commissioner’s office at the Financial Institutions Division. As a trust company we hold cash and non-cash assets such as stocks, bonds, Bitcoin and other cryptocurrencies, tokens, real estate, and private business ownership interests. We act as custodian and trustee for a wide variety of personal and corporate trusts, as well as a major part of the crowdfunding industry, and work with individuals, corporations, lawyers, brokers, investment advisers and others on holding and managing specialized custodial, escrow and trust services.",https://www.linkedin.com/company/primetrust/,,https://twitter.com/primetrustco,https://www.facebook.com/PrimeTrustLLC/,"33,995"
Mercury,https://www.crunchbase.com/organization/mercury-ffa1,https://mercury.com/,"Banking, Financial Services, FinTech","Financial Services, Lending and Investments","Mercury is a bank for startups, engineered in Silicon Valley for tech companies.","Mercury is a bank for startups, engineered in Silicon Valley for tech companies. The company provides bank accounts built specifically for startups by combining Federal Deposit Insurance Corp (FDIC)-insured checking and savings accounts with tech tools like cashflow analytics, intuitive dashboards and efficient payments, enabling tech startups to have a practical financial stack, real-time insight into company finances, and tools to maximize operational efficiency.",https://www.linkedin.com/company/mercurybank/,,https://twitter.com/bankmercury,,"34,107"
Levelfield,https://www.crunchbase.com/organization/vrbex,https://vrbex.com/,"Banking, Cryptocurrency, Financial Services, FinTech, Trading Platform","Financial Services, Lending and Investments, Payments, Software",Early stage Houston based challenger bank with a specialization in digital assets lead by financial service industry veterans,"The VRBex team (rebranding to Levelfield) has worked over two years in research and development, and now we are seeking early stage investors to join us in launching our first business line. View our pitch deck at  http://bit.ly/Levelfield In our vision the future of financial services (the future of money) lies within digital – not merely banking electronically, as many major institutions define digital – but the cultural and technology changes that accompany true 24x7, real time, direct payments. We have a well-developed plan to grow a world leading FinTech/Challenger Bank, and the expertise to make it happen.  VRBex/Levelfield will be leaders in the technological and cultural transformation for financial services arising from fundamental changes driven by digital assets and blockchain. We will disrupt the existing digital asset and banking industries by building a well-regulated, well-managed group centered upon a full-service U.S. chartered bank to offer a mixture of products and services within both the emerging digital asset class and traditional banking and securities.",https://www.linkedin.com/company/vrbex/,,https://twitter.com/VRBex_Exchange,,"34,268"
Hilltop Securities,https://www.crunchbase.com/organization/hilltop-securities,https://www.hilltopsecurities.com/,"Banking, Finance, Financial Services","Financial Services, Lending and Investments","Hilltop Securities is a financial service company that provides management, capital markets, public finance, and clearing services.","Hilltop Securities is a financial service company that provides management, capital markets, public finance, and clearing services. The company delivers a broad range of investment banking and related financial services to corporate, individual, and institutional investors, broker-dealers, governmental entities, and financial intermediaries​. It helps advance the financial opportunities of communities, businesses, and individuals alike.  The company also delivers the forthright advice and tailored solutions necessary for municipal issuers, institutions, broker-dealers, and individuals to thrive. It focuses on providing customers with personal, reliable financial services through a combined network of approximately 806 employees in 54 locations across the country. The company also specializes in the business of buying and selling securities such as stocks, bonds, mutual funds, and certain other investment products.  Hilltop Securities was founded in 1946 and is headquartered in Dallas, Texas.",https://www.linkedin.com/company/hilltop-securities-inc-,,,,"34,465"
Southside Bank,https://www.crunchbase.com/organization/southside-bank,http://southside.com,Banking,"Financial Services, Lending and Investments","Southside Bancshares is a banking company that specializes in personal banking, business banking, mortgage, and equity lending.","Southside Bancshares is a banking company that specializes in personal banking, business banking, mortgage and equity lending, treasury management, wealth management, and investment services.  It was founded in 1960 and headquartered in Tyler, Texas.",,,,,"34,632"
Triyosoft,https://www.crunchbase.com/organization/triyosoft,http://www.triyosoft.com,"B2B, Banking, Collaboration, Document Management, Enterprise Software, Finance, Financial Services, FinTech, Information Technology, Productivity Tools, Project Management, SaaS, Software","Administrative Services, Financial Services, Information Technology, Lending and Investments, Other, Software","TRIYO enables remote teams to effectively collaborate with a clear line of sight by leveraging the API economy via O365, G Suite, Teams.","TRIYO enables remote teams to effectively collaborate with a clear line of sight by leveraging the API economy via O365, G Suite, Teams.",https://www.linkedin.com/company/triyosoft/,,https://twitter.com/triyosoft,https://www.facebook.com/triyosoftinc/,"34,684"
Bridge Financial Technology,https://www.crunchbase.com/organization/bridge-financial-technology,http://www.bridgeft.com,"Accounting, Banking, FinTech, Software","Financial Services, Lending and Investments, Professional Services, Software",Bridge is using software to change the way financial advisors run their businesses and interact with clients.,"Bridge believes that everyone should have access to a fiduciary financial advisor. However, as a result of inefficiency and low tech adoption, many fiduciaries struggle to stay competitive and scale economically.  We make SaaS exclusively for fiduciary advisors known as Registered Investment Advisors (RIAs). Our software enables RIAs to automate their office work and investment management, allowing them to serve more clients, scale their business, and keep costs low.",https://www.linkedin.com/company/bridge-financial-technology,,https://twitter.com/bridge_ft,,"34,762"
ZeFi,https://www.crunchbase.com/organization/zefi,https://zefi.io,"Asset Management, Banking, Cryptocurrency, Debit Cards, Financial Services, FinTech, Software","Financial Services, Lending and Investments, Payments, Software",ZeFi develops a neobanking platform that provides a permission less financial ecosystem without a central authority.,"ZeFi develops a neobanking platform that provides a permission less financial ecosystem without a central authority. The platform provides high yield US dollars denominated savings account to convert deposits to fiat cryptocurrency, which is linked to the US dollar, and thereafter lends it out to low-risk borrowers at a higher interest rate, allowing users to interact and earn more with their crypto assets.",https://www.linkedin.com/company/zefihq/,,https://twitter.com/getzefi,,"34,781"
Bremer Bank,https://www.crunchbase.com/organization/bremer-financial-corporation,https://www.bremer.com/Home/,"Banking, Finance, Financial Services, Internet","Financial Services, Internet Services, Lending and Investments","Bremer Bank financial service company that offers banking, mortgage, investment, wealth management, trust, and insurance products.","Bremer Bank financial service company that offers banking, mortgage, investment, wealth management, trust, and insurance products. They exist to strengthen communities by partnering with the people who cultivate our food, sustain their economy, and serve its neighbors. It was founded in 1943 and is headquartered in Saint Paul, Minnesota, USA.",https://www.linkedin.com/company/bremer-bank,,https://twitter.com/bremerbank,https://www.facebook.com/Bremerbank/info?tab=overview,"34,968"
Sevier County Bank,https://www.crunchbase.com/organization/sevier-county-bank,http://bankscb.com,"Banking, Finance, Financial Services","Financial Services, Lending and Investments",Sevier County Bank provides banking and financial services to its clients.,"Sevier County Bank provides banking and financial services to its clients. Sevier County Bank is helping businesses, building communities, and inspiring customer loyalty. This was the vision that brought together 52 investors in the early 1900s to risk $30,000.00 of their own capital to start their own bank. When Sevier County Bank was founded on March 9, 1909, the stage was set. SCB would be a bank for the people and businesses of the region, not one restricted to a single community or market.",,,https://www.twitter.com/bankscb_tn,,"35,046"
Digiliti Money,https://www.crunchbase.com/organization/cachet-financial-solutions,https://www.digilitimoney.com/,"Banking, Credit, Enterprise Software, Financial Services, FinTech, Information Technology","Financial Services, Information Technology, Lending and Investments, Software",Digiliti Money is a technology solutions and services provider to the financial services industry.,"Digiliti Money Group formerly Cachet Financial Solutions, is a technology solutions and services provider to the financial services industry. The Company's solutions and services enable its clients, such as banks, credit unions, and alternative financial services providers (AFS) to offer their customers remote deposit capture (RDC) and prepaid mobile money technologies and related services. Digiliti Money's cloud-based technology platform simplifies the development, deployment, and servicing of consumer and commercial solutions minimizing cost and accelerating speed-to-market and ROI.",,,,,"35,137"
Southern Bancorp,https://www.crunchbase.com/organization/southern-bancorp,https://banksouthern.com/,"Banking, Finance, Financial Services","Financial Services, Lending and Investments","Southern is a unique organization that combines the vision, passion, and creativity of non-profit organizations.","Southern has originated over $2 billion in development loans—primarily to individuals and organizations in the poorest areas of the United States. The $2 billion milestone is unmatched in rural development, but Southern considers it to be just the beginning. Southern understands that access to capital—both for rural institutions and for rural families—is critically important. However, Southern Bancorp has found that even $2 billion of invested capital is insufficient to drive fundamental community change without such capital investments being focused into specific geographic areas and matched to comprehensive community engagement in education, housing, health care, leadership development, and economic development.",https://www.linkedin.com/company/southern-bancorp,,https://twitter.com/southernbancorp,https://www.facebook.com/SouthernBancorp,"35,325"
MidWestOne Bank,https://www.crunchbase.com/organization/midwestone-bank,https://www.midwestone.bank/,"Banking, Commercial, Financial Services","Financial Services, Lending and Investments, Other","MidWestOne Bank is a commercial banking service company that offers personal banking, small business banking, and wealth management.","MidWestOne Bank is a commercial banking service company that offers personal banking, small business banking, wealth management, and mortgage.  It was founded by Ben S. Summerwill in 1934 and is headquartered in Iowa City, Iowa.",https://www.linkedin.com/company/midwestone-bank/,,https://twitter.com/midwestone,https://www.facebook.com/MidWestOne,"35,496"
First Republic Bank,https://www.crunchbase.com/organization/first-republic-bank,http://firstrepublic.com,"Banking, Finance, Financial Services","Financial Services, Lending and Investments",First Republic Bank founded in 1985.,"Founded in 1985, First Republic and its subsidiaries offer private banking, private business banking and private wealth management, including investment, trust and brokerage services. First Republic specializes in delivering exceptional, relationship-based service, with a solid commitment to responsiveness and action. Services are offered through preferred banking or wealth management offices primarily in San Francisco, Palo Alto, Los Angeles, Santa Barbara, Newport Beach, San Diego, Portland, Boston, Palm Beach, Greenwich, and New York City. First Republic offers a complete line of banking products for individuals and businesses, including deposit services, as well as residential, commercial and personal loans.",http://www.linkedin.com/company/first-republic-bank,,http://twitter.com/firstrepublic,http://www.facebook.com/firstrepublicbank,"35,679"
Heartland Bank and Trust,https://www.crunchbase.com/organization/heartland-bank-and-trust-company,http://hbtbank.com,"Asset Management, Banking, Financial Services, Personal Finance, Real Estate, Retirement","Community and Lifestyle, Financial Services, Lending and Investments, Other, Real Estate",Heartland Bank and Trust is a banking firm offering housing lending services.,"Heartland Bank and Trust is a banking firm offering housing lending services. The Bank offers personal deposit services, such as checking accounts, order checks, savings accounts, debit cards, online banking and bill pay services, asset management, and trust services. It also provides their customers options and local service to choose the way they do their personal and business banking. Heartland Bank and Trust offer traditional bank deposit account services, checking, and savings with conveniences in tune with today's needs. The company also provides banking solutions for both commercial and small businesses. They also deliver comprehensive wealth management solutions after gaining a deep understanding of the situation and goals. Heartland Bank and Trust was founded in 1964 and is headquartered in Bloomington, Illinois.",https://www.linkedin.com/company/heartland-bank-and-trust-company,,https://www.twitter.com/hbtbank,https://www.facebook.com/heartlandbankandtrustcompany,"35,735"
IntellectEU,https://www.crunchbase.com/organization/intellecteu,https://www.intellecteu.com,"Banking, Data Integration, FinTech, Information Technology, Payments, Professional Services, Software, Technical Support, Web Development","Data and Analytics, Financial Services, Information Technology, Lending and Investments, Other, Payments, Software","IntellectEU is an international technology company with core expertise in financial integration, middleware solutions and DLT development.","Company Profile: International technology company. SWIFT Integration Partner. Founding member of Linux Foundation’s Hyperledger. IBM Partner for Blockchain implementations. Expertise: financial integration; middleware; DLT development. 10+ years of financial integration and development experience. Global footprint: 200+ projects; 20+ countries worldwide. Cooperation models: remote and on-site. Headquarters: Belgium. Offices: United States, Ukraine, Portugal, Mexico. Professional Services: Blockchain/ DLT development: Hyperledger, Ethereum, R3’s Corda, Chain. Implementation of custom DLT use cases, DLT Proof of Concepts and MVPs. Integration of Blockchain/ DLT with different back office applications, platforms, and legacy systems to ensure their coexistence within a single infrastructure. Financial Integration: Key Industry Standards, Formats & Protocols, Networks & Back Office Apps. SWIFT Infrastructure: set-up, integration, standards update. SWIFT messages parsing, translation, transformation, validation, archiving. SWIFT IT consulting services. Financial Software Development. Custom Web Software Development. Developer Seat and technical training. Technical support and consulting. Software testing services. Financial Integration Projects: Standards: ISO 20022, ISO 15022, SWIFT, EDI, etc. Formats: TXT, XML, CSV, RJE, BAI, JSON, etc. Protocols: JMS, FTP, SMTP/IMAP, IBM MQ, REST, SOAP, IDOC (SAP), etc. Networks: SWIFT, Fed, FIX, CHIPS, Target2, SARIE, EBICS, Blockchain, etc. Applications: SAP, SWIFT Alliance Access, Oracle, TemenosT24, FlexCube, TurboSWIFT, Quantum, Olympic, Tax/Mint, Google Enterprise, Salesforce, etc. IntellectEU: Smart Integration & Development",https://www.linkedin.com/company/intellecteu,,https://twitter.com/IntellectEU,https://www.facebook.com/IntellectEU,"35,775"
Esquire Bank,https://www.crunchbase.com/organization/esquire-bank,https://www.esquirebank.com/,"Banking, Finance, Financial Services","Financial Services, Lending and Investments",Esquire Bank is a full service commercial bank engaged in serving the financial needs of the legal and small business communities.,"Esquire Bank is a full-service commercial bank serving professional service firms, law professionals, small to mid-sized businesses, and individuals. The bank focuses on servicing these businesses, their owners, and employees, giving them direct access to key decision-makers including its senior and executive managers. Esquire Bank provides outstanding relationship banking through its high-tech and high-touch approach. Its team has designed a full range of banking services and products with competitive deposit and loan rates. The company's systems use the latest technology, providing its clients with customized tools to efficiently conduct their banking business.",https://www.linkedin.com/company/esquire-bank,,,,"35,809"
OpenCollective,https://www.crunchbase.com/organization/opencollective,https://opencollective.com,"Banking, Consulting, Financial Services, Payments","Financial Services, Lending and Investments, Payments, Professional Services",OpenCollective enables groups to pull money together and spend it transparently without having to open a legal entity or bank account.,"Open Collective enables groups to quickly set up a collective, raise funds and manage them transparently. OpenCollective enables groups to pull money together and spend it transparently without having to open a legal entity or bank account.",,,https://www.twitter.com/opencollect,https://www.facebook.com/BeOpenCollective/,"36,111"
State Street,https://www.crunchbase.com/organization/state-street-corporation,http://www.statestreet.com,"Angel Investment, Banking, Financial Services","Financial Services, Lending and Investments",State Street is a leading financial services provider serving some of the world's most sophisticated institutions.,"State Street is a leading financial services provider serving some of the world's most sophisticated institutions. They offer a flexible suite of services that spans the investment spectrum, including investment management, research and trading, and investment servicing.",http://www.linkedin.com/company/state-street,,http://twitter.com/StateStreet,https://www.facebook.com/StateStreetCorp/,"36,155"
NatureTrak,https://www.crunchbase.com/organization/naturetrak,http://naturetrak.com,"Banking, Cannabis, Compliance, FinTech, Risk Management, Software","Community and Lifestyle, Financial Services, Food and Beverage, Health Care, Lending and Investments, Professional Services, Software",NatureTrak is an enterprise solution that connects credit unions to the emerging cannabis economy.,"NatureTrak provides risk management and compliance solutions to financial institutions that work with cannabis related businesses(CRB's). NatureTrak's platform is integrated throughout the CRB's supply chain, yet accessible by core banking systems. From inventory management, distribution, logistics, and digital transactions, NatureTrak's solutions deliver the transparency, visibility, and business intelligence needed by financial institutions to confidently serve their clients who operate Marijuana, CBD, or Hemp businesses.",https://www.linkedin.com/company/naturetrak/,,http://twitter.com/naturetrak,https://www.facebook.com/naturetrak/,"36,305"
American National Bank of Texas,https://www.crunchbase.com/organization/american-national-bank-of-texas,http://www.anbtx.com/,"Banking, Financial Services","Financial Services, Lending and Investments",American National Bank of Texas is one of the oldest independent banks in North Texas.,"Since 1875, American National Bank of Texas (ANBTX) has served the North Texas region’s personal and business needs. ANBTX isn’t just another bank. They are seasoned banking professionals who build lifelong partnerships with their customers. As an active participant in every community they serve, ANBTX understands the specific challenges, goals and needs of their customers like no other bank. Because they  understand, they  empower customers with solutions – not just products. They  listen, first and foremost. Then they  build the right mix from their comprehensive offering of products and services. They deliver value-added expertise to help each customer so they can prosper in business and in life. Their heritage and their commitment to purpose and dedication make us the solid, dependable establishment that the community has learned to count on yesterday, today and tomorrow.",https://www.linkedin.com/company/american-national-bank-of-texas,,https://twitter.com/anbtx,https://www.facebook.com/anbtx,"36,314"
Citizens Community Bancorp,https://www.crunchbase.com/organization/citizens-community-bancorp,https://www.ccf.us/,"Banking, Finance, Financial Services","Financial Services, Lending and Investments","Citizens Community Bancorp specializes in banking, financial services, commercial banking, mortgages, and mobile banking.","Citizens Community Federal specializes in banking, financial services, commercial banking, mortgages, mobile banking, community involvement, and internet banking,  It was founded in 1938 and headquartered in Eau Claire, Wisconsin.",https://www.linkedin.com/company/citizens-community-federal/,,https://twitter.com/ccfbank,https://www.facebook.com/citizenscommunityfederal,"36,346"
cbanc Network,https://www.crunchbase.com/organization/cbanc-network,https://www.cbancnetwork.com/,"Banking, Credit, Financial Services","Financial Services, Lending and Investments",cbanc Network is an online professional network for bank and credit union professionals.,"cbanc Network is an online professional network for bank and credit union professionals. The company also provides tools for financial institutions such as documents, discussions, vendor management, peer group analysis, risk assessment, and more. It aims to keep community financial institutions independent and thriving by empowering their employees to collaborate, share information, and lead the evolution of community banking. cbanc Network was founded in 2009 and is headquartered in Austin, Texas, United States.",https://www.linkedin.com/company/cbanc-network,,https://twitter.com/cbanc,https://www.facebook.com/cbancnetwork,"36,371"
Investar Bank,https://www.crunchbase.com/organization/investar-bank,https://www.investarbank.com,"Banking, Financial Services, Venture Capital","Financial Services, Lending and Investments",Investar Bank is a full service community bank that offers a full array of banking products and services for individuals.,"Investar Bank is a full-service community bank that offers a full array of banking products and services for individuals, professionals, and small and medium-sized businesses. This includes specialty accounts, bill paying services, cash management, electronic transactions, and a wide variety of loan services. It provides full banking services, excluding trust services, through its wholly-owned banking subsidiary, Investar Bank, National Association. The Bank has 10 branches across Southeast Louisiana with additional ATMs located in Baton Rouge.  Investar Bank was founded in 2006 and is headquartered in Baton Rouge, Louisiana, United States.",https://www.linkedin.com/company/investar-bank,,https://twitter.com/realinvestar,https://www.facebook.com/investarbank/,"36,432"
