Organization Name,Organization Name URL,Website,Industries,Industry Groups,Description,Full Description,LinkedIn,Hub Tags,Twitter,Facebook,CB Rank (Organization)
The Allstate Corporation,https://www.crunchbase.com/organization/allstate,http://www.allstate.com,"Banking, Finance, Insurance, Venture Capital","Financial Services, Lending and Investments","You are investing into the acquisition of an established Allstate insurance agency located in midtown Atlanta, GA.","You are investing into the acquisition of an established Allstate insurance agency located in midtown Atlanta, GA. The purchase price is $1,445,000. Last year's gross earnings were $829,960. The sale price is for a partial sale of the book of business. The expected gross earnings for 2015 are $733,450. The loan has already been approved by the bank, and Allstate corporate has given the green light to close and take over the agency June 1st, 2015. The loan is contingent on a $50,000 down payment from the buyer. The President has already made a good faith payment of $5,000 when he signed the purchase agreement. He is now seeking investors for the $45,000. This will leave him with the capital reserves necessary to insure a smooth takeover. As part of the negotiation, the seller agreed to continue paying for the operating expenses of the business until the first Allstate commission payment comes in, about 6 weeks after the takeover. The seller has also agreed to transfer the security deposit on the office lease. There is no security deposit for the utilities. The bank is lending $1,125,000 for 10 years at 7.25% and the seller is holding a note for $300,000 for 10 years at 7.25%. Your initial investment capital will be returned in the first 12 months. You will receive profit sharing dividend payments quarterly based on the equity you own (3.1%). The cash flow projections expect a profit of $332,650 in the first year. Your approximate quarterly dividend payments should be about $2,578. Additionally, You will be able to cash out of your equity after 12 months.",http://www.linkedin.com/company/allstate,,http://twitter.com/allstate,http://www.facebook.com/Allstate,"114,356"
Latham & Watkins,https://www.crunchbase.com/organization/latham-watkins,http://www.lw.com,"Banking, Consulting, Financial Services, Legal","Financial Services, Lending and Investments, Professional Services","Latham & Watkins is a global law firm with more than 2,000 lawyers in its offices located in Asia, Europe, the Middle East and the US.","Latham & Watkins offers legal advisory services. The firms practice areas include antitrust, joint ventures and strategic alliances, entertainment and media industry, funds and acquisition vehicles, finance, hotels, resorts, and gaming, out-of-court restructurings, benefits and compensation, controversy practice, exempt organizations, and international tax.  Latham & Watkins was founded in 1934 and is headquartered in Los Angeles, California. The firm has additional offices in Boston, Chicago, Frankfurt, Hamburg, Hong Kong, London, Moscow, New Jersey, and New York.",http://www.linkedin.com/company/latham-,,http://twitter.com/lathamwatkins,http://www.facebook.com/lathamwatkins,"114,604"
KapitalWise,https://www.crunchbase.com/organization/kapitalwise,http://www.kapitalwise.com,"Artificial Intelligence, Banking, Finance, Financial Services, FinTech, Predictive Analytics","Artificial Intelligence, Data and Analytics, Financial Services, Lending and Investments, Science and Engineering, Software","KapitalWise powers deeper relationships between financial institutions and their customers, offering personalized recommendations.","KapitalWise API platform combines financial institutions data with third-party data and uses ML and AI to monitor, detect and predict personal and financial events in the consumer's life to help financial institutions to recommend the right products and services at the right time. Their SaaS solutions integrate fully into a bank’s existing technology platform, with the ability to provide insights to relationship managers or be part of the customer’s digital user experience, complete with goal setting, nudges and scenario planning.",https://www.linkedin.com/company/kapitalwise/,,https://www.twitter.com/kapitalwise,https://www.facebook.com/kapitalwise,"114,913"
Bitprive,https://www.crunchbase.com/organization/bitprive,https://www.bitprive.com,"Banking, Blockchain, Cryptocurrency, E-Commerce, Finance, Financial Exchanges, Financial Services, FinTech, Marketplace","Commerce and Shopping, Financial Services, Lending and Investments, Other, Payments, Software",Bitprive is a global peer-to-peer marketplace of digital assets with 180+ popular payment methods in the world.,"Established in 2020, Bitprive is a Blockchain startup focusing on developing a regulated global cryptocurrency OTC marketplace with 180+ popular payment methods in the world.  Headquartered in the United States, operating the Asia Desk in Hong Kong, Bitprive is serving users from the globe including North America, Russia, Europe, Japan, South Korea and Southeast Asia regions. At Bitprive, we give working people a simple, fair and secure platform for trading the value of their work. Often our biggest problems revolve around money, earning it and transporting it. We are dedicated to unlocking the power of people by building a global peer to peer payment logistics platform of the future.  Our founding team is made of professionals from compliance, e-commerce, stored-value facilities, investment banking, money remittance, forex brokers, e-commerce and early blockchain adopters.",https://www.linkedin.com/company/bitprive,,https://twitter.com/bitprive,https://www.facebook.com/bitprive/,"114,929"
LOUD Capital,https://www.crunchbase.com/organization/loud-capital,http://www.LOUD.vc,"Banking, Financial Services, Venture Capital","Financial Services, Lending and Investments",LOUD Capital is a venture capital and alternative investment firm,"LOUD Capital is a venture capital and alternative investment firm.  They utilize education, services, and other resources to help grow impactful companies. LOUD Capital was founded by Darshan Vyas and Navin Goyal in 2015 and is headquartered in Columbus, Ohio.",https://www.linkedin.com/company/loud-capital,,https://www.twitter.com/loudcapital,https://www.facebook.com/loudcap,"115,298"
Parkside Financial Bank & Trust,https://www.crunchbase.com/organization/parkside-financial-bank-trust,http://parksidepath.com,"Banking, Financial Services, Insurance","Financial Services, Lending and Investments",Parkside Financial Bank & Trust is a financial services company providing banking and treasury management services.,Parkside Financial Bank & Trust is a financial services company providing banking and treasury management services.,https://www.linkedin.com/company/parkside-financial-bank-&-trust/,,,,"115,351"
ACA Compliance Group,https://www.crunchbase.com/organization/aca-compliance-group,http://www.acacompliancegroup.com/,"Banking, Consulting, Financial Services, Information Technology, Security","Financial Services, Information Technology, Lending and Investments, Privacy and Security, Professional Services",ACA Compliance Group (“ACA”) is a leading provider of regulatory compliance products and solutions.,"ACA Compliance Group  is a leading provider of risk management and technology solutions that focus on regulatory compliance, performance, financial crime, and cybersecurity. We partner with their clients to help them mitigate the regulatory, operational, and reputational risks inherent in their business functions. Their clients include leading investment advisers, private fund managers, commodity trading advisors, investment companies, broker-dealers, and domestic and international banks.Their products include standard and customized compliance packages; cybersecurity, AML, and risk assessments; GIPS® verifications and other performance services; and a wide variety of business advisory and technology solutions for financial services firms.",https://www.linkedin.com/company/aca-compliance-group,,https://www.twitter.com/acacompliance,https://www.facebook.com/acacompliance/,"115,576"
FE International,https://www.crunchbase.com/organization/fe-international,https://feinternational.com/,"Banking, Consulting, Content, E-Commerce, Financial Services, FinTech, PaaS, SaaS","Commerce and Shopping, Financial Services, Lending and Investments, Media and Entertainment, Professional Services, Software","FE International provides M&A advisory services for mid-market SaaS, e-commerce and content businesses.","FE International is an award-winning global M&A Advisor of SaaS, E-Commerce & Content businesses and the preeminent valuation thought leader in the industry. Founded in 2010, the leadership team has over 50 years of combined experience in investment banking, strategy consulting, technology, and entrepreneurship. The Firm offers comprehensive exit planning services, as well as direct access to an established network of international investors. With headquarters in New York and regional offices in San Francisco, London, and Hong Kong, FE International is a truly global company. FE was named No. 8 Fastest Growing Financial Services Company in the Americas in 2020 by the Financial Times (No. 133 overall) and is a two-time Inc. 5000 company.",https://www.linkedin.com/company/feinternational/,,https://twitter.com/FEIntl,https://www.facebook.com/FEinternational/,"116,027"
Signature Bank,https://www.crunchbase.com/organization/signature-bank,https://www.signatureny.com/,"Banking, Finance, Financial Services","Financial Services, Lending and Investments",New York-based full-service commercial bank with 27 private client offices throughout the New York metropolitan area.,"Signature Bank, member FDIC, is a New York-based full-service commercial bank with 27 private client offices throughout the New York metropolitan area.  The Bank’s growing network of private client banking teams serves the needs of privately owned businesses, their owners and senior managers.  Signature Bank offers a wide variety of business and personal banking products and services.  The Bank operates Signature Financial, LLC, a specialty finance subsidiary focused on equipment finance and leasing, transportation financing and taxi medallion financing.  Investment, brokerage, asset management and insurance products and services are offered through the Bank’s subsidiary, Signature Securities Group Corporation, a licensed broker-dealer, investment adviser and member FINRA/SIPC.  Since commencing operations in May 2001, the Bank has grown to $23.1 billion in assets, $18.3 billion in deposits, $1.91 billion in equity capital and $1.99 billion in other assets under management as of March 31, 2014.  Signature Bank's Tier 1 and risk-based capital ratios are significantly above the levels required to be considered well capitalized.",,,,,"116,072"
First National Bank Of Omaha,https://www.crunchbase.com/organization/first-national-bank-of-omaha,http://www.firstnational.com/,"Banking, Communities, Finance","Community and Lifestyle, Financial Services, Lending and Investments","First National Bank of Omaha provides banking services for corporate, small business and personal clients.","First National Bank of Omaha provides banking services for corporate, small business and personal clients. It provides services such as individual retirement accounts, checking and savings accounts, certificates of deposit, corporate treasury services, online banking, mobile banking, foreign currency exchange, credit cards, deposits, global banking, and community banking. It also provides wealth management, saving plans, wealth and investing solutions related to investments and planning, and capital markets. Its loans segment provides small business loans, small business administration loans, home equity, auto, and personal loans. In addition, it also provides business services, such as credit card processing, employee banking, and technology solutions, along with other specialized services that include renewable fuels lending and financing, solutions  for financial institutions, and healthcare banking. First National Bank of Omaha, formerly known as The First National Bank of Omaha, was established in 1987, based in Omaha, Nebraska. It currently operates as a subsidiary of First National of Nebraska Inc.",,,,,"116,375"
Woodsville Guaranty Savings Bank,https://www.crunchbase.com/organization/woodsville-guaranty-savings-bank,http://theguarantybank.com,"Banking, Financial Services, Mobile","Financial Services, Lending and Investments, Mobile","Woodsville Guaranty Savings Bank helps people and businesses of northern New Hampshire and northeastern Vermont ""Balance everything.""","Woodsville Guaranty Savings Bank (WGSB) serves the people, businesses, and communities of northern New Hampshire and northeastern Vermont ""Balance everything"" from ten locations, in Woodsville, Piermont, Lisbon, Littleton, Lancaster, Plymouth, Franconia, and Hanover (LPO), NH.  In-person, online, or on the go, WGSB customers can count on their bank to provide the convenience, technology, and personal, friendly service they want everyday, as well as the helpful. trusted advice when they need it.  WGSB is an SBA Preferred Lender.",https://www.linkedin.com/company/woodsville-guaranty-savings-bank/,,https://www.twitter.com/wgsbnh,https://www.facebook.com/theguarantybank,"116,444"
Thomas Weisel Partners,https://www.crunchbase.com/organization/thomas-weisel-partners-llc,http://www.thomasweisel.com,"Asset Management, Banking, Trading Platform","Financial Services, Lending and Investments",Thomas Weisel Partners LLC is a full service investment bank focused on the growth sectors of the global economy primarily in the,"Thomas Weisel Partners LLC is a full service investment bank focused on the growth sectors of the global economy primarily in the Technology, Internet, Media, Telecommunications, Healthcare, Consumer, Energy, Financial Services and Minerals & Mining industries.",http://www.linkedin.com/company/166435,,,,"116,603"
PSCU,https://www.crunchbase.com/organization/pscu,http://www.pscu.com,"Banking, Financial Services, Information Technology, Payments","Financial Services, Information Technology, Lending and Investments, Payments",PSCU is a nation's leading credit union service organization.,"PSCU is a Credit Union Service Organization (CUSO) and a true cooperative partner for credit unions. As a cooperative built, owned and governed by credit unions, their Owners contribute a collectively unique perspective on their strategic needs to thrive and grow in their markets. This collaborative approach ensures that the focus of the cooperative addresses the highest priority needs of its members. For 40 years, PSCU has worked to deliver an exceptional and memorable service experience at every credit union and member touch point. PSCU’s strategic investments in transaction processing, fraud prevention, digital payments, loyalty rewards, data analytics programs and 24/7/365 call center support give all Owners the competitive edge needed to outperform the competition in their markets. PSCU’s access to industry leading partners also gives its Owners the opportunity for early adoption of new payments technology. EMV chip cards and digital wallets are examples of sophisticated technologies that involve the coordination of many moving parts – and multiple partners – that are being successfully delivered to credit unions by PSCU. The combination of leadership in payments and a commitment to ongoing investment in technology and talent make PSCU an optimum partner to process, service and grow credit unions’ card programs. PSCU’s technology infrastructure, from its call center service applications, to its support for member-facing self-service applications is a critical component of PSCU’s service delivery model. The real value and success of PSCU is defined by the success of its Owners and how well PSCU serves its credit unions and their members.",https://www.linkedin.com/company/pscu,,https://www.twitter.com/pscuforward,https://www.facebook.com/pscuforward,"116,803"
The Progressive Corporation,https://www.crunchbase.com/organization/the-progressive-corporation,http://www.progressive.com,"Banking, Financial Services, Insurance, Risk Management","Financial Services, Lending and Investments, Professional Services",Progressive is a place where innovation and collaboration are a way of life. Each of our employees has a role in our success and together.,"Progressive is a place where innovation and collaboration are a way of life. Each of our employees has a role in our success and together, we continue to find new and better ways to satisfy our customers and move the insurance industry forward.",http://in.linkedin.com/company/progressive-insurance,,http://twitter.com/progressive,http://www.facebook.com/progressive,"117,162"
Lincoln International,https://www.crunchbase.com/organization/lincoln-international,http://www.lincolninternational.com,"Banking, Finance, Financial Services","Financial Services, Lending and Investments","Lincoln International specializes in mergers & acquisitions, capital markets, valuations, fairness opinions and jv advisory services.","We are trusted investment banking advisors to business owners and senior executives of leading private equity firms and public and privately held companies around the world. Our advisory services include mergers and acquisitions and capital markets advisory for the mid-market. We also provide valuations and fairness opinions and joint ventures advisory services. As one tightly integrated team of more than 500 professionals across 16 countries, we offer an unobstructed perspective, backed by superb execution and a deep commitment to client success. With extensive industry knowledge and relationships, timely market intelligence and strategic insights, we forge deep, productive client relationships that endure for decades. Connect with us to learn more at www.lincolninternational.com.",https://www.linkedin.com/company/lincoln-international,,https://www.twitter.com/lincolnint,,"117,524"
Global Digital Mercantile Holdings,https://www.crunchbase.com/organization/global-digital-mercantile-holdings,,"Banking, Financial Services","Financial Services, Lending and Investments",Global Digital Mercantile Holdings is provides banking and financial services.,Global Digital Mercantile Holdings is provides banking and financial services.,,,,,"117,615"
KS Bank,https://www.crunchbase.com/organization/ks-bank,http://ksbankinc.com/,"Banking, Financial Services, Local, Local Business","Financial Services, Lending and Investments, Sales and Marketing",KS Bank is a community bank that focuses on offering financial products and services to local families and businesses.,"KS Bank is a community bank that focuses on offering financial products and services to local families and businesses. The bank builds personal relationships by providing exceptional customer service, sustains profitable growth that creates value for its shareholders, contributes to the development of the communities, and promote a culture of professional growth and personal fulfillment for their employees. It was established in Smithfield, North Carolina in 1924",https://www.linkedin.com/company/ks-bank-inc./,,https://twitter.com/ksbankinc,https://www.facebook.com/ksbankinc/,"117,637"
Plaza Bank,https://www.crunchbase.com/organization/plaza-bank,http://plazabankwa.com,"Banking, Financial Services, Non Profit","Financial Services, Lending and Investments, Other",Plaza Bank is a commercial bank that offers personalized services to small businesses based in Seattle.,"The founders of Plaza Bank had a vision to provide a highly differentiated, unique level of service to business clients in the Pacific Northwest community, the community that has embraced diversity and helped create businesses of their own.  In 2006, Plaza Bank simultaneously opened a Downtown Seattle branch and a branch in Kent Station (which closed 11/29/13) to fulfill its promise to the founders, the community and employees.  The Bank has committed itself to providing much needed banking services to the Latino community and continues to create specialized banking relationships with the local business community. Plaza Bank has become a leader in innovation and expertise in the industry.",,,,https://www.facebook.com/plazabankwa,"117,746"
CAP COM Federal Credit Union,https://www.crunchbase.com/organization/cap-com-federal-credit-union,https://www.capcomfcu.org/,"Banking, Financial Services","Financial Services, Lending and Investments",CAP COM is a member-owned financial institution based in the New York’s Capital Region.,"CAP COM is a member-owned financial institution based in the New York’s Capital Region. As a credit union, they are member-driven and they focus on superior service, convenient products and competitive rates that help you save money and make your life just a little easier. And, they offer all the products and services you’d find at a typical financial institution.",https://www.linkedin.com/company/cap-com-federal-credit-union/,,https://twitter.com/cap_com_fcu,https://www.facebook.com/capcomfcu,"118,453"
Golden Eagle Community Bank,https://www.crunchbase.com/organization/golden-eagle-community-bank,https://www.goldeneaglecommunitybank.com/,"Banking, Finance, Financial Services","Financial Services, Lending and Investments","Golden Eagle Community Bank offers personal banking products and services, such as checking and savings, money market, and health savings.","Golden Eagle Community Bank Golden Eagle Community Bank offers personal banking products and services, such as checking and savings, money market, and health savings. The company also provides business banking products and services, including checking, savings, money market, and certificates of deposit. It was founded in 2007 and headquartered in Woodstock, Illinois.",,,,,"118,602"
NBC Bancshares,https://www.crunchbase.com/organization/nbc-bancshares,http://www.nhifinancialservices.com/,"Banking, Finance, Financial Services","Financial Services, Lending and Investments",NBC Bancshares is operating a bank holding company that provides commercial banking services.,"NBC Bancshares is operating a bank holding company of Nebraska Bank of Commerce that provides commercial banking services. It was founded in 2008 and is based in Lincoln, Nebraska.",,,,,"118,627"
Terafina Inc.,https://www.crunchbase.com/organization/terafina,https://www.terafinainc.com/,"Banking, Business Intelligence, Credit, Financial Services, FinTech, Mobile, SaaS, Software","Data and Analytics, Financial Services, Lending and Investments, Mobile, Software","Digital account opening services that unify experience across online, branch and call center channels for community banks and credit unions.","Terafina Inc. is a software-as-a-service product company providing digital account opening services on a single platform that seamlessly unifies the experience across the online, branch and call center channels for mid market community banks and credit unions. Its unique approach from the start has been to underpin a modern digital account opening solution with a comprehensive sales platform. This combination allows its customers to bring branches and call centers into the digital account opening process whereby digital leads can be initiated in one channel and seamlessly followed through and completed on another channel. Further, cross-sell is inbuilt into its core customer experience so that a financial institution’s customers can apply for multiple products in a single buying experience without any form of data re-entry. By creating guided client experiences that go beyond onboarding and leveling up the sales process to think about how you build 30-60-90+ day lifecycle relationships with your clients, Terafina helps build a scalable foundation that drives efficiency, reduces cost, improves speed to market, and stimulates organic growth for your organization.",https://www.linkedin.com/company/3686410,,https://twitter.com/terafinainc,,"118,737"
STRANDS,https://www.crunchbase.com/organization/strands,https://finance.strands.com/,"Artificial Intelligence, Banking, Big Data, Financial Services, FinTech, Machine Learning, Personal Finance, Software","Artificial Intelligence, Data and Analytics, Financial Services, Lending and Investments, Science and Engineering, Software",Strands is a FinTech partner that develops digital money management solutions that help banks empower people in life and business.,"Strands is a FinTech partner that develops digital money management solutions that help banks empower people in life and business. The company specializes in Big Data, AI, and Machine Learning since 2004. It creates custom digital money management software for financial institutions and empowers people to be smarter with money. Strands' mission is to enable banks to anticipate customer needs and proactively suggest actions to increase long term value for customers.",https://www.linkedin.com/company/strandslabs/,,https://twitter.com/strands?lang=en,,"118,807"
Alliance Bank & Trust,https://www.crunchbase.com/organization/alliance-bank-trust,https://www.alliancebanknc.com/,"Banking, Finance, Financial Services","Financial Services, Lending and Investments",Alliance Bank & Trust is a financial services provider that operates as a community bank.,"Alliance Bank & Trust is a financial services provider that operates as a community bank. Founded in 2004, the company directly serves Gaston and Cleveland counties in North Carolina.",https://www.linkedin.com/company/alliance-bank-trust/,,,,"118,829"
