Organization Name,Organization Name URL,Website,Industries,Industry Groups,Description,Full Description,LinkedIn,Hub Tags,Twitter,Facebook
(v)WeCare Technology,https://www.crunchbase.com/organization/vcare-tec,http://www.vcaretec.com,"Billing, Call Center, Service Industry, Software, Telecommunications","Administrative Services, Hardware, Other, Payments, Software",(v)WeCare Technology - Call Center Outsourcing Company,"(v)WeCare Technology is an international call center outsourcing company. The enterprise strives to deliver groundbreaking solutions to companies in different industry verticals. (v)WeCare Technology’s headquarters are in the United States and it carries out its operations through offices in India. The company that had a modest beginning in 2003 soon grew into a full-fledged organization. The idea behind (v)WeCare Technology’s foundation was a desire to provide excellent customer care to companies all over the world. No doubt, (v)WeCare Technology has proved its mettle time and over again. The company faced adversities with courage and made every possible effort to convert threats into profitable business opportunities. Despite a lot of competition from industry bigwigs, (v)WeCare Technology continued its journey fearlessly and chose to give a deaf ear to criticism. (v)WeCare Technology was quick to realize that every contemporary organization bows down to innovation. This is the reason the company took an initiative to set new industry trends with innovative business solutions. (v)WeCare Technology uses state-of-the-art technology and valuable industry insights to provide exceptional services to its customers. The company has worked meticulously to understand the requirements of customers. To keep the good work going, (v)WeCare Technology has incorporated services like CRM, software development and application, IT consultancy and networking solutions in its service cart. This is in addition to the conventional contact center services like e-mail support, live chat and customer care services. The latest addition to the company’s offerings is robust IVR services. (v)WeCare Technology values the confidence and trust of its clients. The company has never resorted to cookie-cutter solutions, despite the dearth of time and business pressure. This is the reason the company is known for its ability to deliver the best in the time-frame specified by its client. (v)WeCare Technology completely understands the significance of confidentiality and makes sure that the information provided by a client is used only in the interest of that particular client. With a magnificent management team of nearly 35 members, (v)WeCare Technology has been constantly soaring its height in the realm of BPO services as well as in Telecom billing services. Today it boasts more than 2000 employees in its different verticals. Equipped with leveraging technologies and Cisco powered IP network, the organization has been rendering excellent services to its clients overseas. Some of its services are listed below: •	Call answering services •	Back-end and technical support •	Chat and email support •	Software development including Telecom billing software •	Website designing and development •	Infrastructure management services •	Data Analytics Solutions •	IVR services - Hosting & Development •	Social Media Marketing •	Web based research activity •	Finance and Administration outsourcing •	Customer Relationship Management •	Customer Retention Services •	Telecom Billing and OSS solutions •	Retail Call Center •	Call Center Outsourcing Services What Modules it consists: (v)WeCare Technology being the one stop hub for all you telecom billing and OSS support consists of different module. Viz,: o	Lifeline ETC Module: This module provides for validation of addresses and credentials, duplicate checks, 497 reporting and a lot more. o	Activation Module: Activation module enables subscribers to sign up quickly in our system. o	Agent Portal: This module enables the agents to get their quick performance update over the internet. o	Billing Module: This module enables mailing of e-bills depending on dates and anniversaries. It is also integrated with some of the major payment gateways.  o	Inventory Module : (v)WeCare inventory module enables the users to accomplish orders on a first in first out basis. o	Data Analytics & Reporting: This module allows preparing of various like, reports sales report, agent performance tracking report, etc.  o	CSR Module:  CSR module helps you to know your customer well.",https://www.linkedin.com/company/wecaretechnology,,http://twitter.com/vcaretec,http://www.facebook.com/vcaretec1
3CLogic,https://www.crunchbase.com/organization/3clogic,http://www.3clogic.com,"Artificial Intelligence, Call Center, Customer Service, SaaS, Software, Telecommunications","Administrative Services, Artificial Intelligence, Data and Analytics, Hardware, Other, Professional Services, Science and Engineering, Software",3CLogic is a cloud contact center platform that provides cloud-based multichannel communications for service desks and sales organizations.,"3CLogic is a cloud contact center platform that provides cloud-based multichannel communications for service desks and sales organizations. It also offers solutions to enterprises interested in moving their customer interactions to the Cloud. From a simple connector between a legacy telephony system and a cloud-based CRM (3C Connect) to a hybrid solution or a complete AWS Cloud deployment. 3CLogic integrates with other cloud-based solutions, including CRM, CSM, and WFM, while providing market-leading security, scalability, and reliability. Its complete suite of inbound, outbound, multi-channel cloud-based contact center solutions provides companies with a 360-degree view of all their customer interactions, regardless of the channel chosen. Allowing for better first call resolutions and increasing customer satisfaction.  In addition to traditional contact center features (i.e. multichannel communication, IVR, ACD, predictive dialer, etc.) 3CLogic provides a powerful reporting framework with business analytics and a real-time scripting engine. The platform drives digital transformation by improving CX, organizational efficiency, and reporting insights using dynamic IVR, CTI, AI, advanced analytics, and API-driven integrations. 3Clogic was founded in 2005 and is headquartered in Rockville, Maryland, USA.",http://www.linkedin.com/company/3clogic,,http://twitter.com/3clogic,http://www.facebook.com/3CLogic
"Allzone Management Services, Inc",https://www.crunchbase.com/organization/allzone-management-services-inc,https://allzonems.com/,"Billing, Call Center, Health Care, Information Technology, Medical, Office Administration, Outsourcing","Administrative Services, Health Care, Information Technology, Payments, Professional Services, Software",Medical Billing Services,"Allzone is a premier provider of medical coding, medical billing & revenue cycle management services. Allzone is headquartered in the US, Los Angeles and has over 500+ employees in it's three state-of-the-art delivery centers",https://www.linkedin.com/company/allzone-management-services-inc/,,https://twitter.com/Allzone_Online,https://www.facebook.com/Allzone-Management-Solutions-902968013142955/
Aloware,https://www.crunchbase.com/organization/aloware,https://aloware.com/,"Call Center, Communications Infrastructure, CRM, Customer Service, SaaS, Software, Telecommunications, Unified Communications","Administrative Services, Hardware, Information Technology, Internet Services, Messaging and Telecommunications, Other, Professional Services, Sales and Marketing, Software","Omnichannel Cloud Contact Center that supports Calls, SMS, Social Messengers and works with any CRM.","Aloware understands what a modern contact center software should be: efficient, flexible, and packed with necessary features. It gears sales and support teams with the right tools to crush quotas and close more deals efficiently. It does all that by providing an all-in-one turnkey software that helps sales teams engage with customers in ways they love: via call, text message, email or social. Sales teams love Aloware for its adaptability. It offers seamless integrations with major CRMs, making it a premier partner of Hubspot and Pipedrive. Teams, big or small, find switching to Aloware a breeze. Designed for efficiency, Aloware lets you set up your workflows for automation. With the use of triggers, you can maximize your time building customer relationships than playing catch-up with your phones. Also contact leads through any device because Aloware does the busywork of merging them from a multitude of channels, into one smart platform. Now it gets even better with unlimited inbound calls and texts for support teams. Want to know more about what Aloware can do for you? See for yourself through a risk-free trial– no commitments whatsoever.",https://www.linkedin.com/company/aloware/,,https://twitter.com/alowaretalk,https://www.facebook.com/alowaretalk/
Altus Technology,https://www.crunchbase.com/organization/altus-technology,http://www.AltusTechnology.com,"Call Center, Collaboration, Information Technology, SaaS, Unified Communications, Video Conferencing","Administrative Services, Hardware, Information Technology, Internet Services, Messaging and Telecommunications, Other, Software","SaaS, UCaaS, CCaaS, CPaaS, Teams, Webex Calling, Webex Teams, Webex Meetings, Webex Contact Center, Managed SD WAN","Service Provider delivering communications, collaboration solutions, contact center, work stream application, and fully managed SD WAN to private and public sector organizations in North America.",https://www.linkedin.com/company/altustechnology/,,https://twitter.com/altusuc,
AMC Technology,https://www.crunchbase.com/organization/amc-technology,https://www.amctechnology.com,"Call Center, Cloud Computing, CRM, SaaS, Software, Telecommunications","Administrative Services, Hardware, Information Technology, Internet Services, Sales and Marketing, Software",AMC Technology is a software integration for customer service industries around the world.,"AMC Technology is a software integration for customer service industries around the world with their CRM and contact center integration platforms for both premise and cloud. Picasso and DaVinci support deep integration for leading CRM like SAP CRM, ServiceNow, Dynamics 365, Salesforce, Zendesk, Siebel, and SAP C4C and leading premise and CPaaS platforms like Twilio Flex, Skype for Business, Nexmo, Amazon Connect, Avaya AES, Avaya AACC, Avaya AIC, Cisco UCCE, Cisco UCCX, Aspect UIP, and more. The company provides licenses under this program to several non-profits, including American Red Cross, Canadian Blood Services, and American University Cairo. They also help innovative organizations to work more effectively and deliver higher levels of customer service. AMC's mission is to enable a customer presence to cross the enterprise, spanning applications & technologies. AMC Technology was founded in 1995 and is headquartered in Richmond, Virginia, United States.",https://www.linkedin.com/company/amc-technology,Pledge 1%,https://www.twitter.com/amctechnology,https://www.facebook.com/amctechnology.contactcanvas
Amtelco,https://www.crunchbase.com/organization/amtelco,http://amtelco.com,"Call Center, Information Technology, Software, Telecommunications","Administrative Services, Hardware, Information Technology, Software",Amtelco is a telecommunications company specializing in call center software.,"Amtelco is a trusted name in call center communication systems, software applications and XDS technologies for call centers, contact centers, healthcare facilities, higher education facilities, executive suites and developers. Amtelco's award-winning Infinity system is one of the most reliable and profitable pieces of call center equipment on the market. Infinity provides call centers with tools like Automatic Call Distribution (ACD), voice processing, text messaging, PBX capabilities and digital switching to transform businesses into specialized customer resource centers.",https://www.linkedin.com/company/amtelco,,https://www.twitter.com/amtelco,https://www.facebook.com/amtelco
Aspect Software,https://www.crunchbase.com/organization/aspect-software,http://www.aspect.com,"Call Center, Collaboration, Customer Service, Enterprise Software, Software, Telecommunications","Administrative Services, Hardware, Other, Professional Services, Software",Aspect Software is a Communications Software Provider.,"Aspect looks to enable organizations to turn the potential of unified communications into real business results, through enhanced knowledge worker and agent productivity and by helping optimize business processes throughout the enterprise and contact center for improved agility and responsiveness.  Aspect provides these capabilities by leveraging Microsoft unified communications like Microsoft Active Directory, Microsoft Exchange and Microsoft Office Communications Server 2007.",https://www.linkedin.com/company/aspect-software/,,http://twitter.com/AspectUC,http://www.facebook.com/pages/Aspect-Software/34156565263
Atexto,https://www.crunchbase.com/organization/atexto,https://atexto.com,"Call Center, Developer APIs, Electronic Health Record (EHR), Health Care, Health Diagnostics, Health Insurance, Machine Learning, Medical, Natural Language Processing, Software","Administrative Services, Artificial Intelligence, Data and Analytics, Financial Services, Health Care, Software",SaaS to source training data for speech recognition,Atexto is a crowd-based training-data and annotation services SaaS that helps telemedicine companies increase the accuracy and Language Support of the speech recognition at their video visits.,https://www.linkedin.com/company/audioatexto-com,,https://twitter.com/atexto_en,https://www.facebook.com/Atextocom/
AVOKE Analytics,https://www.crunchbase.com/organization/avoke-analytics,http://www.avoke.com,"Analytics, Call Center, Customer Service, Information Technology, Software","Administrative Services, Data and Analytics, Information Technology, Other, Professional Services, Software",AVOKE provides true end-to-end call experience analytics. ,"AVOKE Analytics provides the only whole call analytics solution available today. This solution enables companies to discover and quantifiably improve customer contact experiences by evaluating their customers’ journeys from dialing-to-hang-up. The AVOKE analytics solution is used by leading companies in consumer electronics, healthcare, telecommunications, and financial services. ",,,,
AVOXI,https://www.crunchbase.com/organization/avoxi,http://www.avoxi.com,"Call Center, Internet, Software","Administrative Services, Internet Services, Software",AVOXI is a computer software company that specializes in the fields of call center software solutions and international toll-free numbers.,"AVOXI is a computer software company that specializes in the fields of call center software solutions and international toll-free numbers. It provides telecommunications and enhanced VoIP solutions including toll-free services, and call recording.",https://www.linkedin.com/company/avoxi/,,http://twitter.com/AVOXI,https://www.facebook.com/goavoxi
Awesome OS,https://www.crunchbase.com/organization/awesome-os,https://awesomeos.com/,"Call Center, Customer Service, Graphic Design, Outsourcing, Web Development","Administrative Services, Design, Other, Professional Services, Software",Awesome OS provides customer experience and business process solutions to high growth clients and startups,"Awesome OS enables clients to scale operations and increase their competitive edge. Their main focus is on customer care - voice, digital/non-voice services, such as emails, chat and back office support, including web development and graphic design.",,,,
Benefitexpress,https://www.crunchbase.com/organization/benefitexpress,http://www.benefitexpress.info/,"Call Center, Cloud Computing, Employee Benefits","Administrative Services, Health Care, Internet Services, Software","The leading middle market, cloud-based platform for employee benefits and health exchange services.","benefitexpress is the leading middle market, cloud-based platform for employee benefits and health exchange services, with a focus on flexibility. By offering technology that integrates all benefits, in a one stop shop, benefitexpress provides simplicity to complex plans and offers a very custom-made experience to engage and educate employees while offering employers an ease of benefit management that is unmatched in market. benefitexpress provides a full range of services including, benefit enrollment, management and administration as well as direct bill services, reimbursement account administration, carrier bill reconciliation, total compensation statements, and a full service call center.",https://www.linkedin.com/company/benefit-express,,https://www.twitter.com/benefitexpress,https://www.facebook.com/benefitexpress
Bolder Thinking,https://www.crunchbase.com/organization/bolder-thinking,http://www.bolderthinking.com,"Call Center, Software, Telecommunications, VoIP","Administrative Services, Hardware, Information Technology, Internet Services, Messaging and Telecommunications, Software","Provider of Cloud Contact Center software. We offer contact center, business telephony, and SOS web to voice solutions.","Bolder Thinking provides three compelling solutions, all delivered via the public cloud: Call Center - The Bolder Call Center solution provides a robust call center platform that enables customers to run call centers that can be located anywhere in the world, regardless of location(s).  The Bolder Call Center provides skill based routing, full recording, true dynamic scalability, and robust analytics, all delivered through the public internet. Business Telephony - Bolder's Business Telephony solution delivers PBX functionality to SIP based hard phones and softphones.  SOS by Bolder Thinking - Bolder's innovative web to phone voice communications system that is designed to enable a dramatic increase in shopping cart conversions and a sharp decrease in customer dissatisfaction in service environments.",http://www.linkedin.com/company/bolder-thinking,,http://twitter.com/bolderthinking,https://www.facebook.com/237848573084835
Boostopia,https://www.crunchbase.com/organization/boostopia,http://boostopia.com,"B2B, Business Intelligence, Call Center, Customer Service, E-Commerce, Enterprise Software, SaaS, Technical Support","Administrative Services, Commerce and Shopping, Data and Analytics, Information Technology, Other, Professional Services, Software",Boostopia helps companies understand and improve their support departments.,"3 of the 4 founders worked together previously at another e-commerce startup, that at peak, reached north of $20M+ a year where one of their biggest challenges was managing their team of 20+ support agents. Their first-hand experience was that the existing market of technology solutions for support focuses almost exclusively on building tools for customer service agents to talk to customers, and NOT their bosses, the managers, to do their job of understanding and improving the whole support operation. So Boostopia is the first modern Workforce Optimization (WFO) solution built for SMB customer support managers, not agents, to do their job of understanding and improving the entire support operation. Our solution integrates with and upgrades common ticketing and call center solutions like Zendesk, Freshdesk, Helpscout, and Salesforce Service.  Customers are seeing 30%+ reductions in overall support volume and increases in Agent Productivity by 20%+.",https://www.linkedin.com/company/boostopia.io,,https://twitter.com/getboostopia,https://www.facebook.com/boostopia
Cab Hound,https://www.crunchbase.com/organization/cab-hound,https://cabhound.com/,"Apps, Call Center, Cloud Computing, Mobile Apps, Mobile Payments, Transportation","Administrative Services, Apps, Financial Services, Internet Services, Mobile, Payments, Software, Transportation",Mobile and cloud based technology and call center services for the taxi industry,"Cab Hound offers cloud dispatching technology, driver & passenger apps for android & iPhone and call center services that fit your taxicab companies specific needs.",https://www.linkedin.com/company/cab-hound,,https://twitter.com/cabhound,https://www.facebook.com/cabhound
CatrovaCer,https://www.crunchbase.com/organization/catrovacer,http://catrovacer.com,"Artificial Intelligence, B2B, Call Center, Information Technology, Software","Administrative Services, Artificial Intelligence, Data and Analytics, Information Technology, Other, Science and Engineering, Software",Conversation Analysis AI for call centers,"We have built a conversation analysis AI. You can give it call recordings/chat logs, and it will show you what differentiates your top performers from the rest, according to data. It will give personalized recommendations to turn the average performers into stars. The relative performance can be visualized via a dashboard with custom metrics like politeness, enthusiasm, the correctness of the information, the caller's reactions to answers, and if the agent is repeating the script over and over again. Situations, where things are going south, would immediately be alerted to the manager with a summary of what happened and an open line for her to join the call.",https://www.linkedin.com/company/c8r,,,
Chasedata,https://www.crunchbase.com/organization/chasedata,http://www.chasedatacorp.com/,"Call Center, Information Technology, Telecommunications, Virtual Assistant","Administrative Services, Hardware, Information Technology, Software",Chasedata take the guesswork and pain out of telemarketing with Their predictive dialer.,"ChaseData Corporation was founded in 1996 in order to empower call centers to accomplish their goals through software. Their company has never lost sight of this original goal. Today They  continue to provide real-world solutions to clients operating inbound contact centers, predictive dialing outbound call centers, in over a dozen industries employing thousands of agents.",https://www.linkedin.com/company/chase-data-corp,,https://twitter.com/chasedata,https://www.facebook.com/pg/ChaseData-892173130809847/
Clarabridge,https://www.crunchbase.com/organization/clarabridge,http://www.clarabridge.com,"Analytics, Call Center, Customer Service, Enterprise Software, Social Media Management, Text Analytics","Administrative Services, Data and Analytics, Internet Services, Other, Professional Services, Sales and Marketing, Software",Clarabridge helps business win the hearts and minds of their customers with the industry leading Customer Experience Management platform.,"Clarabridge helps hundreds of the world’s leading brands understand and improve their customer experience. Using advanced text analytics, enterprise survey, and robust engagement, Clarabridge transforms all forms of customer feedback empowering confident, decisive action across the business.",http://www.linkedin.com/company/clarabridge,,http://twitter.com/Clarabridge,http://www.facebook.com/Clarabridge
Clarity Voice,https://www.crunchbase.com/organization/clarity-voice,https://clarityvoice.com,"Call Center, Information Technology, Internet, Messaging, Software, Telecommunications, Wired Telecommunications","Administrative Services, Hardware, Information Technology, Internet Services, Messaging and Telecommunications, Software",Clarity Voice is a cloud-based phone company that offers VOIP service and  telecommunications services.,"Clarity Voice is a cloud-based phone company that offers VOIP service and  telecommunications services with features that make your life easier, such as auto attendants, advanced call routing and recording, innovative promotional messaging, and so much more. Clarity’s customized phone solutions include FranchisePhones, designed specifically for the franchising community, and Phone System in a Box, created for small- and medium-sized business VoIP service.",https://www.linkedin.com/company/clarity-voice/,,https://twitter.com/ClarityVoice1,https://www.facebook.com/ClarityVoice1/
Clickatell,https://www.crunchbase.com/organization/clickatell-inc,http://clickatell.com/,"Business Information Systems, Call Center, CRM, Cyber Security, Developer APIs, Messaging, Mobile, Mobile Payments, SMS, Telecommunications","Administrative Services, Financial Services, Hardware, Information Technology, Internet Services, Messaging and Telecommunications, Mobile, Payments, Privacy and Security, Sales and Marketing, Software","Clickatell is the original pioneer of the global mobile messaging API, today the company is a global leader in Mobile Engagement & Payments","Founded in 2000, Clickatell developed the worlds' first Mobile Messaging (SMS) API, enabling any software to send a text message, developers could simply 'cut and paste 4 lines of code' and be done. Today Clickatell is a global leader in helping brands connect, interact and transact with their mobile always customers. Clickatell is a privately held company headquartered in Silicon Valley, CA with over $18 million in venture capital funding led by Sequoia Capital. Today, Clickatell delivers several billion personalized priority messages per year for over 18,000 of the worlds' most loved brands and businesses while being hailed as one of the fastest growing mobile payment enablers in emerging markets. Current customers, which span enterprise sectors, include Visa, IBM, Avaya, McKinsey & Company, Facebook and WhatsApp. For more information, please visit www.clickatell.com or contact pr@clickatell.com.",https://www.linkedin.com/company/clickatell,,http://twitter.com/Clickatell,https://www.facebook.com/Clickatell-187073743959/
