Organization Name,Organization Name URL,Website,Industries,Industry Groups,Description,Full Description,LinkedIn,Hub Tags,Twitter,Facebook
VHT,https://www.crunchbase.com/organization/virtual-hold-technology,http://www.vhtcx.com,"Business Intelligence, Call Center, Customer Service, Enterprise Software, Internet, Messaging, SaaS, Software, Telecommunications","Administrative Services, Data and Analytics, Hardware, Information Technology, Internet Services, Messaging and Telecommunications, Other, Professional Services, Software","We enable people to get the help they need, from brands they love, on the terms they choose.","VHT invented Callback and for the last 25 years has been the leading provider of patented Callback technology.  Today VHT continues to improve the customer experience with its Mindful Platform. Mindful is a cloud-based, SaaS platform created to integrate Callback technology with voice, text, chatbot, and other platforms to allow seamless transitions between talk and text with customers. Along with digital channels, insight through analytics, measurement, and leveraging automation, we enable more successful relationships between customers and brands. Mindful by VHT utilizes voice and text channels through Callback, SMS messaging and seamless channel transitions to reduce hold time, improve average handle time, and align customer and business model contact preferences.",https://www.linkedin.com/company/vhtcx,,http://twitter.com/vhtcx,https://www.facebook.com/vhtcx/
VnuMngr,https://www.crunchbase.com/organization/vnumngr,http://www.VnuMngr.com/,"Analytics, Call Center, CRM, Event Management, Food and Beverage, Marketing, Restaurants, SaaS, Software, Ticketing","Administrative Services, Data and Analytics, Events, Food and Beverage, Information Technology, Media and Entertainment, Sales and Marketing, Software",SalesForce for Venues / First enterprise software for venue operators that help increase exposure and mange all bookings,"VnuMngr is an ERP software that helps venue operators to increase Exposure, Sales & Manage daily tasks from saas cloud software or iOS and Android devices.  VnuMngr eco-system includes venue website content management, table reservation, venue booking, ticket sales, food delivery, bottle services sales automation, marketing suite, Staff Recruiting & Scheduling, Reporting, Analytics, Security cam monitoring & POS integration. more details available on www.VnuMngr.com",http://www.linkedin.com/company/vnumngr,,http://twitter.com/VnuMngr,http://www.facebook.com/vnumngr
VoiceBase,https://www.crunchbase.com/organization/voicebase,http://www.voicebase.com,"Analytics, Big Data, Business Intelligence, Call Center, Data Mining, Enterprise Software, Information Services, Predictive Analytics","Administrative Services, Artificial Intelligence, Data and Analytics, Information Technology, Software",Speech Analytics for the Data-Driven Enterprise,"VoiceBase is defining the future of deep learning and communications by providing unparalleled access to spoken information for businesses to make better decisions. With flexible APIs, pre-built dashboards, developers and enterprises build scalable solutions with VoiceBase by embedding speech-to-text, conversational analytics, and predictive analytics capabilities into any big voice application. VoiceBase’s customers and partners include Tableau, Amazon Web Services, The Home Depot, Twilio, Vonage/Nexmo and Nasdaq. The company is privately held and is based in San Francisco, California. For more information on VoiceBase visit www.voicebase.com",https://www.linkedin.com/company/voicebase-inc-,,http://twitter.com/VoiceBase,http://www.facebook.com/VoiceBase1
VoiceOps,https://www.crunchbase.com/organization/clover-intelligence,https://voiceops.com,"Artificial Intelligence, Business Development, Call Center, CRM, Machine Learning, SaaS, Sales, Sales Automation, Software","Administrative Services, Artificial Intelligence, Data and Analytics, Information Technology, Professional Services, Sales and Marketing, Science and Engineering, Software",VoiceOps is the AI coaching & training platform,"VoiceOps is the AI coaching & training platform. Our platform offers one place to get visibility into sales calls and to provide coaching to reps. Our customers plug into VoiceOps and immediately have a world-class coaching infrastructure at their fingertips. Founded in 2016, we're proud to work with the leading companies in insurance, mortgage, travel, and education. We’ve got incredible investors supporting us like Bain Capital Ventures, Accel, Founders Fund, and Y Combinator. Our team has been featured on Forbes 30 Under 30, highlighted by Inc., Business Insider, Huffington Post, Venture Beat, TechCrunch. Our team includes graduates from Harvard, Yale, and MIT, a Fulbright scholar, and the 2017 North American debate champion.",https://www.linkedin.com/company/voiceops/,,https://twitter.com/voice_op,https://www.facebook.com/voiceopscoaching
VoIP Innovations,https://www.crunchbase.com/organization/voip-innovations,http://voipinnovations.com,"Call Center, Cloud Computing, Collaboration, Developer APIs, Developer Platform, Developer Tools, Messaging, Mobile Apps, SMS, Telecommunications, Unified Communications, VoIP, Web Apps","Administrative Services, Apps, Hardware, Information Technology, Internet Services, Messaging and Telecommunications, Mobile, Other, Software","VoIP Innovations, we provide Wholesale VoIP origination and termination services, as well as thousands of DIDs and E911.","VoIP Innovations is ﻿the only full-service global communications provider offering developers, enterprises, and carriers four areas of value: carrier services, Apidaze programmable telco APIs (CPaaS), a Showroom with ready-to-deploy partner solutions, and professional software development services. With these four areas of expertise, we enable our customers to build solutions with advanced functionality including voice, video, and messaging-enabled mobile and web apps, as well as lower their costs on Toll-Free, fax, and global voice and SMS origination/termination. With our 24/7 tech support, customer-oriented approach, and front- and back-end APIs, we offer powerful advantages for creating and delivering global communications solutions. VI was founded in 2007 and is headquartered in Pittsburgh, PA with offices throughout the U.S., as well as in Europe and the Philippines.",https://www.linkedin.com/company/voip-innovations,,https://www.twitter.com/voipinnovations,https://www.facebook.com/voip1nnovations
Voiptime Cloud,https://www.crunchbase.com/organization/voiptime-cloud,https://voiptimecloud.com/,"Call Center, Computer, Enterprise Software, Information Technology, SaaS, Sales Automation, Software, Telecommunications","Administrative Services, Consumer Electronics, Hardware, Information Technology, Sales and Marketing, Software","Voiptime Cloud offers the reliable cloud call center software for sales & marketing, and customer service.","Voiptime Cloud is an experienced vendor of call center and cold calling solutions. We have combined a decade of experience in IT and telesales with VoIP telephony expertise to create the solution that will actually help your sales reps to close more prospects and enable your sales managers to achieve the highest performance results.  Voiptime Cloud is an ideal solution for the sales professionals working with the high call volumes and looking to make the calling process easier to oversee and manage. Our software will be especially useful for telesales, telemarketing companies, and sales departments doing mass outbound campaigns.",https://www.linkedin.com/company/voiptimecloud/,,https://twitter.com/Voiptimecloud,https://www.facebook.com/voiptimecloud
VOZIQ,https://www.crunchbase.com/organization/voziq,http://www.voziq.com/,"Artificial Intelligence, Big Data, Call Center, Customer Service, Enterprise Software, Intelligent Systems, Marketing, Natural Language Processing, Predictive Analytics, Sales","Administrative Services, Artificial Intelligence, Data and Analytics, Other, Professional Services, Sales and Marketing, Science and Engineering, Software","VOZIQ offers an AI-enabled predictive customer intelligence solution to boost retention, loyalty and service experience metrics.","VOZIQ provides an end-to-end, cloud-based customer retention solution to help recurring revenue businesses accurately predict and mitigate customer churn risk very early in the lifecycle. It is achieved by applying a suite of 10+ machine learning models on combined structured and unstructured customer data.  This always-on, predictive scoring for every customer arms these businesses with granular visibility into a wide array of attributes that impact customer health, customer engagement, and customer marketing success. With the intelligence, businesses can easily identify micro-segments of customers based on risk levels, root causes, prior engagements, quick opportunities etc., and run targeted campaigns. VOZIQ operationalizes the intelligence via APIs and expert interventions to create risk-aware systems and risk-aware teams. The impact comes from large-scale proactive and more profitable actions through key customer engagement channels such as care and marketing. VOZIQ is based in Reston, VA, and has a Data Science and Engineering Center in Hyderabad, India.",http://www.linkedin.com/company/voziq,,http://twitter.com/voziq,http://www.facebook.com/voziq
Whelp,https://www.crunchbase.com/organization/whelp,https://getwhelp.com,"Artificial Intelligence, Big Data, Call Center, Customer Service, E-Commerce, Information Technology, SaaS, Small and Medium Businesses, Software","Administrative Services, Artificial Intelligence, Commerce and Shopping, Data and Analytics, Information Technology, Other, Professional Services, Science and Engineering, Software",Conversational Commerce Platform,"We bridge the gap between businesses and customers by unifying all customer support channels into one creative space at Whelp, a multi-channel conversational customer support platform.  We introduce a new stream of revenue (RPC - revenue per conversation) for businesses by empowering their customer support agents to sell/upsell to customers via messengers using our payment processing technology we have built right in Whelp. With AI-based hybrid chatbot and callback in 20 seconds features, we bring technology to empower human operators for greater, faster and more efficient customer service.",https://www.linkedin.com/company/whelp/,,http://twitter.com/getwhelp,https://facebook.com/getwhelp
