Organization Name,Organization Name URL,Website,Industries,Industry Groups,Description,Full Description,LinkedIn,Hub Tags,Twitter,Facebook
Concerto Software,https://www.crunchbase.com/organization/concerto-software,,"Call Center, Information Technology, Software","Administrative Services, Information Technology, Software","Concerto Software, Inc. a leading provider of call center software and services.","Concerto Software, a customer interaction management company, offers contact center services to its clients. The company offers its users with services that assist them in managing interactions with its clients through voice, email, Web, and fax. Its combination with Touchstar's Predictive Dialing System enables its users to optimize productivity with the assistance of TCPA and Do-not call registry systems that contains inbound ACD features. Furthermore, the service provides a range of facilities, including predictive dialing, call recording, silent call monitoring, and single-screen monitoring facilities. Cobncerto Software is a subsidiary of Golden Gate Capital and is headquartered in Westford, Massachusetts.",,,,
Connect First A RingCentral Company,https://www.crunchbase.com/organization/connect-first,http://www.connectfirst.com,"Call Center, SaaS, Software, Telecommunications","Administrative Services, Hardware, Software",Connect First is an award-winning cloud contact center software provider,"Connect First is an award-winning SaaS telecommunications and cloud contact center software provider that focuses on customer satisfaction and elegant hosted solutions. Connect First offers a robust platform, designed and supported by a team of highly experienced engineers, designers and business analysts, and backed with personalized in-house customer care.  Solutions include Cloud Routing, Inbound ACD, Outbound Dialing, Call Tracking, Interactive Voice Response (IVR), Voice Broadcast, Disaster Recovery, Predictive Dialer, Real-Time Telemetry, CDR Reporting, Live Agent Chat and more. Through a consultative approach with each customer interaction, Connect First builds customized solutions to meet the needs of a discerning customer base.",,,,https://www.facebook.com/connectfirstinc
Convoso,https://www.crunchbase.com/organization/safesoft-solutions,http://www.convoso.com,"Call Center, SaaS, Software, Telecommunications","Administrative Services, Hardware, Software","Convoso's cloud-based call center software revolutionized the call center industry by empowering the admin, agent, and customer experience.","Convoso’s mission is to create innovations that enable contact center owners to hit performance metrics that they never thought possible. We are passionate about our customer’s success and have a proven track record of delivering outstanding results that drive more engaged call center agents, boost in margins, and breakthrough years in profit. Our predictive dialer with superior recycle logic—combined with lead management automation—empowers outbound contact centers to move more leads through the funnel faster. With our conversational AI agent, you can turn aged leads into live transfers. We consider our customers to be our partners and work hand in hand with them to achieve maximum results because without them we don’t exist. It is an amazing feeling to have a direct impact on our customer’s growth from head count and all the way to revenue and profits.",http://www.linkedin.com/company/606710,,http://twitter.com/convoso,https://www.facebook.com/Convoso/
CrazyCall,https://www.crunchbase.com/organization/crazy-call,https://www.crazycall.com/?utm_source=crunchbase.com&utm_medium=referral&utm_campaign=profile-link,"Call Center, SaaS, Software, Telecommunications, VoIP","Administrative Services, Hardware, Information Technology, Internet Services, Messaging and Telecommunications, Software",CrazyCall helps you to increase sale and connect with your customers.,"Crazy Call is a Cloud Telephony for Call Centers & Sales Professionals that's accessible right within your browser, without any installation or complex billing. All it takes is for you to pick a number and start calling prospects! It allows you to organize and manage sales, control the quality of their calls, reduce costs, integrate and automate telesales campaigns. CrazyCall is also an easy to use sales enablement platform that increases cold-call ROI and helps with website conversions.",https://www.linkedin.com/company/6382503,,https://twitter.com/CrazyCallApp,https://www.facebook.com/CrazyCallSoftware
Dextr.Cloud,https://www.crunchbase.com/organization/dextr-cloud,https://www.dextr.cloud,"Call Center, Contact Management, Information Technology, SaaS","Administrative Services, Information Technology, Software","Contact Center, Call Center, SaaS, AWS Connect",Dextr.Cloud is the premier provider of AWS Connect contact center solutions. Dextr is the glue for AWS Connect.,https://www.linkedin.com/company/dextr-cloud/,,,
Dialpad,https://www.crunchbase.com/organization/dialpad,https://www.dialpad.com,"Artificial Intelligence, Call Center, Meeting Software, Mobile, Mobile Apps, SaaS, Software, Telecommunications","Administrative Services, Apps, Artificial Intelligence, Data and Analytics, Hardware, Messaging and Telecommunications, Mobile, Science and Engineering, Software",Dialpad is an AI-powered cloud communications platform that turns conversations into opportunities and helps teams make smart calls.,"Dialpad is an AI-powered cloud communications platform that turns conversations into opportunities and helps teams make smart calls. The communications and contact center provider offers native, real-time transcription, automated note-taking, live sentiment, and voice analytics to market, and with the rising demand for remote collaboration. It offers Dialpad, Dialpad Sell, UberConference, and Dialpad Contact Center solutions that are all powered by VoiceAI. These products cover the full range of modern business communications needs with a range of system software that offers voice, video, group messaging, SMS, MMS, conferencing, screen sharing, and document sharing services that enable employees to collaborate securely from anywhere across any device, in a single platform. Aside from OMERS, investors of the company include Amasia, Andreessen Horowitz, Felicis Ventures, GV, ICONIQ Capital, Salesforce Ventures, Scale Ventures, Section 32, Softbank, Work-Bench, and SoftBank. Alex Cornell, Brian Peterson, Craig Walker, and John Rector incorporated Dialpad in San Francisco, California in 2011.",https://www.linkedin.com/company/dialpad,Unicorn,https://twitter.com/DialpadHQ,https://www.facebook.com/Dialpadhq
Edifius,https://www.crunchbase.com/organization/edifius,https://www.edifius.com/,"Artificial Intelligence, B2B, Call Center, Information Technology, Internet, Machine Learning, Natural Language Processing, SaaS, Software","Administrative Services, Artificial Intelligence, Data and Analytics, Information Technology, Internet Services, Other, Science and Engineering, Software","Edifius is an AI-Powered B2B SaaS platform to improve operational efficiency, customer experience, and team productivity.","Edifius is reinventing the way businesses manage their operations and customers by leveraging technology, data, voice, artificial intelligence, machine learning, NLU, and NLP to increase personalization, workforce digital transformation, autonomous marketing, and self-service automation.",https://www.linkedin.com/company/edifius,,https://twitter.com/edifius_ai,https://www.facebook.com/edifiuscorp
EpiAnalytics,https://www.crunchbase.com/organization/epianalytics,http://www.epianalytics.com,"Artificial Intelligence, Call Center, Machine Learning, Real Time, Software","Administrative Services, Artificial Intelligence, Data and Analytics, Other, Science and Engineering, Software","EpiAnalytics integrated artificial intelligence and machine learning solutions transform corporate data, increasing efficiency and BI.","EpiAnalytics is a software publishing company that offers real-time text analytic solutions to automate business processes such as advanced case routing, and email and survey classification. It also provides business intelligence solutions for decision support. The company’s easy-to-use, on-demand software transforms customer comments and feedback into valuable insights that can be utilized across its clients’ organizations and to improve their business processes in real time. Founded in 2008, EpiAnalytics is based in Carlsbad, California.",https://www.linkedin.com/company/epianalytics-inc.,,http://twitter.com/EpiAnalytics,http://www.facebook.com/pages/EpiAnalytics-Inc/157284200953969
FidoTrack,https://www.crunchbase.com/organization/fidotrack,http://www.fidotrack.com/,"Call Center, Information Technology, Software","Administrative Services, Information Technology, Software","FidoTrack, one of the providers of Cloud Gamification software and services for call centers.","FidoTrack, one of the providers of Cloud Gamification software and services for call centers. The FidoTrack system is already deployed to call centers throughout the U.S. and has achieved amazing measurable ROI results for 100% of clients to date. The dramatic improvements in productivity combined with the huge reduction in employee turnover make the FidoTrack system the best in the marketplace. ",https://in.linkedin.com/company/fidotrack,,https://twitter.com/fidotrack,
Five9,https://www.crunchbase.com/organization/five9,http://www.five9.com,"Call Center, Enterprise Software, SaaS, Sales, Software","Administrative Services, Sales and Marketing, Software","Five9 is a company providing cloud-based call center software for sales, marketing and support.","Five9 is a leading provider of cloud software for the enterprise contact center market, bringing the power of the cloud to thousands of customers and facilitating approximately three billion customer interactions annually. Since 2001, Five9 has led the cloud revolution in contact centers, helping organizations transition from legacy premise-based solutions to the cloud. Five9 provides businesses reliable, secure, compliant and scalable cloud contact center software designed to create exceptional customer experiences, increase agent productivity and deliver tangible business results.",http://www.linkedin.com/company/five9,,http://www.twitter.com/Five9,http://www.facebook.com/callcentersoftware
Genesys,https://www.crunchbase.com/organization/genesys,http://www.genesys.com,"Business Intelligence, Call Center, Cloud Infrastructure, Contact Management, CRM, Customer Service, Enterprise Software, SaaS, Software, Text Analytics","Administrative Services, Data and Analytics, Hardware, Information Technology, Internet Services, Other, Professional Services, Sales and Marketing, Software",Genesys is a global leader in providing omnichannel customer experience (CX) and contact center solutions in the cloud and on-premises.,"Genesys® powers more than 25 billion of the world’s best customer experiences each year. Their success comes from connecting employee and customer conversations on any channel. Every day, 11,000 companies in more than 100 countries trust the industry’s #1 customer experience platform to drive great business outcomes and create lasting relationships. Combining the best of technology and human ingenuity, Genesys builds solutions that mirror natural communication and work the way you think. Their industry-leading solutions foster true omnichannel engagement because they perform equally well across channels, on-premise and in the cloud. Experience communication as it should be: fluid, instinctive and profoundly empowering.",http://www.linkedin.com/company/genesys,,http://twitter.com/Genesys,http://www.facebook.com/genesys
Global Call Forwarding,https://www.crunchbase.com/organization/global-call-forwarding,https://www.globalcallforwarding.com,"Call Center, Enterprise Software, Telecommunications, VoIP","Administrative Services, Hardware, Information Technology, Internet Services, Messaging and Telecommunications, Software","Address: 3333 S Congress Ave #300 Delray Beach, FL 33445 ","Global Call Forwarding is a provider of international local, mobile, and toll free numbers in over 160 countries across the globe that are loaded with features such as call recording, sms forwarding, rollover, outbound calling, advanced routing, API, PBX, unlimited extensions, sequential forwarding, simultaneous ringing, custom ring back tones, and more.",https://www.linkedin.com/company/united-world-telecom-lc/,,https://twitter.com/forwardcalls,https://www.facebook.com/GlobalCallForwarding/
Gridspace,https://www.crunchbase.com/organization/gridspace,https://www.gridspace.com/,"Call Center, Enterprise Software, Information Technology, Software, Speech Recognition, Telecommunications","Administrative Services, Data and Analytics, Hardware, Information Technology, Software",Gridspace scans and automates voice calls for contact centers and developers.,"Gridspace was formed as a collaboration between SRI Speech Labs, the lab behind Siri, and a multidisciplinary team of designers and engineers. The company’s software makes it easy for contact centers and developers to quickly understand customer requests, synchronize agent responses, and drive successful outcomes. Legacy voice systems were not designed for modern speech services. Gridspace built a novel speech processing system in the house to enable low-latency speech analytics, live agent guidance, and natural-sounding, interwoven voice bots.",http://www.linkedin.com/company/gridspace-inc,,http://twitter.com/gridspaceinc,
Hit Rate Solutions,https://www.crunchbase.com/organization/hit-rate-solutions,http://www.hitratesolutions.com,"Call Center, Direct Marketing, Enterprise, Enterprise Software, Outsourcing, Virtual Assistant","Administrative Services, Other, Professional Services, Sales and Marketing, Software",Hit Rate Solutions is a global provider of contact center services to companies worldwide.,"Hit Rate Solutions is a global provider of outsourced contact center services to companies worldwide and deliver customer service for international market leaders. Hit Rate Solutions delivers exceptional customer service and technical support for various industries. Our low-risk solutions enable great service that answers our clients’ needs. Hit Rate Solutions provides high-quality customer care and are consistently ranked by our clients and their customers. We help our clients excel in today’s competitive global business environment by seamlessly managing the two components of any successful call center campaign: technology and people. Our highly trained and talented employees will serve as your virtual assistants, delivering solutions through various CRM, Knowledge Management and other web applications.",https://www.linkedin.com/company/hit-rate-solutions,,https://twitter.com/hitratesolution,https://www.facebook.com/HitRateSolutions/
injixo,https://www.crunchbase.com/organization/injixo,https://www.injixo.com/us,"Call Center, Customer Service, Software","Administrative Services, Other, Professional Services, Software","injixo helps you to manage your workforce anytime and anywhere. With our mobile-ready applications, you can easily run your call center.","injixo WFM is a cloud WFM application for contact centres of all sizes. It is easily accessed via a web browser and can be used without a lengthy setup process. It supports the entire WFM cycle, from multi-channel forecasting, requirement and capacity planning through single- and multi-skill scheduling, realtime management, agent self-service on smartphone, schedule adherence monitoring and comprehensive reporting functions. injixo WFM costs just £9 per user per month, pay-as-you-go. A full onboarding programme is included, facilitated by our team of Customer Success Managers, all of whom are former resource planners with many years of first-hand experience. Over 200 UK contact centres have already chosen injixo, with more joining every week. We are are the winner of multiple awards. Come and find out why: You can see injixo in action, chat with our WFM Experts - and check out our new self-teaching fully automated forecasting engine! ",https://www.linkedin.com/company/injixo/,,https://twitter.com/injixo,
Interactive Intelligence,https://www.crunchbase.com/organization/interactive-intelligence-group,https://www.inin.com/,"Call Center, Customer Service, Software","Administrative Services, Other, Professional Services, Software","Interactive Intelligence is a software and cloud services for customer engagement, communications and collaboration.","Interactive Intelligence Group, Inc. is a provider of software and cloud services for customer engagement, communications and collaboration. The Company operates in the segment of interaction management software solutions licensing and associated services.",,,,
Invoca,https://www.crunchbase.com/organization/invoca,http://www.invoca.com,"Advertising, Analytics, Call Center, Digital Marketing, Enterprise Software, Marketing, Marketing Automation, Telecommunications","Administrative Services, Advertising, Data and Analytics, Hardware, Sales and Marketing, Software","Invoca specializes in the fields of inbound call marketing, call tracking, call intelligence, and pay-per-call advertising.","Invoca is an AI-powered call tracking and conversational analytics company that brings the depth of marketing analytics traditionally limited to digital consumer interactions. The company specializes in the fields of inbound call marketing, call tracking, call intelligence, and pay-per-call advertising.",https://www.linkedin.com/company/invoca-com/,,http://twitter.com/Invoca,http://www.facebook.com/invoca
Kore.ai,https://www.crunchbase.com/organization/kore-ai,https://kore.ai/,"Artificial Intelligence, Call Center, Collaboration, Enterprise Software, Machine Learning, Messaging, Natural Language Processing, PaaS, Software, Virtual Assistant","Administrative Services, Artificial Intelligence, Data and Analytics, Information Technology, Internet Services, Messaging and Telecommunications, Other, Science and Engineering, Software","AI based, enterprise focused conversational and digital platforms and products that automate and optimize enterprise digital interactions","Kore.ai provides platforms and solutions to o enable enterprises to automate and enhance digital interactions with their customers, employees and partners. Kore.ai provides a Conversational AI based no/low code enterprise platform to create virtual assistants with conversational & digital user experiences. Kore.ai also provides domain trained pre-built virtual assistants for Banking, Insurance, HR and IT Support. The company has launched an enterprise digital assistant called Kora which acts as a universal/master/concierge assistant with inbuilt skills for knowledge mgt, enterprise search and meetings/tasks mgt and extensible with custom chatbot/digital, RPA & search skills. In addition, the company provides a cloud based call automation and digital deflection service called Deflect.ai.",https://www.linkedin.com/company/kore-inc/,,https://twitter.com/koredotai,https://www.facebook.com/KoreDotAI/
Krista Software Inc.,https://www.crunchbase.com/organization/krista-software,https://kristasoft.com,"Call Center, Industrial Automation, Marketing Automation, Sales Automation, Software","Administrative Services, Information Technology, Manufacturing, Sales and Marketing, Science and Engineering, Software","Krista is a modern, Conversational Robotic Process Automation, RPA, easily leverage existing IT assets in business workflows.","Krista is a modern, Conversational Robotic Process Automation, RPA, platform designed to easily leverage existing IT assets in business workflows. Krista’s unique informal approach enables business process owners to quickly build new workflows without waiting in line for expensive IT or development resources. Creating automation in Krista is simple. It is just like describing a conversation between your people and your systems.",https://www.linkedin.com/company/kristasoftsoftware/,,https://twitter.com/KristaSoft,https://www.facebook.com/KristasoftRPA/
LiveVox,https://www.crunchbase.com/organization/livevox,http://www.livevox.com,"Call Center, Cloud Computing, CRM, Customer Service, Enterprise Software, SaaS, Software","Administrative Services, Information Technology, Internet Services, Other, Professional Services, Sales and Marketing, Software","LiveVox is a next-generation contact center platform that seamlessly integrates omnichannel communications, CRM and WFO.","LiveVox is a next-generation contact center platform that powers more than 14 billion interactions a year. We seamlessly integrate omnichannel communications, CRM, and WFO capabilities to deliver an exceptional agent and customer experience while reducing compliance risk. Our reliable, easy-to-use technology enables effective engagement strategies on communication channels of choice to drive performance in your contact center. Our battle-tested risk mitigation and security tools help clients maximize their potential in an ever-changing business environment. With 20 years of pure cloud expertise, LiveVox is at the forefront of cloud contact center innovation. Our more than 500 global employees are headquartered in San Francisco, with offices in Atlanta; Columbus; Denver; New York City; St. Louis; Medellin, Colombia; and Bangalore, India.",https://www.linkedin.com/company/livevox,,http://twitter.com/LiveVox,https://www.facebook.com/livevox-inc-191482530869894
MaestroQA,https://www.crunchbase.com/organization/adtrib,https://www.maestroqa.com,"Call Center, Customer Service, SaaS, Software","Administrative Services, Other, Professional Services, Software",MaestroQA is a software company that offers quality assurance and coaching software for customer care teams.,"MaestroQA is a software company that offers quality assurance software for customer care teams. It helps companies transform their customer service from a department that is viewed as a cost into a growth driver - one that drives customer loyalty and happiness. The company also offers a robust set of features to help improve customer support including CRM and support tools integrations, customizable scorecards, agent dashboards, workflow automation, data warehouse integrations, strict security and compliance, and much more. MaestorQA was founded in 2013 and is headquartered in New York, NY, United States.",https://www.linkedin.com/company/maestroqa,,https://twitter.com/maestroqa,https://www.facebook.com/MaestroQA-1059561310823979/
MAP Communications,https://www.crunchbase.com/organization/map-communications,https://www.mapcommunications.com/,"Call Center, Information Technology, Software, Telecommunications","Administrative Services, Hardware, Information Technology, Software",MAP Communications is a provider of live answering and call center services.,"Provider of live answering and call center services. The company's internally developed operational call-handling platform called ECHO software is a robust call-handling application that guides their live agents logically through the call for a professional, comprehensive customer support solution, enabling businesses to provide a 24-hour point of contact to their customers.",https://www.linkedin.com/company/map-communications/,,https://twitter.com/MAPCommInc,https://www.facebook.com/mapcommunications/
NetByTel,https://www.crunchbase.com/organization/netbytel,http://www.netbytel.com,"Call Center, Industrial, Software","Administrative Services, Manufacturing, Software",NetByTel provides speech recognition call center software solutions for its clients.,"NetByTel provides speech recognition call center software solutions for its clients. It offers a multichannel leverage point for its retail, catalog, direct response, publishing, travel or hospitality, finance, and manufacturing clients.",,,,
NICE inContact,https://www.crunchbase.com/organization/nice-incontact,http://www.niceincontact.com/,"Artificial Intelligence, Call Center, Consumer Electronics, Customer Service, Information Technology, Machine Learning, Software, Telecommunications","Administrative Services, Artificial Intelligence, Consumer Electronics, Data and Analytics, Hardware, Information Technology, Other, Professional Services, Science and Engineering, Software",NICE inContact makes it easy and affordable for organizations around the globe to provide exceptional customer experiences.,"NICE inContact makes it easy and affordable for organizations around the globe to provide exceptional customer experiences while meeting key business metrics. NICE inContact provides the world’s #1 cloud customer experience platform, NICE inContact CXone™, combining best-in-class Omnichannel Routing, Workforce Optimization, Analytics, Automation and Artificial Intelligence on an Open Cloud Foundation. NICE inContact is a part of NICE (Nasdaq: NICE), the worldwide leading provider of both cloud and on-premises enterprise software solutions. ",https://www.linkedin.com/company/11934/,,https://twitter.com/incontact,https://www.facebook.com/NICEinContact/
