Organization Name,Organization Name URL,Website,Industries,Industry Groups,Description,Full Description,LinkedIn,Hub Tags,Twitter,Facebook,CB Rank (Organization)
iLearningEngines,https://www.crunchbase.com/organization/ilearningengines,https://www.ilearningengines.com,"E-Learning, Service Industry, Training","Education, Other, Software",iLearningEngines is a Training as a Service Technology platform for Enterprises to drive mission critical outcomes and behaviors.,"iLearningEngines is a Learning as a service platform for enterprises to drive Mission Critical Behavior. ILE has brought to market a revolutionary credits-based LMS and Collaborative Engine that is transforming the way organizations deliver mission critical and compliance training. As demonstrated by several case studies, ILE goes beyond providing analytics to organizations; it provides a much-needed ability to drive outcomes for organizations by closing the loop on learning. Customers that have deployed the ILE technology have showcased their training efforts with great success to their customers and prospects as a differentiator.",,,,,"131,259"
ArborBridge,https://www.crunchbase.com/organization/arborbridge,http://www.arborbridge.com,"E-Learning, EdTech, Education, Tutoring","Education, Software",ArborBridge prepares students for US college admissions success by guiding them to higher SAT scores and better grades.,"ArborBridge prepares students for US college admissions success by guiding them to higher SAT scores and better grades. Our tutors connect seamlessly with students, one-on-one, using cutting-edge online tutoring technology. ArborBridge directors and instructors have graduated from the most prestigious universities and have rich backgrounds in tutoring and classroom teaching. Their abilities are powerfully enhanced by our proprietary training, curricula, and technological resources - all of which can be adapted to students' individual needs. Above everything, our staff share tremendous passion for supporting students and cultivating a life-long love of learning. All of our services incorporate regular assessments and goal-setting.  The meticulous collection of data - including evaluations, lesson notes from tutors, and parent and school feedback - drives the structure and evolution of each student's program. Regardless of their initial skill levels or starting scores, our students feel empowered to challenge themselves and take ownership of their success.",https://www.linkedin.com/company/arborbridge,,http://twitter.com/arborbridge,http://www.facebook.com/ArborBridge,"131,620"
SweetRush Inc.,https://www.crunchbase.com/organization/sweetrush-inc,http://sweetrush.com,E-Learning,"Education, Software",SweetRush is an e-learning company providing virtual classroom and gamification solutions.,"SweetRush specializes in end-to-end solutions for the design and development of custom blended learning initiatives.SweetRush’s focus on team culture and mastery of performance improvement is reflected in loyal clients, a near-zero turnover of teammates, a 16-year track record of success, and a remarkable portfolio. Their work with clients has earned us gold awards from their peers and high ranking on the top training industry lists.",https://www.linkedin.com/company/107915,,https://www.twitter.com/sweetrushinc,https://www.facebook.com/sweetrushinc,"133,407"
ChatENG,https://www.crunchbase.com/organization/chateng,https://chateng.live,"E-Learning, Education, Internet","Education, Internet Services, Software",ChatENG provides live remote English classes focused on speaking that are engaging and immersive to children.,"ChatENG provides live remote English classes focused on speaking that is engaging and immersive to children. It helps children to improve their skill in speaking english. The company was founded in 2017 and headquartered in Boston, Massachusetts.",https://www.linkedin.com/company/chateng/,,,,"133,542"
FastBridge Learning,https://www.crunchbase.com/organization/fastbridge-learning,https://www.fastbridge.org/,"E-Learning, Education","Education, Software",FastBridge Learning is a research-driven assessment platform that transforms the way teachers measure and monitor student progress.,FastBridge Learning is a research-driven assessment platform that transforms the way teachers measure and monitor student progress.,https://www.linkedin.com/company/fastbridge-learning?trk=biz-companies-cym,,https://twitter.com/FastBridgeLearn,https://www.facebook.com/FastBridgeLearning/?ref=hl,"133,621"
KnowFully,https://www.crunchbase.com/organization/knowfully,https://www.knowfully.com/,"E-Learning, Education, Higher Education","Education, Software","KnowFully is a provider of end-to-end professional education in the accounting, finance, and healthcare sectors.","KnowFully is a provider of end-to-end professional education in the accounting, finance, and healthcare sectors. KnowFully's brands enable students and professionals to more efficiently prepare for and pass professional licensure exams, satisfy required credit hours to maintain credentials, and leverage the comprehensive, practical, in-depth continuing education they need to remain at the forefront of their industries thereafter.",https://www.linkedin.com/organization-guest/company/knowfully,,,,"134,924"
Pragmatic Leaders,https://www.crunchbase.com/organization/pragmatic-leaders,http://pragmaticleaders.io,"E-Learning, EdTech, Education","Education, Software","Pragmatic Leaders is an ecosystem solving real-world case-based product management courses for pragmatic tips, tools, events, and jobs.","Pragmatic Leaders is an ecosystem solving real-world case-based product management courses for pragmatic tips, tools, events, and jobs. The ecosystem is built on 3 pillars of Educate, Engage, and Employ. The Educate provides pragmatic training and a structured pedagogy to prepare product managers of tomorrow, The Engage builds serendipitous engagement platforms and reduce the learning curve and the ensuing frustrations by enabling quick resolutions via a to-the-point Q&A community, and The employ makes an easy transition into product jobs.  Founded in 2018 and is based in San Francisco, California, United States.",https://www.linkedin.com/company/pragmaticleaders/,,https://twitter.com/pragmaticlead,https://www.facebook.com/pragmaticleaders/,"135,091"
Praxis Labs,https://www.crunchbase.com/organization/praxis-labs,https://praxis2018.github.io/,"Compliance, Corporate Training, E-Learning, EdTech, Education, Human Resources, Software, Training, Virtual Reality","Administrative Services, Education, Hardware, Professional Services, Software","Praxis reimagines corporate bias training, integrating research-backed curriculum with cutting edge VR technology",Praxis Labs advances diversity and inclusion outcomes through perspective-taking VR-based unconscious bias trainings.,,,,,"135,294"
School Specialty,https://www.crunchbase.com/organization/school-specialty,http://www.schoolspecialty.com,"Customer Service, E-Learning, Education","Education, Other, Professional Services, Software","School Specialty offers deals on educational materials, school supplies, and teacher approved resources.","School Specialty, Inc., together with its subsidiaries, distributes supplies, furniture, technology products, supplemental learning products, and curriculum solutions to the education marketplace in the United States and Canada.",http://www.linkedin.com/company/school-specialty-inc.,,http://twitter.com/SchoolSpecialty,http://www.facebook.com/SchoolSpecialty,"135,839"
ProfStream,https://www.crunchbase.com/organization/profstream,https://profstream.com,"Collaboration, E-Learning, Education, Software","Education, Other, Software",ProfStream is a curriculum development and distribution tool that uses Git and Markdown.,"ProfStream is a curriculum development and distribution tool that leverages the power of Git and Markdown to enable rich collaboration. The tool is intended for coding schools to be able to develop curriculum with the tools that developers know, as well as securely distribute curriculum to their students.",,,http://twitter.com/ProfStream,,"136,698"
Carrus Learn,https://www.crunchbase.com/organization/carrus-learn,https://www.carruslearn.com/,"E-Learning, Health Care","Education, Health Care, Software",Carrus is an E-learning company working in healthcare begins with a passion for helping others—a passion.,"Carrus is an E-learning company working in healthcare begins with a passion for helping others—a passion they understand. At Carrus, they help people improve their lives and advance their careers through exceptional healthcare learning, and they ’re committed to providing the best experiences and outcomes possible. No matter where you are in your healthcare career, their training and continuing education programs are built to help you achieve your goals.",https://www.linkedin.com/company/carruslearn/,,,,"136,750"
Creativebug,https://www.crunchbase.com/organization/creativebug,http://www.creativebug.com,"Art, E-Learning, Video","Education, Media and Entertainment, Software, Video",Creativebug offers online art and design classes and workshops.,"Founded on the belief that we’re all creators at heart, Creativebug is the first-ever subscription-based, award-winning video-learning site for art and craft classes.  We’re home to a global community of three groups of creatives—our expert instructors (those that star in the videos), our keen-eyed editorial team (those that make the videos) and our inspired community of members (those that watch, learn, do and share). You subscribe to our platform, support a group of artists, and we provide you with access to content to fuel your creative lifestyle.  Our subscription-based structure allows us to curate the best artists out there, bringing together a team of lifelong experts and creative gurus. All of our classes are filmed by our top-notch videography crew in our San Francisco-based studio—so our content is quality-controlled and unlike anything else out there.",https://www.linkedin.com/company/creativebug,,https://twitter.com/creativebug,https://www.facebook.com/creative.bug,"137,356"
BIGVU,https://www.crunchbase.com/organization/amselem,https://www.bigvu.tv,"E-Learning, Social Media Marketing, Video, Video Streaming","Content and Publishing, Education, Media and Entertainment, Sales and Marketing, Software, Video","BIGVU empowers SMBs with an easy-to-use video creation app for social media, coaching and content marketing.","With BIGVU, anyone create a polished video for his or her business in a matter of minutes.   BIGVU is a professional TV studio in your pocket. Users read from a teleprompter app while recording their presentation, mix photos, video shots and tweets that are automatically transformed into stunning video sequences.",https://www.linkedin.com/company/10500794/,,https://twitter.com/videoinspire,https://www.facebook.com/socialvideocreator/,"137,548"
Emotional ABCs,https://www.crunchbase.com/organization/emotional-abcs,http://EmotionalABCs.com,"E-Learning, EdTech, Education","Education, Software",Emotional ABCs is America's Most Awarded evidence-based Social Emotional Learning (SEL) program for children ages 4-11.,"Emotional ABCs is America's #1 Awarded evidence-based Social Emotional Learning (SEL) curriculum. Designed for children ages 4-11, Emotional ABCs teaches children how to figure out What they're feeling, Why they might be having that emotion, and How to make good choices in response to what they are experiencing. A Common Sense Education ""Top Pick"", the program is used by parents & teachers in 75 countries & in more than 60,000 schools across the USA. Learn more at EmotionalABCs.com",https://www.linkedin.com/company/emotional-abcs,,https://twitter.com/EmotionalABCs,https://www.facebook.com/EmotionalABCs,"137,980"
"Catapult Learning, Inc.",https://www.crunchbase.com/organization/catapult-learning,http://www.catapultlearning.com/,"E-Learning, EdTech, Education","Education, Software","Technology-enabled, K-12 services provider that offers a comprehensive portfolio of education solutions","Catapult Learning, Inc. has dedicated over four decades to providing outstanding education solutions that generate demonstrable academic achievement and better life outcomes for students, regardless of their learning barriers or other challenges they may face. The company’s team of 5,600 educators works to achieve sustained academic gains and build teacher and leadership capacity through evidence-based programs that include intervention services, special education and alternative education programs, and professional development solutions. Founded in 1976 and headquartered in Camden, New Jersey, Catapult Learning partners with over 500 school districts, including 18 of the 20 largest school districts in the United States.",https://www.linkedin.com/company/catapult-learning/,,http://twitter.com/CatapultLearn,https://www.facebook.com/catapultlearning,"138,479"
CYPHER LEARNING,https://www.crunchbase.com/organization/cypher-learning,http://www.cypherlearning.com,"E-Learning, Education, Software, Universities","Education, Other, Software","CYPHER LEARNING is a company that specializes in providing learning platforms for schools, businesses, and entrepreneurs around the world.","CYPHER LEARNING is a company that specializes in providing learning platforms for schools, businesses, and entrepreneurs around the world.  CYPHER LEARNING has three products: NEO an LMS for schools and universities, MATRIX an LMS for businesses, and INDIE an LMS for entrepreneurs. CYPHER LEARNING is currently the only company that offers learning management systems in all major e-learning sectors: education, business, and individuals. All products are known for their intuitive design, powerful features, and competitive pricing. The platforms are used by over 20,000 organizations, support 40+ languages, have millions of users, and have won several awards.",https://www.linkedin.com/company/cypher-learning,,https://www.twitter.com/cypherlearning,https://www.facebook.com/cypherlearning,"139,017"
GALE CENGAGE Learning,https://www.crunchbase.com/organization/gale-cengage-learning,http://www.gale.cengage.com,"E-Learning, Education, Higher Education, Publishing","Content and Publishing, Education, Media and Entertainment, Software","Cengage Learning delivers highly customized learning solutions for colleges, universities, professors, students, libraries, government","Cengage Learning delivers highly customized learning solutions for colleges, universities, professors, students, libraries, government agencies, corporations and professionals around the world. Gale, part of Cengage Learning, serves the world's information and education needs through its vast and dynamic content pools, which are used by students and consumers in their libraries, schools and on the Internet. It is best known for the accuracy, breadth and convenience of its data, addressing all types of information needs â€“ from homework help to health questions to business profiles â€“ in a variety of formats.",https://www.linkedin.com/showcase/3836963/,,https://twitter.com/galecengage,https://www.facebook.com/GaleCengage/,"139,166"
Avela Education,https://www.crunchbase.com/organization/avela-education,https://avela.org,"E-Learning, EdTech, Education, Primary Education, Secondary Education, Software","Education, Software",Software to advance equity in education.,"Avela is advancing equity in education. We provide software and services to empower school districts to support parents, run enrollment lotteries, and make data-driven decisions.  Our first product is a platform for facilitating talent placement. Whether assigning students to classrooms, teachers to schools, volunteers to projects, or employees to teams,  organizations use our software to easily run efficient matches that are fair, transparent, and equitable. Our tools, designed by renowned MIT professors,  are built on Nobel Prize-winning algorithms. Since 2003, our team has worked with K12 districts across the country, including New York, Boston, and New Orleans, to reform enrollment processes and improve equity. We’d love to work with your organization or district as well!  Learn more at https://avela.org/.",https://linkedin.com/company/avela,,https://twitter.com/avelaeducation,https://facebook.com/avela.education,"139,353"
Aztec Software,https://www.crunchbase.com/organization/aztec-software,http://aztecsoftware.com,"E-Learning, Software","Education, Software",Aztec Software focuses on software product development services that accelerate the creation of software products.,"Founded in 1980 by educators, not technologists, Aztec has been in the business of improving adult and young adult lives through computerized skills remediation from its inception. With an industry-leading understanding of the way in which its student population learns using a computer, the company has expanded its product set beyond academic material and into all aspects of the transitioning worker's retraining and survival. Used throughout the country in community colleges, correctional facilities, one-stop centers, job corps centers, middle schools, and high schools, the Aztec Learning System has become an integral part of today’s complete educational curriculum.  Designed in a modular format, the system is deliverable on standalone PCs, local and wide area networks, or through the Internet.",https://www.linkedin.com/company/aztec-software/?originalSubdomain=in,,https://twitter.com/aztecsoftware?lang=en,,"139,428"
School District 1j Multnomah County Oregon,https://www.crunchbase.com/organization/school-district-1j-multnomah-county-oregon,,"E-Learning, EdTech, Education","Education, Software","School District No 1j Multnomah County Oregon is a public school district located in Portland, Oregon.","School District No 1j Multnomah County Oregon is a public school district located in Portland, Oregon.",,,,,"139,514"
Artpath,https://www.crunchbase.com/organization/artpath,https://artpath.net/,"Art, E-Learning, Health Care, Video","Education, Health Care, Media and Entertainment, Software, Video",Artpath Method is an eLearning experience based on a disruptive methodology.,The Artpath Method is an eLearning experience based on a disruptive methodology that combines a curated selection of the most relaxing art on Earth with the most effective meditation techniques.,https://www.linkedin.com/company/artpathmeditation/about/,,,https://www.facebook.com/artpath.net/,"141,245"
Blueprint Test Preparation,https://www.crunchbase.com/organization/blueprint-test-preparation,http://blueprintlsat.com,"Consulting, E-Learning, Education, Higher Education, Tutoring","Education, Professional Services, Software",Blueprint Test Preparation is a higher education company offering live LSAT class and online LSAT course services.,"Blueprint is the premier LSAT test preparation provider in the U.S., offering in-person and asynchronous online courses, private tutoring, self-study materials and application consulting services.  Blueprint’s live classroom instruction is offered in 25+ locations in eight states around the country.  Blueprint leverages a unique edutainment-oriented content creation capability and the latest adaptive learning technology to support individualized study plans.",https://in.linkedin.com/company/blueprint-test-preparation,,https://www.twitter.com/blueprintlsat,https://www.facebook.com/blueprintlsatprep,"141,430"
The Judge Group,https://www.crunchbase.com/organization/the-judge-group-inc,https://www.judge.com/,"E-Learning, Information Technology, Professional Services","Education, Information Technology, Other, Software",Results through the Power of Experience.,"The Judge Group services the IT and engineering needs of its clients. Founded in 1970, The Judge Group is a privately owned leading global professional services firm specializing in technology consulting, staffing solutions and corporate training. Their solutions are successfully delivered through a workforce of 4,500 professionals and an international network of over 32 practice offices.",http://www.linkedin.com/company/the-judge-group?goback=.cps_1259681693551_1,,http://twitter.com/JudgeGroup,http://www.facebook.com/judgegroup,"141,478"
