Organization Name,Organization Name URL,Website,Industries,Industry Groups,Description,Full Description,LinkedIn,Hub Tags,Twitter,Facebook,CB Rank (Organization)
K12Planet.com,https://www.crunchbase.com/organization/k12planet-com,http://www.k12planet.com,"E-Learning, Education, Internet","Education, Internet Services, Software",K12Planet is a revolutionary web site that bridges the gap between school and home and allows school districts.,"K12Planet® is a revolutionary web site that bridges the gap between school and home and allows school districts to build a powerful online learning community. Available to any school district currently using Chancery's Win School®, Mac School® or Chancery SMS™ student information systems, K12Planet provides an easy-to-use, secure, and comprehensive school-to-home portal that gives parents and students instant access to grades, attendance, homework assignments, and school activities. Best of all, K12Planet relieves teachers and administrators of the time-consuming burden of double data entry. That's because K12Planet is updated automatically from the school district's student information system. Now school districts can leverage their existing technology investment to provide parents and students with information crucial to academic progress. Until K12Planet, information this useful was never this easy to provide. By giving students access to faster and more comprehensive feedback on their own performance, K12Planet empowers kids to take control of their academic progress. Other features help students organize their schedules, set their priorities, and access learning resources. And K12Planet is completely free of advertising and sponsorships.",https://www.linkedin.com/company/10114126,,https://www.twitter.com/mypowerschool,https://www.facebook.com/powerschool,"250,565"
MedForums,https://www.crunchbase.com/organization/medforums,https://www.medforums.com/,"E-Learning, Education, Health Care, Medical","Education, Health Care, Software",MedForums is a Developer of an online platform designed to facilitate physician community.,"Developer of an online platform designed to facilitate physician community. The company's platform allows users to crowdsource peers for finding the best medical education, practice tools and employment opportunities, enabling physicians to find the best medical products.",https://www.linkedin.com/company/medforums/,,https://twitter.com/medforums,https://www.facebook.com/medforums,"250,663"
VedaJunction,https://www.crunchbase.com/organization/vedajunction,https://www.vedajunction.com,"Artificial Intelligence, E-Learning, EdTech, Education, Machine Learning, SaaS, Software","Artificial Intelligence, Data and Analytics, Education, Science and Engineering, Software","SaaS, Edtech, Personalized Learning App, homeschooling, School Learning, Virtual tutor","VedaJunction is a machine-learning based intelligent personalized learning platform that provides each student/learner with a virtual tutor which creates individual learning plans that empowers them to learn at their own choice of time, place, pace, and on a customized learning path that works for them. VedaJunction solves the problem of schools’ failure to educate all students to mastery levels by providing a personal Intelligent Agent (AI) to tutor each learner on demand (any time, place and pace) using our customized individual learning plans to achieve their personal best",,,https://www.twitter.com/vedajunction,https://www.facebook.com/VedaJunction-A-personalized-learning-platform-for-Homeschooling-parents-452076748536733,"251,172"
Universal Education,https://www.crunchbase.com/organization/universal-education,https://www.ue-learn.com,"E-Learning, EdTech, Education, Mobile","Education, Mobile, Software",Ed-Tech,"Universal Education partners with companies and institutions all over the world to offer high-quality education resources through our technology platform including teachers, curriculum, and support services. We have a highly flexible partnership model that can be adjusted to any budget, schedule, or academic requirement. For more information please visit www.ue-learn.com",https://www.linkedin.com/company/ue-learn,,,,"252,303"
OnlineDegree.com,https://www.crunchbase.com/organization/onlinedegree-com,https://onlinedegree.com,"Continuing Education, E-Learning, EdTech, Education, Higher Education","Education, Software",Take Free Online Courses and You Could Get Your Freshman Year of College...Free,"At OnlineDegree.com, anyone can take online courses at their own pace and within the confines of their existing busy schedule...completely, free. Completed courses can then be transferred as earned credits to participating universities across the country, saving students both time and money. Higher education has now become more affordable and accessible to the millions of people unable to take the first step with full-time education.",https://www.linkedin.com/company/onlinedegree/,,https://twitter.com/onlinedegreecom,https://www.facebook.com/onlinedegreecom/,"252,502"
MyStemKits,https://www.crunchbase.com/organization/mystemkits,https://www.mystemkits.com/,"3D Printing, E-Learning, STEM Education","Education, Manufacturing, Science and Engineering, Software",MyStemKits is currently the provider of the largest online library of STEM curriculum in the world.,"MyStemKits was created by a diverse group of educators, artists and technologists leading the charge in the development of innovative 3D printing science, technology, engineering and math (STEM) manipulatives for K-12 classrooms. Each kit comes backed with vetted, interdisciplinary curriculum written by teachers and content-area experts that has been classroom tested. ",https://in.linkedin.com/company/mystemkits.com,,https://twitter.com/mystemkits?lang=en,https://www.facebook.com/mystemkits/,"254,061"
Hacktory,https://www.crunchbase.com/organization/hacktory,https://hacktory.ai,"Corporate Training, Cyber Security, E-Learning, Education, Training","Education, Information Technology, Privacy and Security, Software",Cybersecurity Educational Platform,"Hacktory is a gamified platform for cybersecurity training, it emulates real cases to teach how to use techniques of ethical hackers.",,,https://twitter.com/hacktory1,https://www.facebook.com/HacktoryApp/,"254,064"
ALL In Learning,https://www.crunchbase.com/organization/all-in-learning,https://www.allinlearning.com/,E-Learning,"Education, Software",ALL In Learning is the provider of an online education management platform,ALL In Learning is the provider of an online education management platform. The company specializes in designing and developing educational software systems for K-12 classrooms and campuses tools that improve student learning.,,,https://twitter.com/allinlearning,https://www.facebook.com/AllInLearning,"254,360"
SimplyAfterschool,https://www.crunchbase.com/organization/simplyafterschool-com,http://www.SimplyAfterschool.com,"B2B, E-Learning, EdTech, Education","Education, Other, Software",SimplyAfterschool is an online registration management for after school classes and camps.,"SimplyAfterschool is a web-based application that helps schools manage their afterschool program and camps where schools can easily communicate with parents, collect payments, and manage rosters in a few clicks. It was founded in 2017 and is headquartered in  Los Angeles, California.",https://www.linkedin.com/company/simplyafterschool,,,,"255,461"
GRC Solutions,https://www.crunchbase.com/organization/grc-solutions,http://www.grcsolutions.co,"E-Learning, Education, Training","Education, Software",Adaptive eLearning company focussed on compliance training,"GRC Solutions is a recognized leader in the online compliance training market. As a specialist compliance eLearning publisher, we know what works in compliance training and use innovative technology solutions to assist organizations in reducing mandatory training hours, minimizing push back from employees and improving training outcomes.  Our Salt Adaptive platform is a key tool for use by compliance managers to build, publish and distribute essential compliance training material to users. The platform helps focus users on training outcomes not hours, improving cognitive engagement, whilst providing enhanced reporting and data analytics to ensure that compliance managers can see what is effective in their organization and prove out an ROI on training.  We also publish a broad range of legal compliance, risk management and ethics training courses and have offices in New York, Singapore, New Zealand and across Australia to support an expanding number of jurisdictions around the world. We specialize in adaptive eLearning for compliance, improving speed to competency and reducing mandatory training hours. With our award winning Compliance Learning Management System, Salt® Web, and our adaptive learning content management system, Salt® Adaptive, we help hundreds of companies navigate complex legal and regulatory environments and build resilient organisational cultures. Our training courses can be taken off-the-shelf or tailored for any industry. We also build custom courses to suit client’s internal policies & procedures. We currently work with clients in finance services, pharmaceuticals, construction, mining, oil, and healthcare industries as well as not-for-profit organisations and government bodies.",https://www.linkedin.com/company/grc-solutions-pty-ltd,,https://www.twitter.com/grc_solutions,https://www.facebook.com/421843104616314,"256,320"
Zunos,https://www.crunchbase.com/organization/zunos,https://www.zunos.com,"Corporate Training, E-Learning, Gamification, Gaming, Training","Education, Gaming, Software",Zunos is a digital learning platform that offers gamified employee training programs.,"Zunos is a digital learning platform that offers gamified employee training programs. Its gamification training software is designed for the modern business and encourages competition, boost engagement, and inspire employees to learn daily so they can always stay at the top of their game. Zunos was founded in 2012 and is based in San Francisco, California.",https://www.linkedin.com/company/zunos/,,https://twitter.com/GetZunos,https://www.facebook.com/zunosapp/,"257,771"
Educere LLC,https://www.crunchbase.com/organization/educere-llc,http://educere.net/,"E-Learning, EdTech, Education","Education, Software","Educere specializes in providing innovative virtual education services to K-12 schools, students, and educators.","Educere specializes in providing innovative virtual education services to K-12 schools, students, and educators. Inc. Magazine ranked Educere among the fastest growing privately-held education companies in the United States in 2016, 2015, 2014, 2013, 2012 and 2011.",https://www.linkedin.com/company/educere-llc/,,,,"257,813"
TrueFire Studios,https://www.crunchbase.com/organization/truefire-studios,https://www.truefirestudios.com/,"E-Learning, Music","Education, Media and Entertainment, Music and Audio, Software",TrueFire Studios is an alliance of the world’s leading online music education companies.,"TrueFire Studios is an alliance of the world’s leading online music education companies. They’re passionate about democratizing music education by providing affordable, anytime, anywhere access to best-in-class artists and the most comprehensive music lesson library on the planet, across all major instrument categories. They provide exceptional revenue-share opportunities for educators, while preserving artist-led music education for future generations.",https://www.linkedin.com/company/truefirestudios/,,https://twitter.com/truefirestudios,https://www.facebook.com/truefirestudio,"257,910"
Month to Master,https://www.crunchbase.com/organization/month-to-master,,"E-Learning, Education, Internet","Education, Internet Services, Software",Extreme learning platform to help professionals master a new skill in a short amount of time. ,"M2M is building OpenMind (not yet launched), a “meta” learning layer that coaches learners to master new concepts in a short amount of time. Improving how students learn to program and write code on the various online education platforms (MOOCs) will be the first test market.  ",,,,,"258,073"
Insight Advance,https://www.crunchbase.com/organization/insight-advance,http://www.insightadvance.com/,"E-Learning, Education","Education, Software",Insight Advance is a Provider of products designed to support education industry.,"Insight ADVANCE has developed a suite of products that connects self-reflection, coaching and peer collaboration, observation, and evaluation in one place to permanently impact how all educators involved in teacher growth are supported. The ADVANCE Suite breaks new ground in proving how educator observations, whether on video or in person, can generate data that effectively and efficiently drives professional growth. Provider of products designed to support education industry. The company offers video-based training experiences for observers to improve inter-rater reliability, targeted feedback with real-time data to promote educator growth and e-learning modules, enabling education establishment and educators to observe, calibrate and refine their coaching techniques.",https://www.linkedin.com/company/insight-advance/,,https://twitter.com/InsightADVANCE,https://www.facebook.com/insightadvance,"259,049"
Questia Media,https://www.crunchbase.com/organization/questia-media,http://www.questiamedia.com,"E-Learning, EdTech, Education","Education, Software","Questia Media offers copyrighted information and educational resources students, instructors, hobbyists, enthusiasts, and lifelong learners.","Questia Media, Inc. is a provider of copyrighted information and educational resources for the digital age. Students, instructors, hobbyists, enthusiasts and lifelong learners in more than 200 countries rely on our products to enhance their understanding of both academic and popular subjects.",,,,,"259,901"
"Classroom, Inc.",https://www.crunchbase.com/organization/classroom-inc,https://www.classroominc.org,"E-Learning, EdTech, Education","Education, Software","Classroom, Inc. is a nonprofit that helps students in high-poverty communities build literacy and leadership skills.","Classroom, Inc. is a nonprofit educational organization whose mission is to close the academic achievement gap by using technology and the world of work to engage, teach, inspire, and empower middle and high school students. For more than 20 years, They’ve created digital learning games that make authentic connections between school, college, and career using a blended learning model. Students take on decision-making roles as professionals in a simulated workplace while improving literacy, 21st century skills, confidence, and engagement. They also provide educators with professional development to effectively use their programs and leverage technology. Their learning games are successfully used in school, extended day, after school, and summer school environments. At Classroom, Inc. they believe that educators need effective tools, deeply engaging content, and continuous support  to give all students  the opportunity to succeed in school, work, and life.",https://www.linkedin.com/company-beta/100391/,,https://twitter.com/ClassroomInc,https://www.facebook.com/pg/classroominc,"261,028"
SoftChalk,https://www.crunchbase.com/organization/softchalk,https://softchalk.com/,E-Learning,"Education, Software",SoftChalk offers content authoring and hosting solutions .,"SoftChalk offers content authoring and hosting solutions that are critical to the success of eLearning initiatives, providing educators with easy, fast, affordable ways to create, manage and share rich, interactive content that engages students in the learning process and inspires learning. ",https://www.linkedin.com/company/softchalk-llc/,,https://twitter.com/softchalk,https://www.facebook.com/pg/softchalk/,"261,674"
The Biz Nation,https://www.crunchbase.com/organization/the-biz-nation,http://www.thebiznation.com,"E-Learning, Education, STEM Education","Education, Science and Engineering, Software","The Biz Nation is an e-learning platform focused on entrepreneurship, technology skills and financial education.","The Biz Nation is a social enterprise focused on making productive education accessible to everyone through the use of technology and innovation.We are an online learning platform that teaches real-life applicable courses on marketable skills, entrepreneurship and financial intelligence through a revolutionary methodology that significantly improves student’s learning.We focus in offering courses by which users can learn marketable skills that will take them to: get a job, get a better job or start their own business.    We apply a revolutionary methodology that significantly improves student learning. How? We are the only learning platform that creates courses that target each person’s learning style by identifying their type of brain…this combined with Neuro Linguistic Programming techniques, experiential learning and storytelling is the perfect combination to disrupt online education.  Our courses have a very special motivation component that aims to install a positive and proactive mindset before even starting to learn. Through our education model we are creating a generation of change-makers that can cause a real and significant impact in our community. A third of the world’s youth is not working nor studying. People are losing hope because there is no ‘’employment’’, but there is a lot of  work to be done, there are opportunities out there, however people are not prepared to take advantage of them.  We found a replicable and scalable way to generate opportunities for all of these talented individuals through a new educational system. The Biz Nation provides online courses for anyone to learn from anywhere. We teach users skills that provides them with a competitive edge.  ",,,https://twitter.com/thebiznation_?lang=es,https://www.facebook.com/thebiznation/,"262,733"
JHT Incorporated,https://www.crunchbase.com/organization/jht-incorporated,http://www.jht.com/,E-Learning,"Education, Software",A privately held company that began as a small business dedicated to developing training programs for the Department of Defense.,"JHT Incorporated, founded in 1990 by retired U.S. Air Force pilot James E. Jardon II, is a privately held company that began as a small business dedicated to developing training programs for the Department of Defense and affiliated agencies. Since that time, the company has expanded their services to include three additional areas of expertise. For over 25 years our exceptional group of 180 employees has provided customized and cost-efficient solutions for both commercial and government customers. Their sustaining mission is to enhance their customer’s success by delivering innovative and cost effective solutions in the areas of simulation and training, technical data management, environmental & marine sciences and professional support solutions.",https://www.linkedin.com/company/jht-inc./,,https://twitter.com/JHTInc,,"263,198"
Travitor,https://www.crunchbase.com/organization/travitor,https://travitor.com/,"E-Learning, EdTech, Education","Education, Software","Travitor provides the easiest way to create and assign learning, plus unlimited access to 200+ courses included.","Travitor provides the easiest way to create and assign learning, plus unlimited access to 200+ courses included. Move business forward. Travitor is the easiest way to create and assign learning. Everything you need to manage learning for yourself, for consumers, and for your workforce.",https://www.linkedin.com/company/travitor-media/,,https://twitter.com/travitor,https://www.facebook.com/Travitor/,"265,308"
Hero DNA,https://www.crunchbase.com/organization/hero-dna,https://hero-dna.com/,"E-Learning, Mobile Apps","Apps, Education, Mobile, Software",Fitness Innovation,"We're a company born out of a passion to develop digital brands, products, and services that empower people to be more heroic.",https://www.linkedin.com/company/herodna,,,,"265,590"
Sunset Learning Institute,https://www.crunchbase.com/organization/sunset-learning-institute,https://www.sunsetlearning.com/,"Corporate Training, E-Learning, Training","Education, Software","Sunset Learning Institute delivers high quality, authorized technical training.","Sunset Learning Institute delivers high quality, authorized technical training. They empower students to master their desired technologies for their unique IT environments.",https://www.linkedin.com/company/sunset-learning-institute/,,https://twitter.com/Sunset_Learning,,"265,944"
Prepory,https://www.crunchbase.com/organization/prepory-coaching-group,https://prepory.com/,"Career Planning, E-Learning","Education, Professional Services, Software",College Admissions Counseling | Career Coaching,Prepory is a premier college admissions and career coaching company. It’s our mission to help students and professionals go from where they are to where they should be.,https://www.linkedin.com/company/prepory-coaching,,https://twitter.com/preporycoaching,https://www.facebook.com/PreporyCoaching/,"265,948"
United Techno Solutions Inc.,https://www.crunchbase.com/organization/united-techno-solutions,http://www.unitedtechno.com,"Artificial Intelligence, Crowdsourcing, Data Integration, E-Learning, Life Science, Machine Learning, Pharmaceutical, Retail Technology, Software","Artificial Intelligence, Biotechnology, Commerce and Shopping, Data and Analytics, Education, Hardware, Health Care, Information Technology, Other, Science and Engineering, Software","United Techno specializes in niche consulting and solution design for Life Sciences, Healthcare, Retail and Logistics industries.","Niche Consulting Services: We specialize in Architecture, Design and development of software solutions including Cloud Migration, Cloud Integration services (Dell Boomi, Jitterbit), ERP systems, Pharma IT and Retail IT systems. Software development: United Techno provides supports for Systems and Solutions development and business process re-engineering with special emphasis on the retail, banking and pharmaceutical sector. 1. AS/400 & RPG Legacy Application Development Services, maintenance and infrastructure support. 2. Dell Boomi Cloud Integration Services // Dell Boomi Certified Implementation Partner // 3. Microsoft Technology Stack - Application development & Support 4. Datawarehousing - Informatica DW and Business Intelligence Services. 5. Product Development - Machine Learning, Ai and Big Data Platform (solving enterprise problems with emerging technologies) Compliance, Regulatory & Quality Control Services: 1. Computer System Validation 2. Audit & Regulatory compliance services (FDA, cGMP, ISO)",https://www.linkedin.com/company/united-techno-info-systems,,,http://www.facebook.com/United-Techno-Info-Systems/1581056,"266,561"
Wrainbo,https://www.crunchbase.com/organization/wrainbo,http://www.wrainbo.com/,"Analytics, E-Learning, Gaming, Mobile, Simulation","Data and Analytics, Education, Gaming, Mobile, Software",Wrainbo is a customizable platform that combines immersive game-based learning with learning analytics.,Wrainbo is a customizable platform that marries immersive mobile game design with practical learning. It also incorporates big data assessment based on gameplay data to provide personalized coaching.,https://www.linkedin.com/company/10875885,,https://twitter.com/Wrainbo_Game,https://www.facebook.com/WrainboLearning/,"267,008"
eLearning Innovation,https://www.crunchbase.com/organization/elearning-innovation,http://elearninginnovation.com/,"E-Learning, Education","Education, Software",eLearning Innovation is a developer of custom online learning solutions. ,"eLearning Innovation is a developer of custom online learning solutions. eLearning Innovation develops custom online learning solutions by building close ties to their clients and fully understanding their needs. They focus on immersive learning, creating interactive environments where students engage many of their senses to experience the content. ",https://www.linkedin.com/company/elearning-innovation/,,https://twitter.com/elearninnovate,https://www.facebook.com/elearninginnovate/,"267,128"
Bottom-Line Performance,https://www.crunchbase.com/organization/bottom-line-performance,https://www.bottomlineperformance.com/,"Business Development, E-Learning, Training","Education, Professional Services, Software","Bottom-Line Performance creates learning solutions for businesses using instructional design, training development, and eLearning tools.","Bottom-Line Performance creates learning solutions for businesses using instructional design, training development, and eLearning tools. Founded in 1995, the company is headquartered in New Palestine, Indiana.",https://www.linkedin.com/company/bottom-line-performance/,,,https://www.facebook.com/blpindy/,"267,694"
Teaching Channel,https://www.crunchbase.com/organization/the-teaching-channel,https://www.teachingchannel.org,E-Learning,"Education, Software",Teaching Channel operates as a video showcase on the Internet and television that provides teaching practices.,Teaching Channel operates as a video showcase on the Internet and television that provides teaching practices.,https://www.linkedin.com/company-beta/2612282/,,https://twitter.com/teachingchannel,https://www.facebook.com/TeachingChannel/,"269,221"
