Organization Name,Organization Name URL,Website,Industries,Industry Groups,Description,Full Description,LinkedIn,Hub Tags,Twitter,Facebook,CB Rank (Organization)
Spokn,https://www.crunchbase.com/organization/spokn,https://getspokn.com,"Apps, E-Learning, Human Resources, SaaS, Software","Administrative Services, Apps, Education, Software",Spokn's bite-sized audio insights help companies develop their talent and build a culture of continuous learning,"Spokn helps companies develop their talent and build a culture of continuous learning - all in audio.  Our 'bite-sized' insights cover skills like communication, collaboration, productivity and leadership and come from the top experts in the world - from Harvard Business School and MIT to HubSpot, Mindful, the Financial Times and more.  The best part? It's 100% in audio, so learning fits into the daily routine of employees.",https://www.linkedin.com/company/getspokn/,,https://twitter.com/getspokn,https://www.facebook.com/getSpokn/,"44,999"
Sown To Grow,https://www.crunchbase.com/organization/sown-to-grow,https://www.sowntogrow.com/,"E-Learning, Education, Information Services","Education, Information Technology, Software",Sown To Grow is a student goal-setting and reflection platform that fosters growth mindset and student agency.,"Sown To Grow is a student goal-setting and reflection platform that fosters a growth mindset and student agency. Students set personal learning goals, enter their own scores to track progress, and write reflections to continuously improve. It was founded in 2015 and is headquartered in Oakland, California.",https://www.linkedin.com/company/sown-to-grow/?originalSubdomain=in,,https://twitter.com/sowntogrow?lang=en,,"45,012"
Planet3,https://www.crunchbase.com/organization/planet3,http://exploreplanet3.com/,"E-Learning, EdTech, Education","Education, Software",Planet3 is an exploration-based learning company that presents the entire Earth as a living laboratory.,Planet3 is an exploration-based learning company that presents the entire Earth as a living laboratory. The company also utilizes real-world data and Next Generation Science Standards (NGSS) to deliver learning outcomes.,https://www.linkedin.com/company/planet3,,https://twitter.com/exploreplanet3,https://www.facebook.com/explorePlanet3/,"45,382"
Alchemie Solutions,https://www.crunchbase.com/organization/alchemie-games,http://alchem.ie,"E-Learning, Education, Higher Education, Machine Learning, Mobile","Artificial Intelligence, Data and Analytics, Education, Mobile, Software",Alchemie is building next generation assessment technology.,Alchemie is creating a new path for student understanding and assessment by combining interactive digital tools with machine learning and data analytics.,https://www.linkedin.com/company/alchemie/,,https://twitter.com/LearnAlchemie,https://www.facebook.com/AlchemieSolutions,"45,537"
Clutch Prep,https://www.crunchbase.com/organization/clutch-prep,https://www.clutchprep.com/,"E-Learning, Education, Video","Education, Media and Entertainment, Software, Video",Clutch Prep is the best way to actually learn Video guides that follow your college textbook.,"Clutch Prep is the best way to actually learn Video guides that follow your college textbook. Clutch Prep was founded with the mission to help students succeed in their classes. They believe in a learning model that consists of straight-forward explanations, relevant examples, and thorough practice. This mission requires a robust team of visionaries who are willing to challenge formal curriculum head on, and create high-impact learning experiences for students.",https://www.linkedin.com/company/clutch-prep/,,http://twitter.com/clutchprep,http://www.facebook.com/clutchprep,"46,171"
Immersed Games,https://www.crunchbase.com/organization/immersed-games-3,http://immersedgames.com,"E-Learning, Education, Video Games","Education, Gaming, Software","Creating a video game as a platform for deep, empowering learning experiences.","Immersed Games is harnessing the addictive power of video games for learning. We are creating a video game as a platform for deep, empowering learning experiences. Think World of Warcraft, for learning - a virtual world crafted for relevant learning over a variety of subjects and enrichment that creates an ecosystem for students to engage with long-term. We just released a smaller stand-alone game that will test a portion of our sandbox-like educational gameplay and acquire data before completing the full game release, continuing then to iteratively expand content.",https://www.linkedin.com/company/immersed-games,,https://twitter.com/immersedgames,https://www.facebook.com/ImmersedGames,"46,209"
Ponddy Education,https://www.crunchbase.com/organization/ponddy-education,http://ponddy.ai/,"E-Learning, Education, Information Technology, Internet, Machine Learning","Artificial Intelligence, Data and Analytics, Education, Information Technology, Internet Services, Software",personalized language learning company based in San Jose.,"Create and commercialize the most effective life-long learning solutions, integrating machine learning technologies with exciting self-learning materials and live teachers, individually personalized for various age groups and professions across the globe.",https://www.linkedin.com/company/ponddy/?originalSubdomain=in,,https://twitter.com/ponddyeducation,https://www.facebook.com/pg/ponddyeducation/about/?ref=page_internal,"46,504"
Atentiv,https://www.crunchbase.com/organization/atentiv,http://www.atentiv.com/,"E-Learning, EdTech","Education, Software",Atentiv is a Developer of digital learning applications .,"ATENTIV was the first company to pioneer digital therapies for behavioral disorders due to developmental delays of cognitive skills, initially for ADHD. It is combining scientific and clinical rigor, with the ingenuity of the tech industry and the power of big data analytics into a platform of products for use by providers, health care insurers and employers. Atentiv’s products deliver treatments not through a pill but through a creative and immersive action adventure video game to treat cognitive deficiencies and improve symptoms associated with behavioral disorders.",https://www.linkedin.com/company/atentiv-llc/,,,,"46,680"
onQ,https://www.crunchbase.com/organization/onq-bce0,https://www.engageonQ.com,"Communications Infrastructure, E-Learning, Education, Training, Video","Education, Hardware, Media and Entertainment, Software, Video",Developer of a solution for interactive group communications and learning.,"The onQ solution brings video to life, turning traditional static viewing into an energized, interactive group experience, supported by deep behavioral insights that facilitate dramatic improvements to content, communications, and learning. ",https://www.linkedin.com/company/22344798/,,https://twitter.com/engageonQ,https://www.facebook.com/engageonQ/,"46,695"
Learning Equality,https://www.crunchbase.com/organization/learning-equality,https://learningequality.org/,"E-Learning, Education, Internet","Education, Internet Services, Software",Learning Equality is bridging the global digital divide by bringing the online learning revolution offline.,"Learning Equality is a non-profit organization based in California that is committed to enabling every person in the world to realize their right to a quality education, by supporting the creation, adaptation and distribution of open educational resources, and creating supportive tools for innovative pedagogy.  In the summer of 2012, our co-founder Jamie Alexandre was interning at Khan Academy when he and a fellow intern had the idea to bring Khan Academy offline using a low-cost Raspberry Pi. After returning to San Diego, Jamie and a dedicated group of student volunteers brought this idea to life. KA Lite was officially launched in December of 2012, sparking an enthusiastic global response that led to a flood of requests for support, features, and partnerships. To date, KA Lite has brought Khan Academy content offline and has reached more than 4.5 million people globally in 200 countries and territories in contexts as varied as formal schools in India, orphanages in Cameroon, prisons across the United States, refugee camps in Kenya, and First Nations community centers in northern Canada.  Kolibri is Learning Equality’s updated response to educational inequality caused by limited connectivity. Kolibri is an open-source platform that is built to enable seamless authoring and peer-to-peer sharing, and engage users with educational content without the need for Internet. Through Kolibri, Learning Equality combines a vast, curated library of educational content from sources all over the globe, and makes the content available completely offline, on low-cost devices. Instructors and organizations can create locally relevant, customized educational curricula that fit their context, including both global open content and locally-sourced/created materials. Kolibri also includes tools for self-paced, collaborative learning to provide instant feedback for students and teachers, and personalized recommendations to enable students to work at their own pace with support from mentors and peers in a blended learning context. ",https://www.linkedin.com/company-beta/3210224/?pathWildcard=3210224,,https://twitter.com/LearnEQ,https://www.facebook.com/pg/learningequality/about/?ref=page_internal,"46,740"
Educanon,https://www.crunchbase.com/organization/educanon,http://www.educanon.com/,"E-Learning, EdTech, Education","Education, Software",PlayPosit is an online learning environment that allows its users to create and share interactive video lessons.,"Developed by Ben while teaching (Teach For America), eduCanon improves student outcomes by harnessing the potential of technology. They have been honored as a member of the inaugural class of LearnLaunchX. They won the McGraw-Hill Open Education Resource Prize as a finalist at 2014 Milken-Penn GSE Education Competition and then won the 1776 Global Challenge Cup Competition as the best education company globally. Technology should empower teachers to maximize instructional, collaborative, and preparation time. Each student has unique learning backgrounds - they give teachers a tool to customize existing online content to the needs of their students and deliver it through a medium that is designed for learning.",http://www.linkedin.com/company/educanon,,http://twitter.com/educanon123,http://www.facebook.com/officialeduCanon,"47,099"
ZeroUI,https://www.crunchbase.com/organization/zeroui,http://www.zeroui.com/,"E-Learning, EdTech, Internet of Things, Robotics","Education, Hardware, Internet Services, Science and Engineering, Software",ZeroUI offers an e-learning platform that delivers immersive experiential learning anytime anywhere using the IoT Robotics system.,"ZeroUI is an information technology company that offers an e-learning platform that delivers immersive experiential learning anytime anywhere using the IoT Robotics system. The company focuses in the fields of robotics, IoT, Experiential Learning, and EdTech.",https://www.linkedin.com/company/zeroui,,https://twitter.com/Zero_UI,https://www.facebook.com/zer0ui,"47,155"
Apptuto,https://www.crunchbase.com/organization/apptuto,http://www.apptuto.com,"E-Learning, Gaming, Social","Community and Lifestyle, Education, Gaming, Software",Apptuto is an edtech startup providing a gamified social learning solution to students undertaking standardised exams.,"Apptuto is changing the way we learn, combining academic excellence with technical innovation in order to better prepare and connect students globally. Our multi platform software is redefining exam preparation and has initially launched for candidates of the Chartered Financial Analyst CFA® Program.",https://www.linkedin.com/company/apptuto,,https://twitter.com/apptuto/,https://www.facebook.com/apptuto/info/?ref=page_internal,"47,291"
Right At School,https://www.crunchbase.com/organization/right-at-school,https://rightatschool.com,"Association, E-Learning, EdTech, Education","Education, Other, Software",Right At School provides meaningful before and afterschool programs.,"Right At School provides safe, engaging, and meaningful in-school and extracurricular programs to enrich the lives of students, give parents peace of mind, and enable schools to focus on their academic mission. Its enrichment curriculum utilizes disguised learning and fitness activities that enable schools to focus on their academic mission while inspiring a love of learning and commitment to healthy living. Right At School was established in 2011 and is headquartered in Evanston, Illinois.",https://www.linkedin.com/company/right-at-school/,,https://www.twitter.com/rightatschool,https://www.facebook.com/rightatschool,"47,317"
MasteryPrep,https://www.crunchbase.com/organization/masteryprep,http://masteryprep.com/,"E-Learning, Education, Tutoring","Education, Software",MasteryPrep offers a college and career readiness preparation program to fit its client’s school’s needs and schedule.,"MasteryPrep offers a college and career readiness preparation program to fit its client’s school’s needs and schedule. It is a provider of professional development for the ACT and has helped hundreds of thousands of educators, administrators, and students improve their schools’ standardized test outcomes. MasteryPrep’s program focuses particularly on students who are scoring below an 18 on the ACT. It was launched in 2013 and is based in Baton Rouge, Louisiana.",https://www.linkedin.com/company/9188991?trk=tyah&trkInfo=clickedVertical%3Acompany%2CclickedEntityId%3A9188991%2Cidx%3A1-1-1%2CtarId%3A1466585724362%2Ctas%3AMasteryPrep,,https://www.twitter.com/masteryprep,https://www.facebook.com/MasteryPrep,"47,410"
HelloGuru,https://www.crunchbase.com/organization/helloguru,https://www.helloguru.io,E-Learning,"Education, Software",HelloGuru is an online University that teaches people how to build software without the need of having to learn to code.,"HelloGuru, an online University, is closing the gap between people that knows how to build software and those who don't. Its focus on teaching people how to use No-Code tools leads to more people being able to create software solutions without the need of having to learn to code.",https://www.linkedin.com/company/helloguru-no-code/,,,,"47,955"
Outtalent,https://www.crunchbase.com/organization/outtalent,http://outtalent.com/,"E-Learning, Information Technology, Software Engineering, Training","Education, Information Technology, Science and Engineering, Software",Outtalent helps top software engineers from emerging markets get jobs abroad at companies like Google.,"Outtalent helps top software engineers from emerging markets get jobs abroad at companies like Google, Airbnb, and Stripe. Outtalent was founded in 2019 by Tilek Mamutov and Meder Mamutov.",https://www.linkedin.com/company/outtalent/,,,https://www.facebook.com/outtalent/,"48,003"
NexusEdge,https://www.crunchbase.com/organization/nexusedge-inc,http://www.nexusedge.com/,"Artificial Intelligence, Career Planning, E-Learning, Education, Higher Education","Artificial Intelligence, Data and Analytics, Education, Professional Services, Science and Engineering, Software",NexusEdge is a career development platform.,"NexusEdge is a career development platform for lifelong learning powered by artificial intelligence that aims to empower community college students. NexusEdge’s platform offers a mentor network, digital badges, free classes from Lynda.com, and an entry level jobs board. Its services are geared toward helping students fill the skills gap with a job that suits their talents. The NexusEdge platform includes built in video-chat, with which students can chat with industry professional mentors in careers of their choice. In addition to finding educational institutions that might facilitate students’ use of the platform, NexusEdge is focused on partnering with Kansas City corporations that could be interested in granting employees micro-credential badges. The company was established in 2016 and is headquartered in Los Angeles, California.",https://www.linkedin.com/company/15187553,,https://www.twitter.com/getnexusedge,https://www.facebook.com/nexusedge,"49,955"
DosedDaily,https://www.crunchbase.com/organization/doseddaily,https://www.doseddaily.com,"E-Learning, Education, Health Care, Medical","Education, Health Care, Software",DosedDaily is an e-learning company delivering medical education in a dose a day.,"DosedDaily is an e-learning company delivering medical education in a dose a day. The company's service offers questions based on key articles along with the links and earning of credits on a monthly or yearly basis, enabling pediatrics and doctors to access updates from anywhere and offer insights that have an impact on patient care. It was founded in 2011 and is headquartered in New York, NY, USA.",https://www.linkedin.com/company/doseddaily,,https://twitter.com/dosed_daily,https://www.facebook.com/doseddaily,"50,147"
Trust Assurance Network,https://www.crunchbase.com/organization/trust-assurance-network,https://trustassurance.net/,"E-Learning, EdTech","Education, Software",Trust Assurance is the first and only Trust-as-a-Service blockchain-based platform that delivers a simple and secure means of exchange.,"The Trust Assurance Network is the first and only Trust-as-a-Service blockchain-based platform that delivers a simple, powerful, and secure means of exchange for the education ecosystem. The Trust Assurance Network can provide everything you need to build applications at scale, including APIs, a stable token, and a records-transaction component. Unlike other blockchain solutions that focus solely on payments, our solution is capable of securing any credential, skill, donation, payment, achievement, or other data log that needs to be recorded and tracked.",https://www.linkedin.com/company/trust-assurance-network,,https://twitter.com/trustassurance_,https://www.facebook.com/trustassurancenetwork/,"50,167"
Studygate,https://www.crunchbase.com/organization/studygate,http://www.studygate.com,"E-Learning, Education, Tutoring","Education, Software",StudyGate is a hub for tutors and students.,"StudyGate is a hub for tutors and students. We provide online tutoring and question answering services. Freelance tutors receive access to earnings stability in addition to a flexible schedule. This is accomplished through our platform connection tools and payment management system. These tools take the pressure off of tutors looking for paid clients and allow them to draw directly from StudyGate’s learning network. At StudyGate, our mission is to join competent tutors with ambitious students looking for an enhanced learning opportunity, all under the umbrella of a single platform. No longer will tutors have to scour the depths of the Internet looking for clients, and no longer will students have to worry about whether they will be connected to a first-rate tutor.",https://www.linkedin.com/company/18149046/,,https://twitter.com/studygatetutor,https://www.facebook.com/StudygateTutor,"50,193"
The Graide Network,https://www.crunchbase.com/organization/the-graide-network,http://thegraidenetwork.com/home,"E-Learning, EdTech, Education","Education, Software",The Graide Network is a virtual platform that connects teachers with qualified teaching assistants online.,"The Graide Network is an internet company that offers an online platform that connects teachers with qualified teaching assistants to grade and provide thorough feedback on student assignments. The company is driven by its mission is to reimagine how middle and high school teachers spend their time. The Graide Network was founded in 2015 and headquartered in Chicago, Illinois.",https://www.linkedin.com/company/the-graide-network,,https://twitter.com/@graidenetwork,https://www.facebook.com/thegraidenetwork/,"50,193"
StudySync,https://www.crunchbase.com/organization/studysync,https://www.studysync.com/,"E-Learning, EdTech, Education","Education, Software",StudySync is an e-learning startup that is designed to meet the needs of today’s students and teachers.,"StudySync is an e-learning startup that is designed to meet the needs of today’s students and teachers. With a combination of a digital library of classic and contemporary works, dynamic video targeted print resources, and a mediated social network, StudySync advance reading and writing skills while inspiring critical thinking and collaboration, preparing students for college, careers, and civic life.",https://www.linkedin.com/company/bookheaded-learning-llc/,,https://twitter.com/studysync,https://www.facebook.com/StudySync/,"50,403"
Stukent,https://www.crunchbase.com/organization/stukent,http://stukent.com,"E-Learning, Education, Online Portals","Education, Internet Services, Software",Stukent is on a mission. Our mission statement is: Helping professors help students help the world. We all need help. We need a hand.,"Stukent is on a mission. Our mission statement is: Helping professors help students help the world. We all need help. We need a hand. Stukent is working to develop internet marketing simulations, digital textbooks, and an educational platform that will help academia stay caught up with the fast paced industries their students will soon enter.",http://www.linkedin.com/company/stukent,,http://twitter.com/StukentApp,http://www.facebook.com/stukentapp,"50,482"
Carnegie Speech,https://www.crunchbase.com/organization/carnegie-speech,http://www.carnegiespeech.com,"Collaboration, E-Learning, Software, Training","Education, Other, Software","Carnegie Speech, a speech assessment and tutoring software company, provides speech training technology to help to speak English clearly.","Carnegie Speech Company, Inc., a speech assessment and tutoring software company, provides speech training technology to help to speak English clearly. It offers Carnegie Speech Assessment, which rate the proficiency of spoken English; Native Accent, which teach to pronounce English clearly; and YOUTH Database, a set of recordings of children reading words, phrases, and sentences in English. The company serves BPO and education markets.  Carnegie Speech Company, Inc. was founded in 2001 and is based in Pittsburgh, Pennsylvania.",https://www.linkedin.com/company/carnegie-speech,,https://twitter.com/carnegie_speech,,"50,738"
Rocketship Education,https://www.crunchbase.com/organization/rocketship-education,http://rsed.org,"E-Learning, EdTech, Education","Education, Software",Rocketship is a non-profit network of public charter schools serving disadvantaged communities nationwide.,"Rocketship is a national non-profit network of public elementary charter schools serving low-income communities with limited access to excellent schools. Founded in 2006, Rocketship is a 501(c)(3) nonprofit corporation whose mission is to eliminate the achievement gap by building a scalable and sustainable school model that propels student achievement in underserved communities across the country. The core of Rocketship’s instructional model is a teacher-led, technology supported approach to personalized learning that matches each student with the right content at the right time utilizing the right method of instruction. By deeply engaging parents in their student’s learning and the school community, Rocketship develops parents who become lifelong advocates for their children and their community. Working alongside parents, community organizations, districts, and other charter schools, Rocketship is catalyzing a movement to eliminate the achievement gap in our lifetime.",https://www.linkedin.com/company/361369,,http://twitter.com/RocketshipEd,http://www.facebook.com/RocketshipEd,"50,782"
Byndr,https://www.crunchbase.com/organization/byndr,https://www.byndr.com/,"Continuing Education, E-Learning, EdTech, Education, Higher Education, Mobile","Education, Mobile, Software",Byndr is a mobile-first learning platform fo higher education,"Byndr connects students, teachers and colleges around the globe on one simple, fast and mobile-first platform. We designed Byndr from the ground-up with a focus on ease-of-use, ensuring every student has access to educational resources outside of the classroom.",https://www.linkedin.com/company/byndr,,https://twitter.com/Byndr_Mobile,https://www.facebook.com/ByndrApp/info/?entry_point=page_nav_about_item&tab=page_info,"50,894"
