Organization Name,Organization Name URL,Website,Industries,Industry Groups,Description,Full Description,LinkedIn,Hub Tags,Twitter,Facebook,CB Rank (Organization)
Pluralsight,https://www.crunchbase.com/organization/pluralsight,http://www.pluralsight.com,"E-Learning, EdTech, Education, Enterprise, Information Technology, Software","Education, Information Technology, Other, Software","Pluralsight is a technology learning platform for software developers, IT admins, and creative professionals.","Pluralsight is a technology learning platform for software developers, IT admins, and creative professionals. With 3,000+ courses and new ones added daily, Pluralsight serves as a career catalyst for customers in more than 150 countries and provides tech-savvy businesses with training on the three key areas they need to thrive. The platform expert courses, skill assessments, and one-of-a-kind analytics make it possible to align the organization around digital initiatives, upskill people into modern tech roles, and build adaptable teams that deliver faster.  It was founded in 2004 and is headquartered in Farmington, Utah.",http://www.linkedin.com/company/pluralsight,Exited Unicorn,http://twitter.com/PluralSight,http://www.facebook.com/pluralsight,70
Springboard,https://www.crunchbase.com/organization/sliderule,https://www.springboard.com/,"E-Learning, EdTech, Education","Education, Software",Springboard is an e-learning platform that prepares people for modern careers through cutting edge curriculum and mentor guidance.,"Springboard is an online learning platform that prepares students for the tech industry’s most sought after careers. With expert mentorship from top professionals, a bleeding-edge curriculum, and a network of support from day one, they make sure students have everything they need to excel in their program and in their next job. The platform one-size-fits-one approach is made for working professionals who are ready to level-up or make a major career shift. And our tuition back guarantee means students can take charge and invest in themselves. Springboard data science career track comes with a job guarantee, ensuring students secure a job within six months of graduation or get a full refund. The platform's self-paced courses offer students the opportunity to develop job-ready skills that they display in an industry-worthy capstone or portfolio projects.",https://www.linkedin.com/company/springboard,,http://twitter.com/springboard,http://www.facebook.com/MySlideRule,684
ExecOnline,https://www.crunchbase.com/organization/execonline,https://www.execonline.com/,"E-Learning, EdTech, Education","Education, Software",ExecOnline is a provider of school-certified online executive education programs and executive training solutions.,"ExecOnline is a provider of school-certified online executive education programs used to transform how companies deliver professional development to their executives. The company partners with elite business schools to enable executives at the world’s largest companies to master and apply critical insights and practical solutions.  ExecOnline breaks the compromise between cost and quality through a dynamic and interactive online learning environment that scales across the enterprise and fosters collaborative skill-building.   ExecOnline provides school partners with everything they need to successfully develop online executive education programs including a customizable learning management system, online instructional design, and full sales and marketing capabilities.",https://www.linkedin.com/company/execonline/,,https://twitter.com/execonlineinc,https://www.facebook.com/pages/ExecOnline/1831158956906409,714
Udacity,https://www.crunchbase.com/organization/udacity,https://www.udacity.com,"Artificial Intelligence, E-Learning, EdTech, Education, Internet, Machine Learning, Robotics, Software, Training","Artificial Intelligence, Data and Analytics, Education, Hardware, Internet Services, Science and Engineering, Software","Udacity develops an online learning platform offering programs in artificial intelligence, machine learning, and robotics sector.","Udacity develops an online learning platform offering programs in artificial intelligence, machine learning, and robotics sector, as well as data science, autonomous systems, and cloud computing. It offers nanodegree programs such as front-end and senior web developer, full-stack web developer, data analyst, machine learning engineer, iOS and Android developer, programming introduction, tech entrepreneur, iOS app development beginning, Ruby beginning, and 2D mobile game developer courses. Udacity's online courses teach the skills that industry employers need and deliver credentials endorsed by employers. The company aims to democratize education making it affordable and accessible to get the jobs they desire to improve their lives.  David Stavens, Mike Sokolsky, and Sebastian Thrun founded it in 2011, with its headquarters in Mountain View in California.",https://www.linkedin.com/school/udacity,Unicorn,https://twitter.com/udacity,https://www.facebook.com/Udacity,919
Skillshare,https://www.crunchbase.com/organization/skillshare,http://skillshare.com,"E-Learning, EdTech, Education, Peer to Peer","Education, Other, Software",Skillshare is an ed-tech platform offering online learning for creative fields.,"Skillshare is an online learning community with thousands of inspiring classes for creative and curious people, on topics including illustration, design, photography, video, freelancing, and more. The company's community offers classes on any type of skill, from baking cupcakes to raising startup capital to varying fields in design, business, and technology, enabling members to harness their creative power and learn skills in an enhanced way.  The company was founded in 2010 and is headquartered in New York.",https://www.linkedin.com/company/skillshare-com,,http://twitter.com/skillshare,http://www.facebook.com/skillshare,979
WorkRamp,https://www.crunchbase.com/organization/workramp,https://www.workramp.com,"Corporate Training, E-Learning, SaaS, Software","Education, Software",WorkRamp is an enterprise learning platform that helps organizations build their own training materials.,"WorkRamp is an enterprise learning platform for employee training and customer education at top companies like Zoom, Box, and Workiva. The company is committed to transforming the future of work by delivering an unparalleled, digital learning experience for employees and customers. With WorkRamp, users feel empowered to learn, collaborate, and develop their skills in a digital workspace that bridges the physical and virtual training.   The company is building a dynamic learning platform that focuses on delivering training based on driving business outcomes. Its platform allows companies to manage role-specific training and increase team performance, while also supporting larger HR and compliance needs. We’ve developed training products to address the specific learning needs for sales, support, and customer education teams–that in turn, helps bolster employee productivity, increase company revenue, and drive customer loyalty. WorkRamp was founded in 2015 and based in San Francisco, California.",https://www.linkedin.com/company/7166427,,https://twitter.com/workramp,https://www.facebook.com/workramp/,"1,022"
WalkMe,https://www.crunchbase.com/organization/walkme,http://www.walkme.com/,"Analytics, E-Learning, Guides, Machine Learning, Mobile, Product Design, Product Management, SaaS, Software, UX Design","Artificial Intelligence, Data and Analytics, Design, Education, Media and Entertainment, Mobile, Other, Software","WalkMe’s pioneering Digital Adoption Platform provides software users with guidance, engagement, insights and automation.","designs digital adoption platform that simplifies the user experience. Its digital adoption platform artificial intelligence, machine learning, analytics, and automation to anticipate users' needs and provides help exactly when and where they need it, enabling users to complete their tasks easily.",http://www.linkedin.com/company/walkme/,Unicorn,http://twitter.com/WalkMeInc,http://www.facebook.com/WalkMe/,"1,025"
Bigtincan,https://www.crunchbase.com/organization/bigtincan,http://www.bigtincan.com,"Analytics, Artificial Intelligence, Desktop Apps, E-Learning, Machine Learning, Mobile Apps, Productivity Tools, Sales Automation, Software, Training","Apps, Artificial Intelligence, Data and Analytics, Education, Information Technology, Mobile, Other, Sales and Marketing, Science and Engineering, Software","Sell Smarter, Learn Faster, and Win More with the industry’s leading AI-powered Sales Enablement Automation Platform.","Bigtincan (ASX:BTH)  helps sales and service teams increase win rates and customer satisfaction.  The company’s mobile, AI-powered sales enablement automation platform features the industry’s premier user experience that empowers reps to more effectively engage with customers and prospects and encourages team-wide adoption.  Leading brands including AT&T, ThermoFisher, Merck, ANZ Bank and others rely on Bigtincan to enhance sales productivity at every customer interaction.  With global sales and marketing headquartered in Boston, Bigtincan also has offices across EMEA, Australia and Asia.   ",https://www.linkedin.com/company/275237/,,http://twitter.com/bigtincan,http://www.facebook.com/bigtincan,"1,194"
Cornerstone OnDemand,https://www.crunchbase.com/organization/cornerstone-ondemand,http://www.cornerstoneondemand.com,"E-Learning, Enterprise Software, SaaS, Social Network, Software","Education, Internet Services, Software",Cornerstone OnDemand provides cloud-based talent management software solutions.,"Cornerstone OnDemand is a leading global provider of a comprehensive learning and talent management solution delivered as Software-as-a-Service (SaaS).  The company enables organizations to meet the challenges they face in empowering their people and maximizing the productivity of their human capital.  Cornerstone currently empowers over 19.1 million users across 191 countries and in 42 languages. Their integrated cloud-based software offering consists of Cornerstone Onboarding, Cornerstone Recruiting, Cornerstone Performance, Cornerstone Learning, Cornerstone Connect, Cornerstone Succession, Cornerstone Compensation and Cornerstone Extended Enterprise. Their clients use their solution to develop employees throughout their careers, engage all employees effectively, improve business execution, cultivate future leaders, and integrate with their external networks of customers, vendors and distributors. The company has more than 2,100 clients, including multi-national corporations, large domestic enterprises, mid-market companies, state and local public sector organizations, higher education institutions and non-profit entities.  Clients include BJC HealthCare, Flextronics, Kelly Services, Pearson, Starwood Hotels & Resorts Worldwide, Teach for America and Virgin Media Limited, among many others.  Cornerstone supports multiple client deployments of more than 150,000 users, including one client with more than 700,000 users.     Cornerstone is headquartered in Santa Monica, California, with offices in Auckland, Hong Kong, London, Mumbai, Munich, Madrid, Paris, Rome, Sydney and Tel Aviv.",http://www.linkedin.com/company/cornerstone-ondemand,Crunchbase Venture Program,http://twitter.com/cornerstoneinc,http://www.facebook.com/csodcommunity,"1,197"
Aceable,https://www.crunchbase.com/organization/aceable,https://www.aceable.com,"E-Learning, EdTech, Mobile, Real Estate, Training","Education, Mobile, Real Estate, Software",Aceable is an online education startup that offers state-approved drivers education and real estate courses.,"Aceable is an education startup that offers state-approved online drivers education and real estate courses. Aceable's online courses are designed to help people succeed and achieve their goals. From its origins in driver's ed--where it now has 70% of the Texas market--to the meteoric growth of real estate training, Aceable aims to empower tens of millions of people with the high-stakes education they need to accomplish their life goals and is consistently on city-wide lists named one of the best places to work (Austin American Statesman and Austin Business Journal). Aceable is proud of its roots in the Capital Factory accelerator program and to have received backing from great funds like Sageview Capital, Silverton Partners, Floodgate Fund, Next Coast Venture Partners, Wildcat VC, Nextgen Partners, the Capital Factory Fund, and now HGGC. The company was founded in 2012 by Blake Garrett and is based in Austin, Texas, United States.",https://www.linkedin.com/company/aceable,,http://twitter.com/aceable,http://www.facebook.com/Aceable,"1,262"
Outschool,https://www.crunchbase.com/organization/outschool,https://outschool.com/,"Children, E-Learning, EdTech, Education, Information Technology, Marketplace","Commerce and Shopping, Community and Lifestyle, Education, Information Technology, Software","Outschool is a marketplace of live online classes for kids that connects learners, parents, and teachers together.","Outschool connects motivated learners, parents, and teachers together to create great learning experiences. Their mission is to build the biggest and best global school by offering unique online classes from hundreds of independent teachers. Outschool teachers may be certified teachers, artists, scientists, or other adults with expertise or interest in teaching. It was founded in 2015 and is based in San Francisco, California.",https://www.linkedin.com/company/outschool/,,https://twitter.com/outschool,https://www.facebook.com/outschool/,"1,397"
Course Hero,https://www.crunchbase.com/organization/coursehero,https://www.coursehero.com,"Crowdsourcing, E-Learning, EdTech, Education, Internet, Subscription Service","Education, Internet Services, Other, Software","Course Hero is an online learning platform with study resources that help students feel confident and prepared, from day one to graduation.","Course Hero is an online learning platform with study resources that help students feel confident and prepared, from day one to graduation. The company provides a free and subscription online learning platform that empowers students and educators to succeed through unlocked study tools, documents, and resources. It also offers free and subscription membership that includes access to practice problems, study guides, videos, class notes, and step-by-step explanations for every subject that students study, from economics to literature, biology to history, and accounting to psychology. In 2016, Andrew Grauer, Gregor Carrigan, and Jared Grauer established Course Hero in Redwood City, California.",https://www.linkedin.com/company/coursehero,Unicorn,https://twitter.com/CourseHero,https://www.facebook.com/coursehero,"1,542"
Lambda School,https://www.crunchbase.com/organization/lambda-school,https://lambdaschool.com/,"E-Learning, EdTech, Education, Higher Education","Education, Software",Lambda School trains people to be software engineers for free in exchange for a share of future income.,"Lambda School is a combination of a school and an investment fund. Lambda School's mission is to find untapped or underutilized talent, and train that talent for the most in-demand jobs in the world. Lambda School is pioneering a new model of higher education in which the school invests in the students, instead of the other way around.",https://www.linkedin.com/school/17968067/,,https://twitter.com/lambdaschool,https://www.facebook.com/LambdaSchoolOnline/,"1,662"
BabySparks,https://www.crunchbase.com/organization/babysparks-llc,http://babysparks.com/,"E-Learning, EdTech, Education, Software","Education, Software",BabySparks is a developer of tools and programs to help parents engage their babies and toddlers in the critical areas of early development.,"BabySparks is a developer of tools and programs to help parents engage their babies and toddlers in the critical areas of early development. The company's early development program learns each child unique profile, identifies specific needs, and provides meaningful activities to support them. It was established in 2013 and is headquartered in Plantation, Florida.",https://www.linkedin.com/company/babysparks/,,https://www.twitter.com/babysparksco,https://www.facebook.com/babysparksco,"1,920"
Newsela,https://www.crunchbase.com/organization/newsela,http://newsela.com,"E-Learning, EdTech, Education, Language Learning, News, Software","Content and Publishing, Education, Media and Entertainment, Software",Newsela is an Instructional Content Platform that supercharges reading engagement and learning in every subject.,"Newsela is an Instructional Content Platform that combines engaging, leveled content with integrated formative assessments and insights to supercharge engagement and learning in every subject. Students and teachers use Newsela to find digital content from hundreds of the best sources—from National Geographic to NASA, Biography.com to Encyclopedia Britannica, the Washington Post to the Wichita Eagle. Content is instructionalized to meet students where they are, with interactive tools and analytics to take them where they want to go. Newsela has become an essential solution for schools and districts, with a presence in over 90% of U.S. K-12 schools. Newsela is the content platform for the connected classroom.",https://www.linkedin.com/company/newsela?trk=company_logo,,https://twitter.com/Newsela,http://www.facebook.com/newsela,"1,981"
ClassDojo,https://www.crunchbase.com/organization/classdojo,http://www.classdojo.com,"Apps, E-Learning, EdTech, Education, Knowledge Management, Software","Administrative Services, Apps, Education, Other, Software","ClassDojo is a school communication platform that teachers, students, and families use to build close-knit communities.","ClassDojo is a school communication platform that teachers, students, and families use to build close-knit communities. It connects teachers with students and parents to build amazing classroom communities and instantly share photos, videos, and announcements on Class Story, or privately message with any parent. It aims to bring communities together and give kids a learning experience they love. ClassDojo was founded in 2011 and is based in San Francisco, California.",http://www.linkedin.com/company/2293241,,http://twitter.com/classdojo,http://www.facebook.com/classdojo,"2,422"
University of Arkansas,https://www.crunchbase.com/organization/university-of-arkansas,http://uark.edu,"E-Learning, Education, Higher Education","Education, Software","The University of Arkansas is a public, co-educational research university, providing undergraduate, graduate, and professional programs.","The University of Arkansas boasts a tradition unique among the nation's universities: Senior Walk, consisting of more than three miles of sidewalks crisscrossing campus that are engraved with the names of more than 150,000 graduates, dating back nearly 140 years. It’s concrete proof of the university’s commitment to our students.",http://www.linkedin.com/company/university-of-arkansas,,http://twitter.com/uarkansas,http://www.facebook.com/UofArkansas,"2,673"
Khan Academy,https://www.crunchbase.com/organization/khan-academy,http://khanacademy.org/,"E-Learning, Education, Internet","Education, Internet Services, Software","Khan Academy is a nonprofit organization that provides a free world class education for anyone, anywhere.","Khan Academy is a nonprofit organization with the mission of providing a free, world-class education for anyone, anywhere. Their learning system is mastery-based, which allows students to master key concepts at a pace that’s just right for them before moving on to more challenging content. Khan Academy’s platform is free for students and teachers and includes thousands of interactive exercises, videos, and articles that cover a range of K–12  subjects.  They offer free personalized SAT practice in partnership with the College Board, MAP Accelerator in partnership with NWEA, Khan Academy Districts, Official Praxis Core Prep in collaboration with ETS, and Official LSAT Prep in collaboration with the Law School Admission Council. More than 18 million learners use Khan Academy every month in 190 countries and more than 40 languages. More than 200,000 educators use their free teacher tools.  As a nonprofit, Khan Academy relies on donations from foundations, corporations, and individuals around the world, as well as earned revenue.",http://www.linkedin.com/company/khan-academy,,http://twitter.com/khanacademy,http://www.facebook.com/khanacademy,"3,166"
Age of Learning,https://www.crunchbase.com/organization/age-of-learning,http://www.ageoflearning.com,"E-Learning, EdTech, Education","Education, Software","Age of Learning provides a comprehensive and engaging online curriculum for pre-k, kindergarten, and early elementary school programs.","Age of Learning is a leading education technology innovator, creating engaging and effective learning resources to help children build a strong foundation for academic success.  Founded in 2007 and based in Los Angeles, the company blends educational expertise, innovative technology, and insightful creativity to bring learning to life. Age of Learning’s flagship product in the U.S., ABCmouse.com® Early Learning Academy, is a research-validated, comprehensive curriculum for preschool through 2nd grade, available on all major digital platforms and used by millions of children in their homes, more than 100,000 classrooms, and thousands of public libraries. ",http://www.linkedin.com/company/age-of-learning-inc.,Unicorn,http://twitter.com/ageoflearning,http://www.facebook.com/AgeOfLearning,"3,180"
LearnZillion,https://www.crunchbase.com/organization/learnzillion,https://learnzillion.com/,"E-Learning, EdTech, Education","Education, Software",LearnZillion provides educators with curricular products for the new standards in digital and print.,"LearnZillion provides educators with curricular products for the new standards in digital and print. Its platform offers access to instructional materials for mathematics and literacy, as well as provides task-implementation guides for teachers that enable students and teachers to get benefited from each other through interactive learning. LearnZillion was founded in 2011 and is based in Washington, District of Columbia.",https://www.linkedin.com/company/learnzillion,,https://twitter.com/LearnZillion,https://www.facebook.com/LearnZillion,"3,430"
Udemy,https://www.crunchbase.com/organization/udemy,http://www.udemy.com,"E-Learning, EdTech, Education, Software, Training","Education, Software","Udemy is an online learning platform that helps students, companies, and governments gain the skills they need to reach their goals.","Udemy is an online learning platform assisting students, companies, and governments gain the skills they need to reach their goals. The marketplace for teaching and learning connects students to instructors. Whether learning for professional development or personal enrichment, students can master new skills through self-paced, on-demand courses, while experts have a way to share their knowledge with the world. For companies, Udemy for Business offers subscription access to 7,000+ business-relevant courses in English, Spanish, French, Portuguese, German, and Japanese, powerful learning analytics, as well as an easy-to-use platform to host and distribute their own content in one central place. It offers Government a highly customizable learning platform designed to upskill workers across organizations and nations and prepare them for the jobs of today and tomorrow. Udemy has offices in Denver, Colorado; Dublin, Ireland; Gurgaon, India; Sao Paulo, Brazil; and Ankara, Turkey. The San Francisco, California-headquartered company was established by Eren Bali, Gagan Biyani, and Oktay Caglar in 2009.",http://www.linkedin.com/company/udemy,"Pledge 1%, Unicorn",http://twitter.com/udemy,http://www.facebook.com/udemy,"3,507"
GetSetUp,https://www.crunchbase.com/organization/getsetup,http://www.getsetup.io,"Continuing Education, E-Learning, EdTech, Elder Care, Information Technology, Virtual Workforce","Administrative Services, Education, Health Care, Information Technology, Software",GetSetup is a social learning platform that offers classes and social opportunities to help older adults.,"GetSetUp is an online platform and community that helps older adults enjoy more fulfilling, independent, and socially connected lives through learning. GetSetUp offers on-demand, engaging learning experiences that range from teaching everyday technical skills to enrichment-focused courses taught by passionate instructors.",https://www.linkedin.com/company/getsetup,,https://twitter.com/SetupGet,https://www.facebook.com/getsetup.io,"3,602"
