Organization Name,Organization Name URL,Website,Industries,Industry Groups,Description,Full Description,LinkedIn,Hub Tags,Twitter,Facebook,CB Rank (Organization)
Newco Insurance,https://www.crunchbase.com/organization/newco-insurance,http://www.newcoinsurance.com,"Auto Insurance, Finance, Insurance, Life Insurance",Financial Services,Newco Insurance™ is an independent insurance agency built for the 21st century.,"Newco Insurance™ is an independent agency built for the 21st century. We blend top tier technology with old school service to provide our clients with the coverage they need at the best price possible. We're insurance geeks. It's not the coolest business in the world but we love what we do and we strive to do it well every day. Our clients are who make it possible and we go above and beyond to make them happy. The only way to understand what Newco Insurance™ is all about is to give us a shot. We'll make sure you have the right coverage and get the best price possible all while having a little bit of fun. Newco's Mission is to become the largest home, auto and life insurance agency in America. We will achieve this by providing better coverage, better prices and better service to our clients.",http://www.linkedin.com/company/newco-insurance,,http://twitter.com/NewcoInsurance,http://www.facebook.com/newcoinsurance,"120,762"
Pendo Systems,https://www.crunchbase.com/organization/pendo-systems,http://www.pendosystems.com,"Artificial Intelligence, Asset Management, Cloud Data Services, Data Integration, Data Mining, Financial Services, FinTech, Insurance, Machine Learning, Software","Artificial Intelligence, Data and Analytics, Financial Services, Information Technology, Internet Services, Science and Engineering, Software",Pendo Systems is a financial technology company providing global financial institutions with the tools and technology to access their data,"Pendo Systems provide financial institutions around the globe with the tools, technology and processes that enable them to be fully data transparent.   The Pendo Platform uses a proprietary algorithm that instantly indexes and classifies their data, making it easily accessible and searchable using our natural search bar, immediately unlocking the value and insights hidden inside millions of mission critical documents.  Only by deploying the Pendo Platform can institutions be certain of gaining complete access to the wealth of data they hold and extracting full value from it. At Pendo Systems we understand that data you can’t access or interrogate adds cost to an organization, but when you turn that data into information you’re able to extract maximum value from it. The transformational impact of the Pendo Platform being able to automate and simplify the retrieval and access to tens of millions of documents can, therefore, be measured both in dollars and cents, as well as the positive impact on a financial institution’s reputation.",http://www.linkedin.com/in/pendosystems,,http://twitter.com/PendoSystemsInc,http://www.facebook.com/pendosystems,"121,006"
Tokio Marine,https://www.crunchbase.com/organization/tokio-marine,http://www.tmhcc.com/,Insurance,Financial Services,Tokio Marine HCC is a leading specialty insurance group with offices in the United States.,Tokio Marine HCC is a leading specialty insurance group with offices in the United States.,https://www.linkedin.com/company/tokio-marine-hcc,,,,"121,022"
The Hartford,https://www.crunchbase.com/organization/the-hartford,http://www.thehartford.com/,"Finance, Financial Services, Insurance",Financial Services,"The Hartford is an industry leading provider of property and casualty insurance, group benefits and mutual funds.","The Hartford is an industry leading provider of property and casualty insurance, group benefits and mutual funds. Throughout our rich history of more than 200 years, countless businesses and individuals, including Robert E. Lee, Abraham Lincoln and Babe Ruth, have turned to our company for protection. The Hartford celebrated its 200th anniversary in 2010.",https://www.linkedin.com/company/the-hartford,,https://twitter.com/TheHartford,https://www.facebook.com/TheHartford,"121,184"
Clearwave,https://www.crunchbase.com/organization/clearwave,http://www.clearwaveinc.com,"Biotechnology, Health Care, Insurance","Biotechnology, Financial Services, Health Care, Science and Engineering",Clearwave operates a healthcare network that allows medical facilities to authenticate insurance eligibility of patients.,"Clearwave Corporation owns and operates a healthcare's authentication network and kiosk that allow medical facilities to authenticate insurance eligibility by identifying patients as active or inactive plan members or self-pay patients. Clearwave Corporation was formerly known as HELPS Corp. The company was founded in 2004 and is based in Atlanta, Georgia.",https://www.linkedin.com/company/clearwave-corporation,,https://www.twitter.com/clearwaveinc,https://www.facebook.com/clearwaveinc,"121,364"
DigiSure,https://www.crunchbase.com/organization/digisure,https://www.digisure.ai/,"Auto Insurance, Car Sharing, Enterprise Software, FinTech, Fleet Management, Identity Management, InsurTech, Mobile, Ride Sharing, Sharing Economy","Financial Services, Information Technology, Mobile, Other, Privacy and Security, Software, Transportation",End-to-end protection solution and cloud-native insurance management system for mobility and shared economy companies,"DigiSure is the leading end-to-end protection solution and cloud-native insurance management system for mobility and shared economy companies. We exist to put more power and control over a portion of the $1.6 trillion in property & casualty (P&C) insurance premiums spent annually directly into the hands of the people who know their businesses and customers best. Our vision is to use connected data and automation to transform risk management to make it more transparent and responsive, similar to how the internet and mobile changed commerce and advertising. We do this by infusing data-enabled intelligence and automation technology into everything we build, all the while delivering a customer experience that is second to none. Founded in 2018 by veterans of leading insurance, mobility and sharing economy companies, DigiSure is working to reimagine insurance for future mobility to create a safer, more secure and climate friendly world. The Company is based in San Francisco and maintains a global footprint. For more information visit, www.digisure.ai.",https://www.linkedin.com/company/digisureinc/,,https://twitter.com/digi_sure,,"121,570"
Claim Maps,https://www.crunchbase.com/organization/claim-maps,http://www.claim-maps.com,"Event Management, Information Technology, Insurance","Events, Financial Services, Information Technology, Media and Entertainment",Claim Maps provides visual maps that unlock hidden information in claim management systems to enable knowledge and insights.,"Claim Maps, LLC provides visual maps that unlock the information hidden in claims management systems to enable knowledge and insights. It provides insights for workers compensation claims of startup companies in the insurance industry. Claim Maps was incorporated in 2009 and is based in Tumwater, Washington.",,,,,"121,899"
Contrarian Holdings,https://www.crunchbase.com/organization/contrarian-holdings,,Insurance,Financial Services,Contrarian Holdings is a provider of insurance service.,Contrarian Holdings is a provider of insurance service.,,,,,"122,091"
One Call Care Management,https://www.crunchbase.com/organization/one-call-care-management,http://www.onecallcm.com/Pages/Home.aspx,"Health Care, Insurance, Medical","Financial Services, Health Care",One Call is a provider of healthcare solutions for the workers'​ compensation industry.,"One Call is a provider of healthcare solutions for the workers'​ compensation industry. As a provider of specialized cost containment services to the workers’ compensation industry, clients can count on One Call Care Management to reduce the headaches and hassles and help them achieve a faster, more efficient, and more cost-effective resolution of claims. From high-end diagnostic procedures to transportation and language services, to superior dental programs and other medical specialties. With OCCM, clients are assured of the highest quality and most cost-effective services from impeccably credentialed providers. in 1985, Liz Griggs headquartered the company in Jacksonville, Florida.",https://www.linkedin.com/company/one-callcm/,,https://twitter.com/onecallcm?lang=en,https://www.facebook.com/onecallcm/,"122,830"
Veriforce,https://www.crunchbase.com/organization/veriforce,http://veriforce.com,"Compliance, Computer, Insurance, Software","Consumer Electronics, Financial Services, Hardware, Professional Services, Software",Veriforce is a computer software company providing safety compliance solutions.,"Veriforce is relied upon by leading organizations for the key solutions required to enhance safety for their workforce and the communities they serve.  Their uniquely comprehensive solutions combine VeriSource, their integrated software to manage Operator Qualification (OQ), Drug and Alcohol, Safety, and Certificate of Insurance Tracking programs, with value-added audit and consulting services and complementary training offerings. Using Veriforce solutions, organizations are able to more efficiently manage their contractor workforce, centralize and streamline critical compliance processes, more effectively mitigate regulatory and third-party risk, and drive ongoing improvement to safety.   Veriforce has seasoned experts on staff who have decades of real-world compliance experience and a deep understanding of key regulations and standards. This expertise, combined with their comprehensive solutions and unparalleled customer support, allows us to effectively guide hiring clients and their contractors through the complexities of setting up and managing compliance programs driven by regulatory and/or company-specific requirements. ",https://www.linkedin.com/company/542961,,https://www.twitter.com/veriforcellc,https://www.facebook.com/veriforce,"123,246"
World Insurance Associates,https://www.crunchbase.com/organization/world-insurance-associates,https://www.worldins.net/,Insurance,Financial Services,World Insurance Associates is an insurance agency.,"World Insurance Associates is an insurance agency It offers extensive, cost-effective personal and business insurance solutions in 50 states. The company specializes in transportation, hospitality, self-storage facilities, construction (surety), manufacturers, and law firms.",https://www.linkedin.com/company/world-insurance-associates-llc,,https://twitter.com/worldinsur,https://www.facebook.com/worldinsur,"123,274"
Trupo,https://www.crunchbase.com/organization/trupo,http://bit.ly/TrupoIntro3,"FinTech, Freelance, Insurance, InsurTech, Software","Financial Services, Professional Services, Software",Insurance benefits packages for freelancers.,"Freelancers deserve benefits the same way full-timers do. That’s why we created Trupo - the HR department for freelancers. Here's the hard truth: With income that ebbs and flows and no HR department, entrepreneurs and freelancers too often have no safety net to fall back on. We’re here to fix that. Trupo’s technology delivers personalized benefits packages. Curated by our experts. Designed for the freelance life. All in one place.",https://www.linkedin.com/company/trupo,,https://twitter.com/HelloTrupo,https://www.facebook.com/HelloTrupo/,"123,722"
Midwest Holding,https://www.crunchbase.com/organization/midwest-holding,https://www.midwestholding.com/,"Finance, Financial Services, Insurance, Life Insurance",Financial Services,Midwest Holding is a financial service holding company that is engaged in the underwriting and marketing of life insurance products.,"Midwest Holding is a financial service holding company that is engaged in the underwriting and marketing of life insurance products. Its product offerings consist of a multi-benefit life insurance policy that combines cash value life insurance with a tax-deferred annuity and a single premium term life product. These product offerings are underwritten, marketed, and managed as a group of similar products on an overall portfolio basis. The company's mission is to advance the insurance value chain with technology and services that reduce cost, increase value, and provide a better experience for our partners and customers.",https://www.linkedin.com/company/midwest-holding-inc./,,,,"123,733"
Erie Insurance Group,https://www.crunchbase.com/organization/erie-insurancegroup,https://www.erieinsurance.com/,Property Insurance,Financial Services,"Erie Insurance offers a range of services to meet family insurance needs, including a variety of home and tenant (renters) insurance policy.","Erie Insurance offers a range of services to meet family insurance needs, including a variety of home and tenant (renters) insurance policies and boat insurance. ERIE also offers a variety of business insurance products to meet the needs of both small and large businesses. Erie Family Life offers a complete line of products to meet individual and business life insurance needs. When H.O. Hirt and O.G. Crawford decided to start an insurance exchange in 1925, they wanted to base it on “simple common sense, mixed with just plain decency.” They turned to the Golden Rule as a guiding principle: “Do unto others as you would have them do unto you.” The two entrepreneurs spent months drumming up support for the Erie Insurance Exchange, with nothing but their axiom and a business plan scribbled on a 10-cent tablet. On April 20, 1925, their fundraising concluded and 90 years of service and innovation began.",https://www.linkedin.com/company/erie-insurance-group,,https://twitter.com/erie_insurance,https://www.facebook.com/erieinsurance/?rf=104061032965070,"124,401"
Dreality,https://www.crunchbase.com/organization/dreality,https://www.dreality.co,"Apps, Car Sharing, Insurance, Management Information Systems, Marketplace, Peer to Peer, Real Estate, Rental Property, Vacation Rental","Apps, Commerce and Shopping, Financial Services, Information Technology, Other, Real Estate, Software, Transportation, Travel and Tourism","Dreality is an all in one marketplace for rentals, services & accommodations.","Dreality is an all in one marketplace for rentals, services & accommodations. Rentals including Exotic Cars, Yachts, Jet-Ski's, Venues, Chuaffeurs, & much more. Services including Private Chefs', Dj's, Masseuse's, House Keeping, Mobile Auto detailing & much more. Accommodations such as Homes, Condos, PentHouses, Villas and more. Anyone with a tangible rental, service or accommodation can host there rental or service while anyone can book at the owners discretion. Don't have anything to rent? Start booking and turn your Dreams into a Reality. Start Hosting & Earning.",,,,https://www.facebook.com/drealitylifestyle/?view_public_for=115687333207604,"124,425"
Home365,https://www.crunchbase.com/organization/clipcall,https://www.Home365.co,"Interior Design, Mobile, Property Insurance, Property Management, Real Estate, Real Estate Investment, Real Time, Rental Property, Search Engine, Video","Design, Financial Services, Internet Services, Media and Entertainment, Mobile, Other, Real Estate, Video","Home365 makes owning and renting out real estate easy, predictable, and more profitable than ever before.","Home365 makes owning and renting out real estate easy, predictable, and more profitable than ever before. As the first and only company to introduce an all-inclusive, property-specific Management as a Service (PMaaS) model, Home365 is disrupting the market as a new breed of property management. By leveraging data analysis, Home365 is able to predict maintenance incidents for single family rentals (SFRs) and offer flat monthly rates for individual properties that are up to 50% more affordable. This rate includes all management, maintenance (labor and materials), vacancy insurance, innovative financial products, and more. The management and maintenance services operate on a web & mobile platform and are executed by network of reliable, constantly monitored vendors with strong relationships to the company. This system dramatically improves managerial efficiency, reduces overall handling times, and significantly increases profit margins. Home365 offers property owners full predictability of their investment’s performance, peace of mind, and a “passive investment” experience while lowering the costs of ownership and providing a superior user experience for tenants and landlords alike.",,,https://twitter.com/HelloHome365,https://www.facebook.com/Home365PropertyMaintainance/,"124,567"
Insurance Noodle,https://www.crunchbase.com/organization/insurance-noodle,https://www.insurancenoodle.com,"Enterprise Software, Insurance, Intellectual Property","Financial Services, Professional Services, Software","Insurance Noodle is an online quoting hub for insurance agents, offering small commercial property and casualty insurance solutions.","Insurance Noodle is an online quoting hub for insurance agents, offering small commercial property and casualty insurance solutions. Member agents access the hub's numerous admitted national carriers through one application entry point. It offers immediate, bindable quotes from up to six national, admitted carriers.   Insurance Noodle was founded in 2000 and is based in Chicago, Illinois, the United States.",http://www.linkedin.com/company/insurance-noodle,,http://twitter.com/insurancenoodle,http://www.facebook.com/pages/Insurance-Noodle-LLC/167987986616463,"124,775"
Crawford & Company,https://www.crunchbase.com/organization/crawford-company,https://www.crawco.com/,"Finance, Insurance",Financial Services,Crawford & Company (Crawford) is an independent provider of claims management solutions.,"Crawford & Company (Crawford) is an independent provider of claims management solutions to the risk management and insurance industry, as well as self-insured entities entities, with a global network serving clients in more than 70 countries. It has four segments: America, which serves the property and casualty insurance company markets in the U.S., Canada, Latin America, and the Caribbean; International Operations, EMEA/AP, which serves the property and casualty insurance company markets in Europe, including the United Kingdom, the Middle East, Africa, and Asia-Pacific; Broadspire, which serves the United States self-insurance marketplace, and Legal Settlement Administration, which serves the securities, bankruptcy and other legal settlements markets, primarily in the United States. In October 2011, The Garden City Group, Inc., a wholly owned subsidiary of the Company acquired Settlement Services, Inc. In February 2011, the Company acquired Studio Bolton & Associati S.r.l.",https://www.linkedin.com/company/crawford-&-company/,,https://twitter.com/crawco,https://www.facebook.com/crawfordandco,"124,825"
Spring Venture Group,https://www.crunchbase.com/organization/spring-venture-group,https://www.springventuregroup.com/,"Financial Services, Insurance, Marketing","Financial Services, Sales and Marketing","A Kansas City, Missouri-based digital insurance platform.",Spring Venture Group is a leader in insurance comparison shopping. We deliver real value to their clients by helping them navigate their insurance options to get the best rates possible—specifically in the senior healthcare space. Their advisors use an unbiased approach to deliver real value to every client’s individual needs. That’s what makes us different.,https://www.linkedin.com/company/spring-venture-group/,,https://twitter.com/SpringVentureKC,https://www.facebook.com/SpringVentureGroup/,"124,955"
Crystal & Company,https://www.crunchbase.com/organization/crystal-company,https://www.crystalco.com/,Insurance,Financial Services,Crystal & Company is the home for talented insurance professionals.,"Crystal & Company is the home for talented insurance professionals: creative, committed to their clients and driven to deliver extraordinary results. Crystal & Company is approaching its 85th year of operation. Their heritage is as a leading independent insurance brokerage firm with deep roots in the financial sector but their story is actually much more than that. It is the story of a family that worked hard to build a vibrant business that works with leading companies around the globe. Under the leadership of Jim Crystal, the firm has thrived and diversified. They are proud to be independent and in their third generation of family ownership. They are proud of the growth they have achieved over the last 85 years. They are optimistic about the future that lies ahead of them.",https://www.linkedin.com/company/crystal-&-company/,,https://twitter.com/Crystal_Company,,"124,992"
TRANZACT,https://www.crunchbase.com/organization/tranzact,http://www.tranzact.net,"Direct Sales, Insurance","Financial Services, Sales and Marketing","MG LLC, a provider of sales and marketing services to insurance companies that does business as Tranzact","TRANZACT provides a turnkey, direct-to-consumer sales capability to insurance carriers.  The company leverages and integrates sophisticated digital, data and direct marketing solutions that combined with licensed sales execution capabilities deliver new policy holders to carriers seeking to acquire and manage large numbers of customers in three primary insurance verticals:  Health, Life, and P&C/Auto. TRANZACT markets these insurance products by dedicating professional licensed agents to each carrier's brand and applying its proven marketing techniques, sales execution strategies, case management practices, data-driven analytics and compliance infrastructure. Its customers include the leading brands in the insurance industry. In addition the company licenses its proprietary technology to help its customers enhance their insurance marketing and sales operations.",https://www.linkedin.com/company/tranzact,,https://www.twitter.com/tranzact,https://www.facebook.com/TRANZACT-381706115193115/,"125,264"
ProSight Specialty Insurance,https://www.crunchbase.com/organization/prosight-specialty-insurance-2,http://www.prosightspecialty.com,Insurance,Financial Services,"ProSight Specialty Insurance Group, Inc. provides specialty insurance products.","ProSight Global, Inc. is an innovative property and casualty insurance company that designs unique insurance solutions to help customers improve their business and realize value from their insurance purchasing decision. The company focuses on select niche industries, deploying differentiated underwriting and claims expertise with the goal of enhancing each customer’s operating performance. ProSight’s products are sold through a limited and select group of retail and wholesale distribution partners.",https://www.linkedin.com/company/prosight-specialty-insurance,,https://www.twitter.com/prosightcorp,https://www.facebook.com/prosightspecialty,"125,659"
Wallace Welch & Willingham,https://www.crunchbase.com/organization/wallace-welch-willingham,http://w3ins.com,"Finance, Financial Services, Insurance",Financial Services,"Wallace Welch & Willingham is an insurance company that offers auto, life, and marine insurance products.","Wallace Welch & Willingham is an insurance company that offers auto, life, and marine insurance products. The company also offers risk management solutions. The W3 Advantage, its proprietary risk management system, is a valuable resource they provide to assist their clients with workplace safety, loss control, and legal compliance.",https://www.linkedin.com/company/w3insurance/,,https://www.twitter.com/w3insurance,https://www.facebook.com/w3ins,"125,814"
QuoteWizard,https://www.crunchbase.com/organization/quotewizard,http://quotewizard.com,"Finance, Insurance, Marketing","Financial Services, Sales and Marketing","Quote Wizard helps consumers connect with insurance companies to save on auto, home, life, and health insurance.","Quote Wizard is a company which helps consumers connect with insurance companies to save on auto, home, life, and health insurance. It provides insurance comparison shopping and research tool that enables consumers to compare agent and carrier quotes locally and nationally to get the best, most affordable coverage. Founded in 2006, Quote Wizard is based in Seattle, Washington.",http://www.linkedin.com/company/quotewizard,,http://twitter.com/quotewizard,http://www.facebook.com/QuoteWizard,"126,193"
