Organization Name,Organization Name URL,Website,Industries,Industry Groups,Description,Full Description,LinkedIn,Hub Tags,Twitter,Facebook,CB Rank (Organization)
Zinc Platform,https://www.crunchbase.com/organization/zinc-platform,https://www.zincplatform.com/,"Insurance, Internet, Internet of Things, Software","Financial Services, Internet Services, Software",Zinc Platform is building digital infrastructure to power the next generation of homeowners insurance distribution.,"Zinc Platform, Inc. is focused on providing software that digitizes the last frontier of the mortgage origination process– getting homeowners insurance. Zinc builds technology that integrates with the core systems of today’s modern mortgage lenders to power digital portals for borrowers to procure the homeowners (property) insurance that is required to close a mortgage.  Zinc’s technology takes a broken, week-long process and turns it into a delightful five-minute experience. For borrowers, Zinc powers access to all of the nation’s leading insurance carriers. For mortgage lenders, Zinc ensures compliance with underwriting requirements while automating more of the mortgage closing process.  Zinc is proudly built in New York City by passionate technologists and business strategists focused on making the process of buying a home a more simple, delightful experience",https://www.linkedin.com/company/zinc-platform/,,https://twitter.com/zincplatform,https://www.facebook.com/zincplatform/,"69,067"
Truvius,https://www.crunchbase.com/organization/truvius,http://Www.truvius.com,"Insurance, InsurTech, Shipping Broker","Financial Services, Transportation",Truvius  is an online insurance broker that serves as a personalized administrator of your insurance policies.,"Truvius  is an online insurance broker that serves as a personalized administrator of your insurance policies. At Truvius we understand that there are times when we are fragile in the face of adversity, situations where we need support, facts where we want the best protection, we believe it is possible to help live safer and more protected lives.  In Truvius you will get the protection, tranquility, and security that you and your family require.  At Truvius we update every day to advise our clients at any time, so you worry about what is really important.",,,,,"69,228"
Avatar Financial Group,https://www.crunchbase.com/organization/avatar-financial-group,https://www.avatarfinancial.com,"Financial Services, Insurance, Real Estate","Financial Services, Real Estate","Avatar Financial Group specializes in commercial bridge loans, offering solutions for non-conforming, income-producing real estate projects.","Avatar Financial Group specializes in commercial bridge loans, offering solutions for non-conforming, income-producing real estate projects. It is a quick response commercial hard money lender. While the current market has created a lack of credit availability for real estate investors and small business owners, the company is positioned to meet the market needs and expand its portfolio without the regulatory constraints that large banks and institutional lenders are now facing. The company was founded in 2003 and is headquartered in Seattle, Washington.",https://www.linkedin.com/company/avatar-financial-group/,,https://twitter.com/AvatarHardMoney,,"69,469"
SUNUP Insurance Services,https://www.crunchbase.com/organization/sunup-insurance-services-llc,http://www.sunupinsurance.com,"Finance, Financial Services, Insurance",Financial Services,SUNUP Insurance provides an agent-focused franchise model for insurance agents wanting to run their own business.,"SUNUP Insurance provides the premier, agent-focused franchise model for insurance agents. It offers a distribution system that allows the agent the freedom of the IA model, the teamwork of the Captive model without the pressure of minimum performance quotas, and a training system. Its experience enables them to share proven sales practices, as they assist its franchisee partners in building a strong client base.",https://www.linkedin.com/company/sunupinsurance/,,https://twitter.com/SUNUPInsurance,,"69,605"
Blue Cod Technologies,https://www.crunchbase.com/organization/blue-cod-technologies,http://www.bluecod.net,"Information Technology, Insurance, Software","Financial Services, Information Technology, Software",Blue Cod Technologies is a provider of managed insurance services for the property and casualty industry.,"Blue Cod Technologies provides management and information technology consulting, software solutions and applications, hosted information technology services, and business process outsourcing services. It offers business process outsourcing services in the areas of customers, policy, premiums, claims, and print and distribution. It was founded in 2000 and headquartered in Marlborough, Massachusetts.",http://www.linkedin.com/in/bluecodtechnologies,,http://twitter.com/BlueCodTech,http://www.facebook.com/bluecodtechnologies,"70,035"
SafetyWing,https://www.crunchbase.com/organization/safetywing,http://www.safetywing.com,"Financial Services, Insurance",Financial Services,SafetyWing builds a global safety net for online freelancers.,"SafetyWing builds a global safety net for online freelancers. SafetyWing is currently offering a travel medical insurance for digital nomads. The company's mission is to help people who are considering becoming nomads take the first step by providing an affordable, comprehensive and global insurance, as well as knowledge sharing and resources. SafetyWing makes the transition to location independence easier for new members of our community.",https://www.linkedin.com/company/safetywing/,,https://twitter.com/safetywing,https://www.facebook.com/safetywing/,"70,082"
AssureGuru,https://www.crunchbase.com/organization/assureguru,https://www.assureguru.com/,"Finance, Financial Services, Insurance",Financial Services,"AssureGuru is a digital insurance agency and broker which provides auto, home, landlord, rental, business, pet, and umbrella insurance.","AssureGuru is a digital insurance agency/broker which provides auto, home, landlord, rental, business, pet, and umbrella insurance. They provide the right balance between price and protection. It was founded in 2019 and is based in Georgia.",,,,https://www.facebook.com/assureguru/,"70,222"
Atlas General,https://www.crunchbase.com/organization/atlas-general,http://atlas.us.com/,"Commercial, Health Insurance, Insurance","Financial Services, Other","Atlas General specializes in workers'​ compensation insurance, property insurance, and general commercial insurance.","Atlas General specializes in workers'​ compensation insurance, property insurance, and general commercial insurance. Atlas specializes in developing and underwriting specialty programs with a variety of insurance carrier partners.  The company was founded in 2009 and headquartered in San Diego, California.",https://www.linkedin.com/company/atlas-general-insurance-company/,,https://twitter.com/atlasgenera,https://www.facebook.com/AtlasGeneralInsuranceServices/,"70,356"
InsureScan Inc.,https://www.crunchbase.com/organization/insurescan,http://www.insurescan.net,"Auto Insurance, Commercial Insurance, Insurance, InsurTech, Property Insurance",Financial Services,InsureScan develops all-in-one mobile solutions that helps insurance agencies serve their customers using advanced next-gen tools & metrics.,"InsureScan leverages smartphone features to create a seamless “Once and Done” experience.  Packed with features and enhancements in demand by large agencies, and their agents. Scan License & VIN. Quote. Buy. InsureScan streamlines the policy quoting process & even automated self-claim submission with no need to talk to an agent unless you truly want to, regardless of how simple or complex your programs are. Save time, eliminate keystrokes, and process more. Our mobile platform has a 99.3% accuracy rate, utilizing an industry-first decoding process to auto-fill all entry form fields, heavily reducing new-policy procurement time and overhead costs.",https://www.linkedin.com/company/insurescan/about/,,http://www.twitter.com/insurescan,http://www.facebook.com/insurescan,"70,363"
Schedule it,https://www.crunchbase.com/organization/schedule-it,https://www.scheduleit.io/,"Banking, Insurance, Software","Financial Services, Lending and Investments, Software","Software for anyone who handles Routing, Calendars, Income & Expenses.","Bob and Rebecca founded Schedule It while working claims for Hurricane Sandy. Overworked, overwhelmed and feeling out of control, they turned their appointment scheduling over to a trusted friend. Within days, their phone quit ringing as they were scoping a roof or standing in a flooded basement. Along with fewer distractions, they noticed fewer stops for fuel.",https://www.linkedin.com/company/schedule-it-llc/,,https://twitter.com/ScheduleItLLC,https://www.facebook.com/ScheduleItLLC/,"70,492"
Dock411,https://www.crunchbase.com/organization/dock411,http://dock411.com/,"Insurance, Logistics, Transportation","Financial Services, Transportation",Dock411 saves drivers time and money by sharing important information about their drop-off and pick-up locations before they arrive.,"Dock411 is a mobile application that provides its users with information about driver drop-off and pick-up locations. The application provides its users with estimated wait times, weight limits, overnight parking, hazards, local directions, dock door numbers, load procedures, and emergence delay details. Furthermore, the application enables drivers and shippers to register to the dock411 network. Dock411 was launched in 2015 by Eric Weidl and Daniel Serewicz and is based in Illinois.",https://www.linkedin.com/company/Dock411,,https://www.twitter.com/dock411app,https://www.facebook.com/dock411,"70,515"
Prudential Financial,https://www.crunchbase.com/organization/prudential-financial,http://www.prudential.com,"Finance, Financial Exchanges, Financial Services, Insurance","Financial Services, Lending and Investments","Prudential Financial specializes in the fields of investment management, life insurance, and retirement benefits.","Prudential Financial is a financial services company that specializes in the fields of investment management, life insurance, and retirement benefits. It focuses on helping individuals and institutional customers to grow and protect their wealth. The company also offers an inclusive work environment where employees can develop to their full potential, and give back to the communities where they live and work.  Prudential Financial was founded in 1875 and headquartered in Newark, New Jersey.",http://www.linkedin.com/company/prudential-financial,,https://twitter.com/prudential,https://www.facebook.com/Prudential/,"70,952"
Premins Company,https://www.crunchbase.com/organization/the-premins-company,https://www.preminsco.com/,"Finance, Financial Services, Insurance",Financial Services,"Premins Company facilitates insurance premium financing for commercial, personal, and assigned risk policies.","Premins Company facilitates insurance premium financing for commercial, personal, and assigned risk policies. It is a family-owned insurance premium finance company established in 1965 and licensed in New York, New Jersey, and Connecticut.",https://www.linkedin.com/company/the-premins-company,,,,"71,358"
USAA,https://www.crunchbase.com/organization/usaa,https://www.usaa.com,"Banking, Commercial Real Estate, Financial Services, Insurance, Venture Capital","Financial Services, Lending and Investments, Real Estate","USAA is a private Fortune 150 financial services company that provides banking, insurance, and investment to the military community.","In 1922, when 25 Army officers met in San Antonio and decided to insure each other's vehicles, they could not have imagined that their tiny organization would one day serve 10.4 million members and become the only fully integrated financial services company in America.  The mission of the association is to facilitate the financial security of its members, associates, and their families through provision of a range of highly competitive financial products and services; in so doing, USAA seeks to be the provider of choice for the military community.",https://www.linkedin.com/company/usaa,Crunchbase Venture Program,https://twitter.com/USAA,https://www.facebook.com/USAA,"71,483"
Quaint Oak Bank,https://www.crunchbase.com/organization/quaint-oak-bank,http://quaintoak.com,"Banking, Finance, Financial Services, Insurance, Real Estate, Venture Capital","Financial Services, Lending and Investments, Real Estate","Quaint Oak Bank is a bank that specializes in savings, commercial & investment property lending, mortgage lending, and SBA lending.","Quaint Oak Bank is a bank that specializes in savings, commercial & investment property lending, mortgage lending, and SBA lending.",,,,,"71,493"
Intersection Technologies,https://www.crunchbase.com/organization/intersection-technologies,http://fandiexpress.com,"Automotive, Finance, Insurance","Financial Services, Transportation","Intersection Technologies provides e-contracting technology solutions for the automotive, finance, and insurance industries.","Intersection Technologies, Inc was formed in 2008 to provide the automotive services industry a fresh approach on how to solve business challenges and issues.  The first focus of the company was in conjunction with Advent Resources, building an e-contracting system called F&I Express that has the focus of making the contracting and registering of F&I Aftermarket products an easier process for the dealer. In doing so, the improved dealer process created many benefits to the process stakeholders who are the Agents and Administrators/Providers. At some point in time everything done in the F&I office will be electronic and F&I Express is a platform that brings the F&I Office closer to this vision.",http://www.linkedin.com/company/1657944,,http://twitter.com/FandIExpress,https://www.facebook.com/ride-for-the-brand-359537781283,"71,529"
Spex,https://www.crunchbase.com/organization/spex-it,https://spexreport.com/,"Information Technology, Property Insurance, SaaS, Software","Financial Services, Information Technology, Software",Property Inspection Platform for Insurance Carriers and Claims Service Providers.,"Spex is a software platform that leverages easy-to-use field software (running on iOS and Android) to consistently capture high quality property data and instantly report on that data to remote collaborators.   Spex’s core expertise is in property inspections related to insurance and specializes in enabling remote collaboration workflows and handling very large quantities of property data with extreme efficiency. Spex Customers include some of the world’s best IA Firms, TPA’s, Forensic Engineering Firms, Restoration Contractors and Construction Consulting Firms. Spex was founded in 2012 by two long time insurance adjusters, is headquartered in Denver Colorado and supported by a highly talented team of property insurance and software experts.",http://www.linkedin.com/company/spexapp,,https://twitter.com/SpexReport,https://www.facebook.com/spexreport,"71,638"
DirectDerm,https://www.crunchbase.com/organization/direct-dermatology,https://www.directderm.com/,"Health Care, Insurance, Medical","Financial Services, Health Care",DirectDerm provides teledermatology consultative services for patients facing skin-related medical problems.,DirectDerm is to allow medical providers the ability to access immediate consultative services with a top-quality US board-certified dermatologist for any of their patients' skin related medical problems.,https://www.linkedin.com/company-beta/1813696/,,https://twitter.com/directderm,https://www.facebook.com/directdermatology/,"71,714"
Northwestern Mutual,https://www.crunchbase.com/organization/northwestern-mutual-life,https://www.northwesternmutual.com,"Finance, Financial Services, Insurance",Financial Services,"Northwestern Mutual delivers financial security to millions with life, disability income and long-term care insurance, and investments.","Northwestern Mutual has been helping people and businesses achieve financial security for more than 160 years. Through a holistic planning approach, Northwestern Mutual combines the expertise of its financial professionals with a personalized digital experience and industry-leading products to help its clients plan for what's most important. Northwestern Mutual delivers financial security to millions with life, disability income and long-term care insurance, annuities, and brokerage and advisory services. The company manages billion of dollars of investments owned by its clients and held or managed through its wealth management and investment services businesses.  Northwestern Mutual is the marketing name for The Northwestern Mutual Life Insurance Company (NM), Milwaukee, WI (life and disability insurance, annuities, and life insurance with long-term care benefits) and its subsidiaries. Subsidiaries include Northwestern Mutual Investment Services, LLC (NMIS) (securities), broker-dealer, registered investment adviser, member FINRA and SIPC; the Northwestern Mutual Wealth Management Company® (NMWMC) (fiduciary and fee-based financial planning services), federal savings bank; and Northwestern Long Term Care Insurance Company (NLTC) (long-term care insurance).",https://www.linkedin.com/company/northwestern-mutual,,https://twitter.com/nm_news,https://www.facebook.com/northwesternmutual,"72,614"
Zywave,https://www.crunchbase.com/organization/zywave,http://www.zywave.com,"Insurance, Software","Financial Services, Software",Zywave leads the insurtech industry with the most comprehensive cloud platform solutions.,Zywave leads the insurance tech industry with the most expansive portfolio of sales mgmt and client delivery solutions,https://www.linkedin.com/company/zywave,,https://www.twitter.com/zywave,http://www.facebook.com/pages/Zywave/340588587485,"73,009"
HERO App,https://www.crunchbase.com/organization/hero-app,http://hero-app.com/,"Advertising Platforms, Insurance, Mobile Apps, Nightlife, Transportation","Advertising, Apps, Events, Financial Services, Media and Entertainment, Mobile, Software, Transportation","The HERO app makes it easy to get customers home after drinking, lower your liquor liability, and reward customers for being safe.","HERO is a movement, it’s a community of people and businesses providing a responsible solution to get home in your pocket, supporting the ability to safely enjoy a night out with friends and loved ones. We are committed to fundamentally changing the drunk driving culture that has devastated so many families.",https://www.linkedin.com/company/hero-app-co,,https://twitter.com/HeroAppIt,https://www.facebook.com/HeroAppIt/,"73,011"
Asurion,https://www.crunchbase.com/organization/asurion,http://www.asurion.com,"Electronics, Insurance, Mobile","Consumer Electronics, Financial Services, Hardware, Mobile",Asurion helps people get the most out of their technology by providing expert help and product insurance and warranties.,"Simply put, Asurion helps people stay connected. As the global leader of connected life services, they provide over 290 million consumers around the world with simple, intuitive technology advice to help them get the most from their devices; support to fix their issues and connectivity crisis, and device protection to ensure they receive a replacement or repair. When a product is missing or simply doesn't work properly, Asurion’s 17,000 employees are focused on solving the problem with people and processes operating 24 hours a day, seven days a week, speaking six languages, and working across any device, platform, or provider. By partnering with leading retailers, mobile carriers and pay-tv providers, Asurion helps customers enhance their lives through their technology.",https://www.linkedin.com/company/asurion/,,http://twitter.com/Asurion,http://www.facebook.com/asurion,"73,070"
VOOM Insurance,https://www.crunchbase.com/organization/skywatch-technologies,https://www.voominsurance.com,"Artificial Intelligence, Computer, Drones, Enterprise, Insurance, Software","Artificial Intelligence, Consumer Electronics, Consumer Goods, Data and Analytics, Financial Services, Hardware, Other, Science and Engineering, Software","On-demand, Data-Driven InsurTech platform for anything you Can Ride, Fly or Sail.","VOOM is the world’s first on-demand, telematics-based InsurTech platform for Specialized Mobility products, dedicated to protecting users for anything they ride, fly, or sail.  The company’s first product, SkyWatch.AI, leverages the power of machine learning to assess and mitigate risks and provide on-demand insurance for thousands of drone pilots operating across the US.  VOOM’s data-driven, usage-based insurance products include multiple high-risk, episodic-usage mobility verticals, including e-scooters, e-bikes, powersports, motor boats, and small planes. Headquartered in Tel Aviv with an office in Palo Alto, CA, VOOM is a licensed insurance broker in all 50 US states.",https://www.linkedin.com/company/voom-insurance/,,https://twitter.com/VoomInsurance,https://www.facebook.com/VOOMinsurance/,"73,335"
Paradigm Holdings,https://www.crunchbase.com/organization/paradigm-holdings-8307,https://www.pdgm.com/,Insurance,Financial Services,Paradigm Holdings is a provider of insurance service.,Paradigm Holdings is a provider of insurance service.,https://www.linkedin.com/company/paradigm_2/,,,,"73,575"
NextImage Medical,https://www.crunchbase.com/organization/nextimage-medical,http://nextimagemedical.com/home.php,"Health Care, Insurance, Medical","Financial Services, Health Care",NextImage Medical is a radiology services management company providing healthcare imaging solutions.,"NextImage Medical, Inc. operates as a radiology services management company. The company offers health care imaging solutions for worker's compensation insurance, group health insurance, self-insured employers, third party administrators, and direct-to-consumers. It provides patient care from electronic centralized scheduling of the medical procedure to the tracking and electronic delivery of digital images and reports. The company, through its NextImageGrid technology, enables physicians, patients, case managers, and adjusters to schedule an appointment for imaging services, as well as to access the digital images and diagnostic reports online through its Web portal. NextImage Medical, Inc. was incorporated in 2006 and is based in San Diego, California.",http://www.linkedin.com/company/nextimage-medical,,http://twitter.com/nextimagemed,http://www.facebook.com/RadiologyEssentials,"73,714"
Avalon Health Management,https://www.crunchbase.com/organization/avalon-health-management,http://www.avalonhealthcare.com/,"Health Care, Insurance","Financial Services, Health Care",Avalon Health Management is a provider of health care services to seniors.,"Avalon Health Management is a provider of health care services to seniors. At Avalon Health Care, a commitment to quality reflects a desire for care paired with innovation and compassion in all that they do. It means their aim is that patients receive not only outstanding care but that their care professionals are actively engaged in professional development and advancing the industry to improve the health of all that they serve. Its care teams work to develop innovative care improvement strategies such as interdisciplinary care teams designed to partner with patients through their care journey, striving to protect our vulnerable patients through eliminating healthcare-acquired conditions such as falls, pressure ulcers, and infections and developing early warning systems that alert care teams to intervene rapidly with subtle changes in a patient’s condition indicating decline.",https://www.linkedin.com/company/avalon-healthcare,,https://www.twitter.com/avalon_care,https://www.facebook.com/avalonhealthcaregroup,"73,993"
AdvisorBid,https://www.crunchbase.com/organization/advisorbid,https://www.advisorbid.com,"Finance, Financial Services, FinTech, Insurance, Social Media, Social Network, Wealth Management","Financial Services, Internet Services, Media and Entertainment","AdvisorBid is a patent-pending, modern marketplace for FAs to receive competing offers from BDs, RIAs, and OSJs.","AdvisorBid is an automated and patent-pending marketplace for financial advisors in motion to solicit to receive competing offers from Broker-Dealers (BDs), Registered Investment Advisers (RIAs), and Offices of Supervisory Jurisdiction (OSJs) with one click of a button.",https://www.linkedin.com/company/advisorbid%E2%84%A2/,,https://twitter.com/advisorbid,https://www.facebook.com/AdvisorBid/,"74,438"
TCA Global Master Credit Fund,https://www.crunchbase.com/organization/tca-global-master-credit-fund,https://tcaglobalfund.com,"Banking, Crowdfunding, Insurance","Financial Services, Lending and Investments","TCA Global Master Credit Fund is a predominately short-duration, absolute return fund specializing in senior secured lending.","TCA is a predominately short-duration, absolute return fund specializing in senior secured lending and advisory services to small-caps located mainly in the US, Canada, Western Europe and Australia. The investment objective of the Fund is to seek to achieve superior risk-adjusted returns primarily by making directly negotiated debt and equity-related investments in public and, to a lesser extent, private companies.",,,,,"74,714"
