Organization Name,Organization Name URL,Website,Industries,Industry Groups,Description,Full Description,LinkedIn,Hub Tags,Twitter,Facebook,CB Rank (Organization)
United Automobile Insurance Company,https://www.crunchbase.com/organization/united-automobile-insurance-company,https://www.uaig.net/,"Auto Insurance, Automotive, Insurance","Financial Services, Transportation",Provide a high quality and low cost insurance product to the non-standard automobile insurance market.,"United Automobile Insurance Company (UAIC) was incorporated on March 2, 1989 in Miami Gardens, FL to provide a high quality and low cost insurance product to the non-standard automobile insurance market. The company is family owned and it is one of the largest privately held property and casualty insurance companies in the United States.UAIC has a world class information technology department. Their  web technology is rated year after year as the easiest to use and most dependable by our agents.",https://www.linkedin.com/company/unitedautomobileinsurance/,,https://twitter.com/uaig,https://www.facebook.com/pages/United-Automobile-Insurance-Company/125951494124675,"24,155"
Sherpaa,https://www.crunchbase.com/organization/sherpaa,http://sherpaa.com,"Delivery, Health Care, Insurance","Administrative Services, Financial Services, Health Care",Sherpaa connects employees directly with doctors and insurance guides online to reduce healthcare costs.,"Sherpaa was co-founded by Dr. Jay Parkinson MD, MPH, trained in pediatrics and preventive medicine at St. Vincent’s and Johns Hopkins. He’s given talks for TED and The Clinton Global Initiative. He’s been referred to as “The Doctor of the Future”. Cheryl Swirnow, Sherpaa’s co-founder, graduated from Cornell’s Hotel School with a concentration in HR. With fifteen years' experience in Human Resources, she has worked for the likes of Four Seasons Hotels and Resorts, Quintessentially, Nike, The Barbarian Group and Rent the Runway.",https://www.linkedin.com/company/sherpaa-health-inc-,,https://twitter.com/SherpaaHealth,https://www.facebook.com/sherpaanyc?fref=ts,"24,320"
Outline,https://www.crunchbase.com/organization/outline-0db5,https://outlinerisk.com/,"Information Technology, Insurance, Software","Financial Services, Information Technology, Software","Outline offers placement, transactions, and underwriting for carriers and brokers.","Outline is offering tools to underwriters and brokers for doing business. Outline help to build technology for the industry. Outline gives effective, flexible, modern technology solutions for trading E&S insurance. They aspire to be the leading software provider in the industry. At Outline, their goal is to build the technology platform of the future of the E&S insurance industry. They are working with the premier carriers and brokerages to build a new trading experience that turns painful and time consuming back and forth into a seamless digital experience.",https://www.linkedin.com/company/outline-risk/,,,https://www.facebook.com/pg/outlinerisk/,"24,334"
Glow,https://www.crunchbase.com/organization/glow-aa96,http://www.glow.co,"Financial Services, Insurance, InsurTech",Financial Services,Glow is an insurance company that aims to transform insurance to better protect people.,"Glow is an insurance company that aims to transform insurance to better protect people. The company is working toward holistic coverage for work, life and everything in between. Glow was founded in 2018 and based in San Francisco, California.",https://www.linkedin.com/company/glowinsurance/,,,,"24,737"
Wheelz,https://www.crunchbase.com/organization/wheelz,http://www.wheelz.com,"Automotive, Collaborative Consumption, Insurance, Logistics, Sharing Economy","Financial Services, Other, Transportation",Wheelz provides a car sharing platform facilitating economic opportunities for car owners by leasing their vehicles to non-owners.,"Wheelz (www.wheelz.com) is an early stage, venture backed start-up that is introducing a better approach to personal transportation and car ownership. Wheelz peer-to-peer car sharing platform provides a compelling economic opportunity for car owners to securely lease their vehicles on an hourly or daily basis, and a convenient and affordable personal transportation solution for those who don’t own a car.  Cars are the second largest personal asset class on the American balance sheet. They are chronically under-utilized -- most vehicles are parked 23 of 24 hours daily --; and they begin losing value the minute they drive off the lot. The current model – high-value, rapidly depreciating, poorly utilized – of car ownership is busted. Wheelz is un-busting it;  introducing a more efficient model of car ownership, a model that is more responsible for the planet and the pocketbook.",https://www.linkedin.com/company-beta/2439100/?pathWildcard=2439100,,http://twitter.com/gowheelz,,"24,804"
Leap,https://www.crunchbase.com/organization/leap-e9c5,http://leapeasy.com,"Consumer Software, FinTech, InsurTech, Property Insurance, Real Estate","Financial Services, Real Estate, Software",Leap is an innovative proptech/insuretech providing rent default insurance for multi-family housing across the United States.,"Leap is a high-growth fintech startup that helps under-qualified individuals gain access to sought-after apartments by acting as a cosigner on their lease.  Typically, landlord portfolios experience between 5%-10% vacancy loss on rentals. Yet, perfectly good applicants are regularly declined due to blemished credit, student status, or other factors that do not impact their ability to pay. That’s where Leap helps. Our proprietary underwriting tools allow for quick and thorough vetting of potential residents which expands a landlord’s pool of qualified tenants and eliminates default risk.  There is no cost to the landlord as the one-time, upfront fee is paid by the resident and secures rental income for the entire term of the lease. Further, Leap accepts applications from tenants before they begin their apartment search, pre-approving them up to a certain monthly rent amount and delivering qualified residents directly to landlords.  Our goal is to improve the financial performance of landlords while helping people qualify for better apartments.   Our application takes 4 minutes to complete and can be submitted on a phone, tablet, or computer, and approvals take just 30 minutes during business hours. Furthermore, Leap can pre-approve renters for a maximum monthly rental amount for free. That way if you haven’t found an apartment yet, it’s easier to know what to look for. With Leap, renters can get the apartment they want, not just the one landlords say they qualify for. No apartment is out of reach, and that is a guarantee. Visit us at www.leapeasy.com to see how easy it is to get the apartment of your dreams!",https://www.linkedin.com/company/leap-insurance-agency-llc/,,https://twitter.com/LeapEasy,https://www.facebook.com/leapeasy/,"24,851"
Mile Auto,https://www.crunchbase.com/organization/mile-auto,https://www.mileauto.com/,"Computer Vision, Insurance, InsurTech","Financial Services, Hardware, Software",Mile Auto provides a pay-per-mile car insurance service that saves lower mileage drivers money.,"Mile Auto is a pay-per-mile auto insurance company that uses patented computer vision technologies to help low mileage drivers save money. Mile Auto customers use their smartphones to report mileage once a month, and then pay based on exact miles driven. The result is simple, transparent billing. Mile Auto is headquartered in Atlanta, Georgia.",https://www.linkedin.com/company/mile-auto-inc/,,https://www.twitter.com/drivemile,https://www.facebook.com/drivemile,"25,512"
Everyday Life Insurance,https://www.crunchbase.com/organization/everyday-life,https://www.everydaylifeinsurance.com/,"Financial Services, FinTech, Insurance, InsurTech",Financial Services,Everyday Life Insurance uses technology to redefine financial security for middle income families.,"Everyday Life Insurance uses technology to redefine financial security for middle income families. Its first product, Predictive Protection, saves consumers money by automatically adjusting coverage based on predictable life events like kids growing up or retirement. It was founded in 2018 and headquartered in Boston, Massachusetts.",https://www.linkedin.com/company/everyday-life-insurance/about/,,https://twitter.com/everydaylife_hi,https://www.facebook.com/everydaylifeinsurance/,"25,537"
Habit Analytics,https://www.crunchbase.com/organization/habit-analytics,http://www.habit.io/,"Analytics, Data Integration, Data Visualization, Insurance, Predictive Analytics","Artificial Intelligence, Data and Analytics, Design, Financial Services, Information Technology, Software",Habit is a data platform company that aggregates multiple sources of data and provides a stack of data intelligence for insurance companies.,Habit is a data platform company that aggregates multiple sources of data and provides a stack of data intelligence for insurance companies.,https://www.linkedin.com/company/habit-analytics/,,https://twitter.com/habit_analytics,https://www.facebook.com/habit.analytics,"25,568"
Harvest Returns,https://www.crunchbase.com/organization/harvest-returns,http://harvestreturns.com,"Agriculture, Crowdfunding, Financial Services, Insurance, Real Estate","Agriculture and Farming, Financial Services, Real Estate",Harvest Returns is an online marketplace for agriculture investments.,"Harvest Returns is an equity crowdfunding platform founded in 2016 that is disrupting the agriculture finance sector. The company fills a need for specialty farmers and ranchers who are underserved by the traditional agriculture banking system.  Harvest Returns is led by a solid team of military veterans who have extensive management experience in a variety of industries including agriculture, commercial real estate, information technology, and international development. They are a profitable company and have helped farmers and ranchers around the world raise over $10 million in equity and debt funding.",https://www.linkedin.com/company/harvest-returns,,https://www.twitter.com/harvestreturns,https://www.facebook.com/harvestreturns,"25,587"
Denim,https://www.crunchbase.com/organization/denim,http://denimlabs.com,"Insurance, InsurTech, Software","Financial Services, Software","Making marketing personal, at scale.","Denim is making marketing personal, at scale. Designed with today’s mobile consumers in mind, Denim’s patent-pending, data-driven platform saves time and money by enabling marketing teams to create and easily manage micro-targeted mobile ad campaigns for brands and on behalf of local representatives. With a focus on delivering a simple and intuitive experience, Denim not only delivers results, it’s enjoyable to use. To learn more, visit denimlabs.com.",http://linkedin.com/company/denim-labs,,http://twitter.com/denim,http://facebook.com/denimlabsinc,"25,612"
Wellthie,https://www.crunchbase.com/organization/wellthie,https://www.wellthie.com/,"Health Insurance, Information Technology, Insurance, InsurTech, Marketplace, Software","Commerce and Shopping, Financial Services, Information Technology, Software","Revolutionizing how small businesses shop, find, and buy employee benefits. ","Wellthie is helping to modernize the insurance shopping experience, offering the first and only national small group benefits marketplace designed to help brokers optimize small group sales and carriers maximize product distribution. Wellthie’s enterprise-ready SaaS platform is available to carriers and brokers nationwide. Visit wellthie.com to learn more.",https://www.linkedin.com/company/wellthie-inc-/,,https://twitter.com/wellthie,https://www.facebook.com/wellthie,"25,636"
The Guardian,https://www.crunchbase.com/organization/the-guardian,http://www.theguardian.com/uk,"Finance, Insurance, News, Publishing","Content and Publishing, Financial Services, Media and Entertainment","The Guardian is a British national daily newspaper that covers news, sports, business, opinion, analysis, reviews, and much more.","The Guardian is a British national daily newspaper that covers news, sports, business, opinion, analysis, reviews, and much more. It was published to promote the liberal interests in the aftermath of the Peterloo Massacre and the growing campaign to repeal the Corn Laws that flourished in Manchester. Since launching its U.S. and Australia digital editions in 2011 and 2013 respectively, traffic from outside of the U.K. now represents over two-thirds of The Guardian’s total digital audience. It was first published in 1821 and is based in New York, N.Y.",http://www.linkedin.com/company/102206,,https://twitter.com/guardian,http://www.facebook.com/theguardian,"25,651"
Curex Group,https://www.crunchbase.com/organization/curex-group,http://www.curexgroup.com,"Analytics, Big Data, Financial Services, Information Technology, Insurance","Data and Analytics, Financial Services, Information Technology",Cürex Group is a financial services company that focuses on the execution services and data analytics providers.,"Cürex Group is a financial services company that focuses on the execution services and data analytics providers. The company is driven by its mission is to work in partnership with its clients to add unparalleled clarity to all their foreign exchange activities. It was founded in 2009 and headquartered in New York, United States.",https://www.linkedin.com/company/curex-group-llc/,,https://twitter.com/CurexFX,https://www.facebook.com/CurexGroup/,"25,723"
BeneFix,https://www.crunchbase.com/organization/benefix,https://benefix.us,"Health Insurance, Information Technology, Insurance, InsurTech","Financial Services, Information Technology",An open platform for the world to access benefits.,"In a part of the country where it’s more common to see an Amish buggy than an electric car, BeneFix, an insurTech start-up, is working to change how health insurance brokers manage small group benefits with their simple, speedy, and secure technology.  BeneFix offers health insurance brokers a digital platform that delivers 100% accurate quotes 100 times faster. Based in Lancaster, Pa., BeneFix manages data from thousands of plans  offered by major carriers in Pennsylvania and New Jersey, offering quotes in minutes from a simple-to-use online interface reminiscent of Zillow. Less than two years after founder Matt Ranauro first had the idea for the platform, the business had a brick-and-mortar office in Lancaster City, over 1,000 customers, and, most recently, became one of nine central Pennsylvania finalists competing for a $100,000 investment from AOL co-founder Steve Case’s “Rise of the Rest” initiative.  The success is due, Ranauro believes, to three factors.  First, his own passion for the product. Ranauro has co-founded several tech companies, most notably ILL Co., a company that has built apps for HBO and Nickelodeon, analytics platforms for KPMG and products for the Mayo Clinic. With each company, Ranauro needed to find health insurance for himself and his co-founders and employees. “It took about two months just to find out what was available, then get enrolled in those products.” He said. “Which seems crazy, right? In 2017?” The question became: how do we streamline this and make it a better experience for everyone? Ranauro’s previous experience is the second factor that contributes to the success and growth of BeneFix.  The final is the Insurtech industry itself.  With insurance, and health insurance particularly, still lagging behind other industries in terms of using and creating technologies that work, the Insurtech industry, a $4.5 trillion industry, has attracted the attention of venture capitalists and tech entrepreneurs alike. Lancaster (Ranauro’s hometown)  may be Amish country, full of farms, buggies and country roads, but BeneFix is out to prove that it’s also fertile soil for creating a company that will revolutionize the health insurance industries’ outdated model. ",https://www.linkedin.com/company-beta/10702522/admin/overview/,,https://twitter.com/BeneFix_,https://www.facebook.com/benefix-511601149042334,"25,842"
"Sports Data Labs, Inc.",https://www.crunchbase.com/organization/sports-data-labs,http://www.sportsdatalabs.com,"Data Integration, Health Insurance, Home Health Care, Personal Health, Predictive Analytics, Real Time, Sports","Artificial Intelligence, Data and Analytics, Financial Services, Health Care, Information Technology, Other, Software, Sports",Unlock the Value of Human Data®,"Sports Data Labs, Inc. (“SD Labs”) is a venture-backed, global leader in collection, analysis and distribution of real-time human data from on-body sensors and sensing systems. SD Labs provides technology that enables interoperability of sensors and sensing systems, while using artificial intelligence to transform collected data into metrics, insights and predictions for various real-time and on-demand use cases. SD Labs operates in professional sports via Sports Data Labs and in the digital health ecosystem via Human Data Labs. For further information, please visit: www.sportsdatalabs.com and www.humandatalabs.com",https://www.linkedin.com/company/sports-data-labs,,https://twitter.com/sportsdatalabs,,"26,247"
Ensurise,https://www.crunchbase.com/organization/ensurise,http://www.ensurise.com,Insurance,Financial Services,Ensurise was formed to ensure the development of our agency partners and their clients.,Ensurise was formed to ensure the development of our agency partners and their clients by supporting the delivery of superior insurance solutions throughout the Mid-Atlantic region. Ensurise brings a new perspective to traditional insurance agency perpetuation and growth.,https://www.linkedin.com/company/ensurise/,,https://twitter.com/Ensurise,,"26,370"
Ironshore Insurance,https://www.crunchbase.com/organization/ironshore-insurance,http://www.ironshore.com/,"Health Insurance, Insurance",Financial Services,Ironshore Insurance provides broker-sourced specialty property and casualty insurance coverages for varying risks.,"Ironshore provides broker-sourced specialty property and casualty insurance coverages for varying risks located throughout the world. Select specialty coverages are underwritten at Lloyd’s through Ironshore’s Pembroke Syndicate 4000. The Ironshore group of companies is rated A (Excellent) by A.M Best with a Financial Size Category of Class XIV. Pembroke Syndicate 4000 operates within Lloyd’s where the market rating is A (Excellent) by A.M. Best, AA- (Very Strong) by Fitch, and A+ (Strong) by Standard & Poor’s.",https://www.linkedin.com/company/ironshore-insurance,,https://twitter.com/IronshoreInc,https://www.facebook.com/ironshore-inc-286624078111389,"26,450"
Astiva Health,https://www.crunchbase.com/organization/astiva-health,https://astivahealth.com/,"Health Care, Health Insurance, Insurance","Financial Services, Health Care",Astiva Health is a Medicare health plan that serves the senior population.,"Astiva Health is a Medicare health plan that serves the senior population. The company was founded in 2019 and based in Costa Mesa, California.",https://www.linkedin.com/company/astivahealth/,,,,"26,653"
Clearsurance,https://www.crunchbase.com/organization/clearsurance-2,https://clearsurance.com/,"Auto Insurance, Consumer, Insurance, Marketplace, Property Insurance","Commerce and Shopping, Financial Services, Other",Clearsurance is an insurance marketplace for people to find companies and products to meet their needs and unique buying preferences.,"Clearsurance is an insurance marketplace for people to find companies and products to meet their needs and unique buying preferences. Everything we do at Clearsurance is governed by our core values: 1) we are transparent; 2) we are authentic; 3) we are optimists, and 4) we are scrappy.  Founded in 2016 by insurance entrepreneur Michael Crowe, Clearsurance is simplifying insurance shopping powered by customer-generated reviews, ratings, and data.",https://www.linkedin.com/company/clearsurance,,https://twitter.com/clearsurance,https://www.facebook.com/Clearsurance/,"26,874"
Take Command Health,https://www.crunchbase.com/organization/take-command-health,http://www.takecommandhealth.com,"Health Care, Health Insurance, Insurance, Software","Financial Services, Health Care, Software",Innovative health insurance software for small employers and independent professionals,Take Command Health enables small employers to reimburse employees tax-free for health insurance using a small business HRA (QSEHRA). https://www.takecommandhealth.com/qsehra-guide  We empower employees and independent professionals to make smart health insurance decisions using our innovative plan choice software and health management tools.,https://www.linkedin.com/company/take-command-health/,,https://twitter.com/takecmdhealth,https://www.facebook.com/takecommandhealth,"26,934"
Exeter Property Group,https://www.crunchbase.com/organization/exeter-property-group,http://exeterpg.com,"Commercial Real Estate, Financial Services, Insurance, Property Management, Real Estate","Financial Services, Real Estate","Exeter Property Group is a real estate investment manager focused on industrial single-assets, portfolios and whole loans.","Exeter Property Group was founded in 2006 by a seasoned team with a long history and shared investment philosophy. Drawing on over 25 years of experience throughout multiple real estate market cycles, Exeter’s principals believe that superior returns are generated from aggregating diversified portfolios of properties that meet tenants’ needs for value proposition and functionality, and consequently provide investors with a high level of cash flow as well as value-add growth and capital appreciation potential. Exeter implements this tenant-focused property strategy from its regional offices across the U.S., allowing us to select and operate real estate in a direct and highly engaged manner.",https://www.linkedin.com/company/exeter-property-group/,,https://twitter.com/exeterpgllc,,"26,951"
HealthBridge,https://www.crunchbase.com/organization/healthbridge,http://www.myhealthbridge.com,"Blockchain, Financial Services, FinTech, Health Care, Information Technology, Insurance, Service Industry","Financial Services, Health Care, Information Technology, Other",HealthBridge is an Insurtech company that unites all parties with a stake in healthcare payments.,HealthBridge is an Insurtech company that unites all parties with a stake in healthcare payments. The company's mission is to reimagine the way the healthcare ecosystem addresses the growing financial burden of patient deductibles and coinsurance in the employer-sponsored insurance space.,https://www.linkedin.com/company/healthbridge-financial/,,,,"26,960"
Concertiv,https://www.crunchbase.com/organization/kbb-partners,https://www.concertiv.com/,"Analytics, Consulting, Financial Services, Information Services, Insurance, Procurement","Data and Analytics, Financial Services, Information Technology, Professional Services, Transportation",Concertiv is a strategic sourcing advisor leveraging deep analytics and group buying power.,"Concertiv, formerly known as KBB Partners, is a strategic sourcing advisor leveraging deep analytics and group buying power.  It organizes, benchmarks, negotiates, documents, and quantifies savings across critical business functions for leading investment banks, law firms, asset managers, and other professional services firms. Concertiv is a seasoned team of operating strategists and legal advisors with significant experience successfully leading and closing complex negotiations on behalf of global clients. It applies sophisticated processes and technology platforms to capture and quantify legal and commercial data points and deliver clear and actionable analytics to the C-suite. By leveraging group purchasing volume and data-supported negotiations, it amplifies its clients' voice and position in the market to drive down operating costs, while providing a distribution channel for innovative and emergent products. Co-founders Sara Clarke and Tom Bayoumi established the New York, New York-based company in 2014.",https://www.linkedin.com/company/concertiv/,,,,"26,975"
Rx.Health,https://www.crunchbase.com/organization/rx-health,http://rx.health/,"Health Care, Health Insurance, Hospital, Life Science","Biotechnology, Financial Services, Health Care, Science and Engineering",Rx.Health is changing the way both patients and provider think about digital medicine.,"Rx.Health - a spinoff from the Mount Sinai Health System – brings the first enterprise-wide, Digital Medicine delivery system that enables providers to prescribe evidence-based mobile health applications, multi-media education, wearables, and therapeutics to patients at the point of care. Developed within Mount Sinai’s Digital Innovation Center (AppLab), Rx.Health’s digital medicine prescription platform (RxUniverse) is now utilized across multiple clinical specialties developing unique success stories.",https://www.linkedin.com/company/rx-health/,,https://twitter.com/Rx_Health,https://www.facebook.com/RxUniverse/,"27,403"
