Organization Name,Organization Name URL,Website,Industries,Industry Groups,Description,Full Description,LinkedIn,Hub Tags,Twitter,Facebook,CB Rank (Organization)
SoFi,https://www.crunchbase.com/organization/social-finance,http://www.sofi.com,"Finance, Financial Services, FinTech, Life Insurance, Personal Finance, Wealth Management",Financial Services,SoFi is a finance company that offers a range of lending and wealth management services.,"SoFi is a finance company that offers a range of lending and wealth management services. The company primarily caters to early-stage professionals and offers variable and fixed rate parent, personal, and MBA loans, mortgage refinancing, and more. They create modern financial products and services that help people borrow, save, spend, invest, and protect their money better so that they can achieve financial independence and realize their ambitions from owning a home to saving for retirement, paying off their student loans, and more. It was founded in 2016 and is headquartered in San Francisco, California.",https://www.linkedin.com/company/sofi/,Unicorn,https://twitter.com/SoFi,https://www.facebook.com/SoFi,13
Lemonade,https://www.crunchbase.com/organization/lemonade,https://www.lemonade.com/,"Artificial Intelligence, Financial Services, Insurance, InsurTech","Artificial Intelligence, Data and Analytics, Financial Services, Science and Engineering, Software",Lemonade operates as a full-stack insurance company powered by AI and behavioral economics and driven by social good.,"Lemonade operates as a full-stack insurance company powered by AI and behavioral economics and driven by social good. It is a licensed insurance carrier, offering homeowners and renters insurance. Lemonade replaces brokers and bureaucracy with bots and machine learning, delivering zero paperwork and instant everything.  The company uses artificial intelligence and behavioral economics to set rates for the homes and renters it insures.  Lemonade was founded in 2015 and is headquartered in New York, NY, United States.",https://www.linkedin.com/company/lemonade-inc-/,Exited Unicorn,https://twitter.com/lemonade_inc,https://www.facebook.com/lemonade,52
Clover Health,https://www.crunchbase.com/organization/clover-health,http://cloverhealth.com,"Health Care, Health Insurance, Hospital, Medical, Software","Financial Services, Health Care, Software",Clover Health is an innovative technology company improving health outcomes for America's seniors.,"Clover Health (NASDAQ: CLOV) is a healthcare technology company with a deeply rooted mission of improving every life. Clover uses its proprietary technology platform to collect, structure, and analyze health and behavioral data to improve medical outcomes and lower costs for patients. As a company whose business goals fully align with its members' health needs, Clover works with members and their doctors to become a valued partner. This trust is built by proactively identifying at-risk individuals and teaming up with physicians to accelerate care coordination and simultaneously improve health outcomes and reduce avoidable costs. Clover has offices in San Francisco, Jersey City, Nashville and Hong Kong.",https://www.linkedin.com/company/4836709,Unicorn,https://twitter.com/clover_health,https://www.facebook.com/CloverHealth/,92
Bestow,https://www.crunchbase.com/organization/bestow-inc,https://www.bestow.com,"Developer APIs, Financial Services, FinTech, Insurance, InsurTech, Life Insurance, Mobile Apps, Software","Apps, Financial Services, Mobile, Software",Bestow is an insurance technology company offering term life insurance that is accessible and affordable to families.,"Bestow is an insurance technology company offering a platform that makes life insurance accessible to families. It builds products and technologies that expand the market and reimagines life insurance distribution. Bestow's proprietary, entirely digital life insurance platform will help propel growth into new insurtech, carrier, and partner channels. The approach that the company uses enables busy families to seek and purchase affordable policy rights from their mobile device in a matter of minutes. In addition to its direct-to-consumer arm, Bestow provides APIs that enable partners to offer life insurance coverage to their customers with ease. Jonathan Abelmann and Melbourne O'Banion headquartered the startup in Dallas, Texas in 2016.",https://www.linkedin.com/company/bestow-insurance,,https://www.twitter.com/bestow_inc,https://www.facebook.com/bestowlifeinsurance,213
Octane,https://www.crunchbase.com/organization/octane-lending,http://octane.co,"Enterprise Software, Financial Services, FinTech, Insurance, Lending, Point of Sale","Commerce and Shopping, Financial Services, Software","On Octane.co, powersports shoppers can research vehicles, prequalify for a loan, and instantly check rates with no impact on their credit.","Octane is a Fintech company whose mission is to connect people with their passions. The $21B Powersports market is fast and fun, but the purchasing process is slow and frustrating. Octane is changing that through automated underwriting, innovative credit products, and financing through our in-house lender Roadrunner Financial. Octane reaches millions of riders through editorial brands like CycleWorld.com and helps consumers buy their favorite vehicles with instant, frictionless financing on Octane.co.",https://www.linkedin.com/company/octane-lending,,,,287
H.I.G. Capital,https://www.crunchbase.com/organization/hig-capital,http://higcapital.com/,"Credit, Finance, Financial Services, Insurance, Real Estate","Financial Services, Lending and Investments, Real Estate",H.I.G. Capital is a global private equity and alternative assets investment firm with $42 billion of equity capital under management.,"H.I.G. Capital is an American global private equity and alternative assets investment firm with $37 billion of equity capital under management. The firm operates a family of private equity, growth equity, biohealth, real estate, credit/special situations, lending and syndicated credit funds. Based in Miami, and with offices in New York, Boston, Chicago, Dallas, Los Angeles, San Francisco and Atlanta, as well as affiliate offices in London, Hamburg, , Madrid, Milan, Paris ,Bogotá, Mexico City and Rio de Janeiro). H.I.G. Capital specializes in providing both debt and equity capital to small and mid-sized companies, utilizing an operationally focused/ value-added approach. H.I.G. currently operates a family of funds: > H.I.G.’s equity funds invest in management buyouts, recapitalizations and corporate carve-outs of both profitable as well as underperforming manufacturing and service businesses. > H.I.G.’s debt funds invest in senior, unitranche and junior debt financing to companies across the size spectrum, both on a primary (direct origination) basis, as well as on the secondary markets. H.I.G. is also a leading CLO manager, through its WhiteHorse family of vehicles, and manages a publicly traded BDC, WhiteHorse Finance. > Other H.I.G. funds invest in various real assets, including real estate and shipping.",https://www.linkedin.com/company/h-i-g--capital/,,https://twitter.com/HIGCapitalLLC,https://www.facebook.com/HIG-Capital-160904130600207/,303
Next Insurance,https://www.crunchbase.com/organization/next-insurance,https://www.next-insurance.com/,"Commercial Insurance, Finance, Insurance, InsurTech, Small and Medium Businesses","Financial Services, Other",Next Insurance is an online-based insurance company for entrepreneurs and small businesses.,"Next Insurance is an online-based insurance company for entrepreneurs and small businesses. The company's services feature claims investigation as soon as possible, with many being decision within 48 hours that helps its clients to get transparency. They use technology to eliminate agents and other expensive extras and give prices that are incredibly affordable. It also offers policies to a range of small businesses from general contractors to personal trainers.  Next Insurance was founded in 2016 and is headquartered in Palo Alto, California.",https://www.linkedin.com/company/next-insurance,Unicorn,https://twitter.com/nextinsurance1,https://www.facebook.com/NextInsuranceUSA,338
Bold Penguin,https://www.crunchbase.com/organization/bold-penguin,http://boldpenguin.com/,"Commercial, Insurance, InsurTech, Internet, Software","Financial Services, Internet Services, Other, Software","Bold Penguin is a commercial insurance exchange that connects customers, agents, and carriers to match the right quote in record time.","Bold Penguin is a commercial insurance exchange that connects customers, agents, and carriers to match the right quote in record time. With a heavy focus on the agents, Bold Penguin pushes the boundaries of user experience for businesses, an easy tool for agents, and a streamlined process of underwriting for carriers. The company operates an Exchange which utilizes a set of solutions to identify, triage, quote, and bind commercial insurance in a highly efficient and tech-enabled way. It plans to deliver on the platform enhancements which include more flexibility in how the core technology is leveraged by enterprise customers, expanding in excess and surplus lines. The Company offers a streamlined process of underwriting for carriers in commercial property and casualty insurance services. Bold Penguin was founded in 2016 and is headquartered in Columbus, Ohio, USA.",https://www.linkedin.com/company/bold-penguin,,https://www.twitter.com/bold_penguin,https://www.facebook.com/boldpenguin,387
Nayya,https://www.crunchbase.com/organization/nayya,http://www.nayya.com,"Artificial Intelligence, B2C, Employee Benefits, Health Insurance, Software","Administrative Services, Artificial Intelligence, Data and Analytics, Financial Services, Health Care, Other, Science and Engineering, Software",Nayya is an insurance benefits experience and management platform that addresses health plan challenges.,"Nayya is an insurance benefits experience and management platform that addresses health plan challenges. It utilizes AI and data science to personalize the way that employees choose and use their existing employee benefits. Leveraging billions of disparate datasets, Nayya makes benefits decision making an intuitive exercise for consumers. Akash Magoon and Sina Chehrazi co-founded Nayya in New York, New York in 2019.",https://www.linkedin.com/company/nayya,,,https://web.facebook.com/NayyaHealth,547
Health IQ,https://www.crunchbase.com/organization/health-iq,https://www.healthiq.com/,"Health Care, Life Insurance, Pharmaceutical","Financial Services, Health Care",Learn more about your Health IQ with the world's largest health quiz,"Their mission: to increase health literacy around the world Over the last 100 years, the world’s language literacy has increased significantly. Their challenge over the next 100 years is to increase the world’s health literacy. They believe the best way to create change is to celebrate the people who are dedicated to their health, rather than harass the people who are not. The Health Conscious are the unsung heroes — the people who don’t get credit for their hard work. Help us spread health literacy to every corner of the world.",https://www.linkedin.com/company/68350,,https://twitter.com/healthiqinsure,https://www.facebook.com/HiQ-Health-IQ-725945457478876/,585
Zipari,https://www.crunchbase.com/organization/zipari,http://zipari.com,"CRM, Customer Service, Health Care, Health Insurance, InsurTech, Software","Financial Services, Health Care, Information Technology, Other, Professional Services, Sales and Marketing, Software",Zipari is a company developing a customer experience platform designed specifically for health insurance.,"Zipari is a customer experience platform developed specifically for health insurance. The customer experience platform provides deep analytics and real-time recommendations to optimize the consumer experience and improve customer satisfaction in the healthcare industry. Zipari's breakthrough technology enables the type of member relationship that insurers want and consumers seek. Its InsureCX integrates with major CRM solutions providing industry-specific workflow management for healthcare companies to improve customer acquisition and retention. The company was incorporated in 2014 and is headquartered in Brooklyn, New York.",http://www.linkedin.com/company/zipari,,http://twitter.com/ziparico,http://www.facebook.com/ziparico,756
Metromile,https://www.crunchbase.com/organization/metromile,http://www.metromile.com,"Artificial Intelligence, Auto Insurance, Automotive, Big Data, Financial Services, FinTech, InsurTech, Internet, Machine Learning, Mobile Apps","Apps, Artificial Intelligence, Data and Analytics, Financial Services, Internet Services, Mobile, Science and Engineering, Software, Transportation",Metromile is a car insurance company using data science and machine learning to offer drivers new and fairer insurance.,"Metromile is the provider of pay-per-mile car insurance company in the U.S. Powered by data science and machine learning, the company is disrupting a $250 billion auto insurance category. Metromile is building a loyal community of drivers who come for the savings and stay for the experience. AVA, Metromile's AI-driven claims system, is designed to speed up the process of verifying and paying out insurance claims. Using Metromile Pulse sensor data, AVA can reconstruct the scene of an accident to instantly determine if claim details are accurate. When the claim is verified, Metromile is able to automatically approve payments within seconds.",https://www.linkedin.com/company/metromile,,http://twitter.com/Metromile,http://www.facebook.com/Metromile,757
Duck Creek Technologies,https://www.crunchbase.com/organization/duck-creek-technologies,http://www.duckcreek.com/,"Finance, Insurance, SaaS, Software","Financial Services, Software",Duck Creek Technologies develops industry-specific software that helps insurance carriers to deploy and manage their products and services.,"Duck Creek Technologies develops industry-specific software that helps insurance carriers to deploy and manage their products and services. It is a provider of core system solutions to the P&C and general insurance industry. By accessing Duck Creek OnDemand, the company’s enterprise Software-as-a-Service solution, insurance carriers are able to navigate uncertainty and capture market opportunities faster than their competitors. The company was formed in Boston, Massachusetts in 2000.",https://www.linkedin.com/company/duckcreek,,https://twitter.com/duckcreektech,https://www.facebook.com/duckcreektech,785
At-Bay,https://www.crunchbase.com/organization/at-bay,https://www.at-bay.com/,"Cyber Security, Information Services, Information Technology, Insurance, Network Security, Risk Management","Financial Services, Information Technology, Privacy and Security, Professional Services",At-Bay is a cybersecurity insurance company for the digital age.,"Businesses of every size, in every industry, are increasingly dependent on technology. For all of the benefits innovation brings, the digitization of the economy also creates risk at a magnitude never previously imagined. This new risk is complex, and it's constantly evolving. The old way of managing risk doesn’t cut it in the digital age. We designed At-Bay from the ground up to help businesses meet digital risk head-on. By combining world-class technology with industry-leading insurance expertise, At-Bay offers clarity and confidence to businesses in the digital age. We believe that every business, big or small, when empowered to understand and manage risk, can thrive in a digital world. We address digital risk in a way that everyone, from brokers and business owners, to CISOs and CFOs, can all understand. We question, analyze, and monitor the risk of every company in our portfolio—not just once, but continuously—so we can educate, advise, and support our brokers and our insureds throughout our partnership. Because digital risk never rests, and neither do we.",https://www.linkedin.com/company/at-bay/,,https://twitter.com/KeepRisk_AtBay,,955
Cowbell Cyber,https://www.crunchbase.com/organization/cowbell-cyber-inc,https://cowbell.insure,"Cyber Security, Insurance, Software","Financial Services, Information Technology, Privacy and Security, Software","Delivers standalone, customized cyber insurance policies using AI for continuous risk assessment and for accurate and expedited underwriting","Cowbell Cyber delivers the first vertically-integrated cyber insurance solution, making cyber insurance 2.0 a reality. Cowbell combines outside-in and inside-out risk assessment with AI-powered cyber risk modeling and underwriting to issue customized cyber policies written on the industry's most robust and admitted cyber coverage forms. Policyholders benefit from a transparent buying experience, a policy tailored to their unique needs, and value on day one with recommendations and services to remediate identified risks.",https://www.linkedin.com/company/cowbell-cyber/about/,,https://twitter.com/CowbellCyber,http://facebook.com/cowbellcyber,956
Instnt,https://www.crunchbase.com/organization/instnt,http://www.instnt.org,"Banking, Financial Services, FinTech, Insurance, Software","Financial Services, Lending and Investments, Software",Instnt is the first fully managed onboarding platform for businesses with fraud loss liability insurance.,"Instnt Inc. is a public benefit corporation on a mission to bring inclusion and instant account opening experiences for businesses and their customers. It is a one-of-a-kind collaborative effort between industry thought leaders, technology vendors and the private and public sector to solve for both sides of the on-boarding problem with a “Stripe for on-boarding” service offering and a new, interoperable Open Trust Protocol to make instant consumer acceptance a global reality.",https://www.linkedin.com/company/instnt-inc,,https://twitter.com/Instnt_org,,"1,007"
Groundspeed Analytics,https://www.crunchbase.com/organization/groundspeed-analytics,http://groundspeed.com/,"Analytics, Commercial Insurance, Insurance, InsurTech, Machine Learning","Artificial Intelligence, Data and Analytics, Financial Services, Software","Groundspeed Analytics, Inc. accelerates commercial insurance performance with the power of machine learning and artificial intelligence.","Groundspeed Analytics, Inc. (Groundspeed) accelerates commercial insurance performance with the power of machine learning and artificial intelligence. The Groundspeed platform automatically turns files like submissions, loss runs, exposure schedules and policy documents into actionable information, empowering users to lower costs, identify profitable pools of risk and drive top-line growth.",https://www.linkedin.com/company/groundspeed-llc/,,https://twitter.com/gaingroundspeed,https://www.facebook.com/GAINGROUNDSPEED/,"1,054"
Coalition,https://www.crunchbase.com/organization/coalition-535d,https://www.coalitioninc.com/,"Cyber Security, Information Technology, Insurance, Risk Management","Financial Services, Information Technology, Privacy and Security, Professional Services",Coalition operates as a cyber insurance and security company that helps businesses manage and mitigate cyber risk.,"Coalition is the provider of cyber insurance and security, combining comprehensive insurance and proactive cybersecurity tools to help businesses manage and mitigate cyber risk. Coalition provides companies with up to USD $15 million of cyber and technology insurance coverage in all 50 states and the District of Columbia, as well as CAD $20M of coverage across all 10 provinces in Canada. Coalition’s cyber risk management platform provides automated security alerts, threat intelligence, expert guidance, and cybersecurity tools to help businesses remain resilient in the face of cyber attacks.",https://www.linkedin.com/company/coalitioninc/,Emerging Unicorn,https://twitter.com/solvecyberrisk,https://www.facebook.com/coalitioninc,"1,119"
Berkshire Hathaway,https://www.crunchbase.com/organization/berkshire-hathaway-corp,http://www.berkshirehathaway.com,"Air Transportation, Automotive, Consumer, Credit, Food Processing, Insurance, Property Insurance, Railroad, Real Estate","Financial Services, Food and Beverage, Lending and Investments, Other, Real Estate, Transportation","Berkshire Hathaway is a multinational conglomerate holding company headed by its President & CEO, Warren Buffett.","Berkshire Hathaway is a multinational conglomerate holding company headed by its President & CEO, [Warren Buffet](http://www.crunchbase.com/person/warren-buffett). The company owns, manages and oversees subsidiary companies. Some companies they own wholly include GEICO, Fruit of the Loom, and Helzberg Diamonds. Berkshire Hathaway also holds a significant minority in American Express, The Coca-Cola Company, Wells Fargo, and IBM. The company is considered to be the ninth largest public company in the world, according to Forbes Global 2000 list.",https://www.linkedin.com/company/berkshire-hathaway/,,https://twitter.com/berkshire,https://www.facebook.com/Berkshire-hathaway-inc-265367763673228/,"1,176"
Oscar Health,https://www.crunchbase.com/organization/oscar,http://www.hioscar.com,"Health Care, Health Insurance, Insurance, InsurTech","Financial Services, Health Care","Oscar is a health insurance company that offers individual and family plans, medicare advantage, and small group products.","Oscar is a health insurance company that offers individual and family plans, medicare advantage, and small group products. It employs technology, design, and data to humanize health care. The company offers plans to individuals, couples, and families living in parts of New York, New Jersey, California, and Texas who don’t receive health insurance from an employer. Founded in 2012, Oscar Health is headquartered in New York, New York, United States.",https://www.linkedin.com/company/3014788,Unicorn,http://www.twitter.com/oscarhealth,https://www.facebook.com/OscarHealth,"1,363"
Alliant Insurance Services,https://www.crunchbase.com/organization/alliant-insurance-services,http://alliantspecialty.com/,"Financial Services, Insurance",Financial Services,Alliant Insurance Services is one of the nation’s leading distributors of diversified insurance products and services.,"Alliant Insurance Services, Inc. is one of the largest insurance brokerage firms in the United States and has a history dating back to 1925. Alliant provides property and casualty, workers’ compensation, employee benefits, surety, and financial products and services to more than 26,000 clients nationwide, including public entities, tribal nations, healthcare, energy, law firms, real estate, construction, and other industry groups.",https://www.linkedin.com/company/alliant-insurance-services,,https://www.twitter.com/alliantins,https://www.facebook.com/alliantinsuranceservices,"1,388"
Policygenius,https://www.crunchbase.com/organization/policy-genius,https://www.policygenius.com,"Finance, FinTech, Insurance, InsurTech",Financial Services,Policygenius is an insurance tech-startup that specializes in providing financial protection.,"Policygenius is an insurance tech-startup that specializes in providing financial protection. The company focuses on providing solutions in the fields of finance, insurance, and insure-tech. Policygenius was founded in 2014 and headquartered in New York, United States.",http://www.linkedin.com/company/2863431,,http://twitter.com/policygenius,http://www.facebook.com/policygenius,"1,474"
Collective Health,https://www.crunchbase.com/organization/collectivehealth,http://collectivehealth.com,"Cloud Computing, Health Care, Health Insurance","Financial Services, Health Care, Internet Services, Software",Collective Health is a company providing an alternative to traditional health insurance.,"Collective Health gives companies a smarter alternative to traditional health insurance. Through a cloud-based, integrated health benefits platform, the company enables self-insured employers to get more out of their healthcare investment while taking better care of their people.  Collective Health has seen exponential traction in the $1.2 trillion employer-sponsored insurance market -- its membership has grown by 500x in just three sales cycles. Currently, the company covers 70,000 employee and dependent lives across 15 employers; clients include Activision Blizzard, Crossfit, eBay, Palantir and Red Bull.   For more information, visit https://www.collectivehealth.com.",http://www.linkedin.com/company/collectivehealth,Emerging Unicorn,http://twitter.com/collective,http://www.facebook.com/CollectiveHealthInc,"1,485"
