Organization Name,Organization Name URL,Website,Industries,Industry Groups,Description,Full Description,LinkedIn,Hub Tags,Twitter,Facebook
Plympton,https://www.crunchbase.com/organization/plympton,http://plympton.com,"Mobile, Publishing, Reading Apps","Apps, Content and Publishing, Media and Entertainment, Mobile, Software",Plympton is a literary studio that innovates in digital publishing.,"DailyLit, their consumer-facing product, consists of a team of publishers, product designers and engineers on a mission to bring the best fiction and non-fiction to the world's 600 million smartphones and tablets. And they do it in a way that fits into daily life's small moments. They are the only team that combines world-class software engineers (MIT, ex-Palantir) with an eminent editorial staff (New York Times-bestselling author) that has relationships with publishers of the world's best writers. Their library has included stories from: - Alice Munro, Nobel Prize winner  - Jhumpa Lahiri, Pulitzer Prize Winner  - Julia Glass, National Book Award Winner  - John Grisham, 250 million+ books sold Acquired by Plympton in spring 2013, DailyLit was founded 2006 by USV Partner Albert Wenger and Susan Danziger. It has grown to 200,000 users and a mailing list of 150,000. We are building a next-generation mobile e-reading app focused on curated selections—shorter form and serialized—for subscription.",,,http://twitter.com/plympton,http://www.facebook.com/readrooster
Pulse,https://www.crunchbase.com/organization/pulse,https://mobile.linkedin.com/pulse,"Apps, iOS, News, Reading Apps, Social Network","Apps, Content and Publishing, Internet Services, Media and Entertainment, Mobile, Platforms, Software",Pulse is a news reading app that provides users with news from multiple RSS feeds on a single interface.,"Pulse is an elegant news reading application for iPhone, iPad and Android devices. It incorporates colorful panning story bars and fills them with content from your favorite sources. Pulse redefines news, giving you the opportunity to experience the news you desire from traditional sources, your favorite blogs and social networks all in one beautiful interface. Pulse is developed by Alphonso Labs.",https://www.linkedin.com/company/pulse-news/,,,
Qlovi,https://www.crunchbase.com/organization/qlovi,http://www.qlovi.com,"EBooks, Personalization, Reading Apps","Apps, Commerce and Shopping, Content and Publishing, Media and Entertainment, Software",Qlovi is personalized reading & writing.,Qlovi is personalized reading & writing.,,,http://twitter.com/Qlovi,http://www.facebook.com/qloviedu
Radish,https://www.crunchbase.com/organization/radish-media-inc,https://www.radishfiction.com,"Apps, Media and Entertainment, Mobile Apps, Publishing, Reading Apps","Apps, Content and Publishing, Media and Entertainment, Mobile, Software",Radish is a mobile fiction platform for serialized storytelling.,"Radish is a mobile fiction platform for serialized storytelling. Its wide variety of stories are published and read in bite-sized installments optimized for the smartphone reader. Radish is revolutionizing the way that stories are consumed and produced. Readers can access thousand of serials across genres and connect directly with their favorite storytellers in live community chat rooms. Authors can publish their own original stories, revive backlist titles with a young, mobile readership, and pre-release upcoming books to build advanced buzz—the opportunities are endless!",https://www.linkedin.com/company/10854052,,https://twitter.com/radish_fiction,https://www.facebook.com/radishfiction/
Read Naturally,https://www.crunchbase.com/organization/read-naturally,https://www.readnaturally.com/,"EdTech, Education, Publishing, Reading Apps, Social Assistance","Apps, Content and Publishing, Education, Government and Military, Media and Entertainment, Software","Read Naturally's innovative, research-proven reading programs provide high-quality interventions and differentiated instruction.","Read Naturally's innovative, research-proven reading programs provide high-quality interventions and differentiated instruction for struggling readers of all ages and abilities – whether special education, ELL, Title I, mainstream, or adult – to improve reading skills, gain confidence and transform attitudes toward school and learning. Read Live, our most popular intervention and assessment tool, uses a powerful web-technology platform providing administrators the ability to easily deploy these programs on a single computer or across an entire district. Read Live features a reading intervention, Read Naturally Live and an assessment tool, Benchmark Assessor Live. Students work mostly independently in Read Naturally Live by reading high-interest, nonfiction stories and completing a number of activities including a vocabulary-boosting game, Wordtastic. This motivating and engaging curriculum and format builds students'​ fluency, vocabulary, comprehension and phonics skills. Read Naturally launched two new programs in 2014, Funēmics and Splat-O-Nym. Funēmics teaches the foundational skills of phonemic awareness to small groups of pre-readers or struggling readers. Students gain awareness of words’ syllables, rhyming, phonemes and phoneme manipulation using scripted lessons that correspond to interactive exercises displayed for students on an iPad. Splat-O-Nym is an iPad app designed to build vocabulary. Students independently play games that include over 7,000 synonym questions, 1,000 antonym questions, and 600 meaning-from-context questions. Other research-based interventions programs from Read Naturally include: Read Naturally GATE, Signs for Sounds, Word Warm-ups, One Minute Reader and Take Aim! at Vocabulary.",https://www.linkedin.com/company/read-naturally/,,https://twitter.com/readnaturally,https://www.facebook.com/ReadNaturally
Readism,https://www.crunchbase.com/organization/readism,,"Reading Apps, Software, Web Apps","Apps, Software","Readism is a web-app that provides a personalized estimated reading time for any article, book, or webpage.","Readism is a web-app that provides a personalized estimated reading time for any article, book, or webpage.",,,,
ReviewMeta,https://www.crunchbase.com/organization/reviewmeta,http://reviewmeta.com/,"Consumer Reviews, Messaging, Reading Apps","Apps, Commerce and Shopping, Information Technology, Internet Services, Messaging and Telecommunications, Software",ReviewMeta analyzes millions of reviews to help consumers find those they can trust.,ReviewMeta analyzes millions of reviews to help consumers find those they can trust.,,,https://twitter.com/ReviewMeta,https://www.facebook.com/reviewmeta
Serial Box,https://www.crunchbase.com/organization/serial-box,https://www.serialbox.com/,"Apps, Audiobooks, Content, Digital Entertainment, EBooks, Media and Entertainment, Publishing, Reading Apps","Apps, Content and Publishing, Media and Entertainment, Music and Audio, Software",Serial Box is an entertainment company that provides serialized entertainment for readers and listeners.,"Serial Box is an entertainment company that provides serialized entertainment for readers and listeners. The company creates short, immersive stories that you can listen to or read. They produce completely original series and tell official new stories around story worlds like BBC's Orphan Black and characters like Marvel's Black Panther and Jessica Jones. Serial Box is designed for consumption on smartphones in either an audiobook or e-book format, users can read or listen to each weekly episodic installment. It produces original fiction with a focus on science fiction, fantasy, mystery, crime, and thrillers. The users can use the Serial Box mobile app to access both audio and text and even toggle between them. Serial Box was founded in 2015 and is headquartered in New York, NY, United States",https://www.linkedin.com/company/serial-box,,https://twitter.com/serialboxpub,https://www.facebook.com/SerialBoxPub/
StackUp,https://www.crunchbase.com/organization/stackup-2,http://www.stackup.net,"Browser Extensions, EdTech, Education, Employment, Machine Learning, Reading Apps, Recruiting, Software","Apps, Artificial Intelligence, Data and Analytics, Education, Professional Services, Software",Stackup is an Artificial Intelligent Patent Pending System that Measure & Report all online reading & learning done across the web.,"Stackup is an Artificial Intelligent Patent Pending System that Measure & Report all online reading & learning done across the web to provide teachers with with a core solution to improve reading competency, students with a way to get credit for learning on their own, and school leaders real time data on how their devices are being used school or district wide. ",https://www.linkedin.com/company/stackup?trk=company_logo,,https://twitter.com/StackupScore,https://www.facebook.com/HowDoYouStackUp
The Hawaii Project,https://www.crunchbase.com/organization/the-hawaii-project,http://www.thehawaiiproject.com,"EBooks, Mobile Apps, Personalization, Reading Apps, Social","Apps, Commerce and Shopping, Community and Lifestyle, Content and Publishing, Media and Entertainment, Mobile, Software",The Hawaii Project is a personalized book recommendation engine. We find great books you'd never find on your own.,"The Hawaii Project are the makers of Bookship (https://www.bookshipapp.com), a social reading app. Bookship was shortlisted by The Bookseller for BookTech Company of the Year. They are also the creators of The Hawaii Project, a personalized book recommendation engine. The Hawaii Project finds great books you'd never find on your own - matching your personal interests to what leading tastemakers around the web are writing about. Follow authors, subscribe to our unique channels, and mark books you've read, loved or want. We'll do the rest, delivering you great recommendations and alerts about interesting books and book news from around the web! Our basic service is free. Premium Accounts let you follow more authors and get extra features. 10% of our revenue goes to fund 3 great literacy non-profits.",,,,
UnlockBoot,https://www.crunchbase.com/organization/unlockboot,https://www.unlockboot.com/,"Mobile, News, Online Portals, Professional Services, Reading Apps, Retail, Retail Technology, Service Industry, Windows Phone","Apps, Commerce and Shopping, Consumer Electronics, Content and Publishing, Hardware, Internet Services, Media and Entertainment, Mobile, Other, Platforms, Software","UnlockBoot was founded in April 2010 as a tech blog focused on delivering news, jailbreak information, reviews & more.","https://www.Unlockboot.com  - is a weblog focused on delivering the latest news, reviews, how to guides and tutorials about Mac, Android, iPhone, iPad, iPod & anything iOS.",,,https://twitter.com/unlockboot,https://www.facebook.com/unlockboot/
Workers On Call,https://www.crunchbase.com/organization/workers-on-call,http://www.workersoncall.com,"Consulting, Human Resources, Information Technology, Internet, Outsourcing, Reading Apps, Software","Administrative Services, Apps, Information Technology, Internet Services, Professional Services, Software",Workers On Call is an outsourced worker site helping companies find skilled workers who are available and ready to start working.,"Workers On Call is an outsourced worker site designed to help companies start work now. If you need work done immediately you will be matched with skilled workers who are available and ready to start immediately. Forget spending hours reading applications or waiting for responses. See who is online now, how long they have left to work and chat live with them about your project. Hiring takes less than 15 minutes. We all know how many jobs we have in a day. Delegate or outsource to a talented global workforce.",,,http://twitter.com/WorkersOnCall,https://www.facebook.com/workersoncall
Your Bible Quotes,https://www.crunchbase.com/organization/your-bible-quotes,http://www.yourbiblequotes.com/,"Personalization, Reading Apps, Software","Apps, Commerce and Shopping, Software",Daily personalized bible quotes.,"Your Bible Quotes is owned and operated by Certatim.  They’re a small software development company based out of Miami Beach and have a number of software products that they offer for small businesses.  They also work on custom development for clients. Their idea came from a desire to make access to the Bible easier in what seems like an ever busier and rushed society.  Wouldn’t it be nice to just take a minute to read a Bible Quote selected for you each day?  Take a step back from your daily grind and think about what’s important? They realized there is less and less time of each day for themselves and for you as an individual.  They wanted to build a way for you to be able to set aside 5 minutes to reflect on a Bible Quote.  Simple, personalized Bible Quotes delivered daily.  It’s that simple.",,,https://twitter.com/ybiblequotes,https://www.facebook.com/yourbiblequotes
