Organization Name,Organization Name URL,Website,Industries,Industry Groups,Description,Full Description,LinkedIn,Hub Tags,Twitter,Facebook
Asymmetrica Labs,https://www.crunchbase.com/organization/asymmetrica-labs-inc,http://asym.co,"Developer APIs, Enterprise Software, Reading Apps","Apps, Software","Asym Spacing is a word-spacing format for web & print that significantly increases reading enjoyment, ad click-throughs, and conversions.","Asymmetrica has created a text format that meaningfully improves reading comprehension. Our software platform, Asym, precisely adjusts the spaces between words.  Our vision is to improve global literacy one reader and business at a time. For businesses, Asym provides a 5-32% lift across retail revenue, conversion funnels, web engagement, advertisement click-through rates, direct mail, and other content by improving how readers' brains render text. These metrics are the cornerstones of online revenue generation. Asym is a cognitive technology that systematically improves conversion and makes the story and message of online brands stick. Asymmetrica is poised to become a large, high-margin company by generating real revenue for a broad range of customers. Asymmetrica was founded by Chris Nicholas and Ken Brownfield within HVF Labs, Max Levchin's innovation lab and investment firm. Chris has a PhD in neuroscience and is an experienced data scientist, published expert in molecular genetics and word & letter perception, product manager, and co-inventor of five typesetting patents including fixed-layout ebooks. Starting in 1999, Ken built out PayPal's initial production infrastructure and continued with architectural roles at PayPal and eBay. He subsequently worked with Max at MRL Ventures, Slide, and Google, and most recently managed YouTube's website infrastructure. Our foundational technology is fast, scalable, and directly combats modern distractions and low literacy – two real and underestimated problems for any content provider.",https://www.linkedin.com/company/3648743,,https://twitter.com/AsymmetricaLabs,https://www.facebook.com/AsymmetricaLabs?_rdr=p
BeeLine Reader,https://www.crunchbase.com/organization/beeline-3,http://www.beelinereader.com/,"Assistive Technology, Ediscovery, EdTech, Education, Legal, Productivity Tools, Reading Apps, Software","Apps, Education, Health Care, Internet Services, Professional Services, Software",BeeLine Reader develops digital reading tools to help students learn to read faster.,"BeeLine Reader makes reading faster and easier by using a color gradient that guides the eyes from the end of one line to the beginning of the next. With BeeLine Reader, students can finish work faster and with less eyestrain. The company's goal is to make those hours more efficient and more enjoyable. BeeLine Reader was founded on 2011 and is based in Woodside, California.",https://www.linkedin.com/company/beelinereader/,,https://twitter.com/BeeLineReader,https://www.facebook.com/BeeLine.Reader
BEGiN,https://www.crunchbase.com/organization/beginlearning,https://www.beginlearning.co/,"Apps, E-Learning, EdTech, Education, iOS, Reading Apps","Apps, Education, Mobile, Platforms, Software",BEGiN is the award-winning education technology company that creates learning products to bring children the highest quality education.,"BEGiN is the award-winning education technology company that creates engaging and effective learning products to bring the highest quality education to young children everywhere. Their library of interactive stories helps their child fall in love with reading while building critical skills.  BEGiN’s investors and partners include some of the most recognized and well-loved children’s brands including Sesame Workshop, LEGO Ventures, Gymboree Play and Music, and Fisher-Price. BEGiN was co-founded by Neal Shenoy, Noelle Millholt, and Stephanie Dua and is one of Crain’s 100 Best Places to Work in New York City.",,,,
Book+Main,https://www.crunchbase.com/organization/book-main,http://bookandmain.com,"Apps, Communities, Reading Apps, Social Media","Apps, Community and Lifestyle, Internet Services, Media and Entertainment, Software",Where Big Data meets Romance. Literary matchmaker for authors and readers.,"Book+Main is an online platform that uses machine learning to connect authors and readers in romance—the #1 grossing genre. A sales and marketing tool for authors, a discovery tool for readers, and a robust community that connects the two, Book+Main allows readers to search over 350 keywords {subgenres and tropes} to discover ‘Bites’, excerpts specifically chosen by the author to connect readers to their words in a beautiful, content-focused space. Since launching in November ’17, Book+Main has welcomed members from over 150 countries worldwide.",https://www.linkedin.com/company/bookandmain/,,https://www.twitter.com/bookandmain/,https://www.facebook.com/bookandmain/
Booklamp,https://www.crunchbase.com/organization/booklamp,http://booklamp.org,"Content Discovery, Education, Reading Apps, Software","Apps, Content and Publishing, Education, Media and Entertainment, Software",Booklamp provides users with reading suggestions based on a detailed analysis of the writing styles of their preferred authors.,"Booklamp.org is a system for matching readers to books through an analysis of writing styles. The technology BookLamp alows you to find books that are written with a similar tone, tense, perspective, action level, description level and dialogue level.",,,http://twitter.com/booklamp,http://www.facebook.com/BookLamp
BookShout,https://www.crunchbase.com/organization/bookshout-2,https://bookshout.com/,"Content, EBooks, Internet, Publishing, Reading Apps, Software","Apps, Content and Publishing, Internet Services, Media and Entertainment, Software","BookShout is an e-book distribution and reading platform that provides content from publishers for bulk, promotional, and direct sales.","BookShout is an e-book distribution and reading platform that provides content from publishers for bulk, promotional, and direct sales. Its cloud-based reading platform provides an easy-to-use experience for both mobile and web readers. Its application provides both standard features such as bookmarking, notes, and many new innovative ones such as speed-reading and daily progress. BookShout was launched in 2010 and is based in Plano, Texas.",https://www.linkedin.com/company/bookshout,,https://twitter.com/BookShout,https://facebook.com/BookShout
Bubblin Superbooks,https://www.crunchbase.com/organization/bubblin-flipbooks,https://bubbl.in,"Communities, EBooks, Reading Apps","Apps, Community and Lifestyle, Content and Publishing, Media and Entertainment, Software",Bubblin is an online café for books.,"Bubblin is an online café for books.  A silent and cozy place to hang out and read great books. By silent we mean no pesky advertisements, no unsolicited comments, no promotional opinions or overarching reviews and only very limited social networking: just about enough to share interests with other like-minded book lovers privately. Rediscover yourself in the quiet company of books. Learn more about us:  <a href=""https://bubbl.in/about"">https://bubbl.in/about </a>",,,https://twitter.com/bubblinapp,https://www.facebook.com/bubblinsuperbooks/
Charmtech Labs,https://www.crunchbase.com/organization/charmtech-labs,https://www.captivoice.com,"Audio, Reading Apps","Apps, Media and Entertainment, Music and Audio, Software",Charmtech Labs was founded in 2010 by a group of CS professors and Ph.D. students who wanted to make a difference in the real world.,"Charmtech Labs LLC was founded in 2010 by a group of computer science professors and Ph.D. students who wanted to go beyond academic research and make a difference in the real world. Armed with years of cutting-edge research and software development experience, they set out to remove barriers between people and information. Initially inspired by helping people with vision impairments to overcome information accessibility problems, they are now bringing their screen-reading technology to the mainstream market. Their flagship product, Capti Narrator, revolutionizes the way people consume digital content.",https://www.linkedin.com/company/charmtech-labs-llc,,https://twitter.com/captinarrator,https://www.facebook.com/223708031015524
Comixology,https://www.crunchbase.com/organization/comixology,http://www.comixology.com,"Cloud Data Services, Comics, Digital Entertainment, Digital Media, Reading Apps","Apps, Consumer Goods, Information Technology, Internet Services, Media and Entertainment, Software","Comixology delivers a cloud-based digital comics platform that enables users to discover, buy, and read comics.","Founded in 2007 with the mission of bringing comics to people everywhere, comiXology — in just five short years — has revolutionized the comic book and graphic novel world. From creating the industry leading platform for digital comics to tools and services for brick and mortar retailers, comiXology has lead the charge in exposing new audiences to the rich history and culture of comic books.  With the development of the Comics by comiXology digital comics platform — available across iPhone, iPad, Android, Kindle Fire and the Web — comiXology provides the easiest way worldwide for people to enjoy comics at just the click of a button! Regularly ranking as the top grossing iPad app in the entire iTunes App Store, Comics by comiXology was recently selected as a preloaded app on Amazon’s Kindle Fire.  Providing digital comics across multiple platforms, comiXology will not stop until everyone on the face of the earth has been turned into a comic book fan. For more information, please visit www.comixology.com.",https://www.linkedin.com/company/1379932,,http://twitter.com/comixology,https://www.facebook.com/comixology
Epic Magazine,https://www.crunchbase.com/organization/epic-magazine,http://epicmagazine.com,"Education, Publishing, Reading Apps","Apps, Content and Publishing, Education, Media and Entertainment, Software",Epic Magazine brings you extraordinary true stories.,"Epic writers travel the world searching for encounters with the unknown. Wartime romance, unlikely savants, deranged detectives, gentlemen thieves, and love struck killers: stories that tap into the thrill of being alive. Epic publishes extraordinary true stories that get noticed. More than 25 of our articles have been optioned by Hollywood, including Argo, which won the Academy Award for Best Picture, and Fox Film Studios has signed a first look deal with us.",https://www.linkedin.com/company/3554952,,https://twitter.com/epic,https://www.facebook.com/epicmagazinenow
feedly,https://www.crunchbase.com/organization/devhd,http://www.feedly.com,"Content, EBooks, Reading Apps","Apps, Content and Publishing, Media and Entertainment, Software",Feedly offers an app that enables readers to connect with the websites and sources about the things they are most passionate.,"Our mission is to connect professionals to the content they need to get ahead and become better at what they do. We believe that reading opens doors, whether that’s performing better at work, mastering a craft or learning something new.  Feedly is the app that connects curious minds with the blogs, websites and sources of content they are most passionate about.  Feedly Cloud is the infrastructure that powers feedly, and an ecosystem of 200+ reading apps (http://feedly.com/apps.html). feedly Cloud is two-sided market place which connects publishers to intent readers.",,,https://www.twitter.com/feedly,
HOMER,https://www.crunchbase.com/organization/learn-with-homer,http://learnwithhomer.com,"Apps, E-Learning, EdTech, Education, iOS, Mobile, Reading Apps","Apps, Education, Mobile, Platforms, Software",HOMER is a developer of an educational application used to offer a learn-to-read program for kids.,"HOMER is a developer of an educational application used to offer a learn-to-read program for kids. The company offers personalized, fun, and proven to learn products for kids ages 2-8 to help build confidence, mastery, and a love of learning. Its learning experts have crafted the HOMER Method to support parents in delivering knowledge, personal development, and motivation, a recipe for growing, enthusiastic, lifelong learners. HOMER combines a child’s passions and current reading level to create a personalized learn-to-read plan on their Android phone or tablet. It includes thousands of lessons and games on the alphabet, phonics, sight words, and more. HOMER was founded in 2013 and is based in New York, NY, USA.",https://www.linkedin.com/company/homerlearning-inc-/,,http://twitter.com/learnwithhomer,http://www.facebook.com/learnwithhomer
Inky Technologies,https://www.crunchbase.com/organization/inky-technologies,,"Consumer, Mobile Apps, Reading Apps","Apps, Mobile, Other, Software",Inky Technologies is a book recommendations platform.,"Inky is a book recommendation platform.  Founded in 2016, the company is headquartered in Troy, NY.",https://www.linkedin.com/company/inky-technologies/,,https://twitter.com/inkysbookshelf,https://www.facebook.com/Inkysbookshelf/
Instapaper,https://www.crunchbase.com/organization/instapaper,http://www.instapaper.com,"Apps, Reading Apps, Social Bookmarking","Apps, Content and Publishing, Other, Software",Instapaper is a web application that allows users to save online content for future references.,"Instapaper is a web application that allows users to save online content for future references. Instapaper facilitates easy reading of long text content. It is a simple tool for saving web pages to read later on your iPhone, iPad, Android, computer, or Kindle. ",https://www.linkedin.com/company/15615855,,http://twitter.com/instapaper,http://www.facebook.com/instapaperholdings
Kids Discover,https://www.crunchbase.com/organization/kids-discover,http://www.kidsdiscover.com/,"EdTech, Education, Publishing, Reading Apps","Apps, Content and Publishing, Education, Media and Entertainment, Software",Kids Discover is an educational publisher offering high-quality science and social studies reading for K-8 learners and educators.,"Kids Discover Online (KDO) gives teachers and students the opportunity to browse Kids Discover’s vast library of science and social studies content, photographs, activities, and interactive simulations in an individualized, organized platform. Kids Discover Online content is offered a 3 different Lexile(R) Reading Levels, and is aligned with Common Core, State, and Next Generation Science Standards.  Using Kids Discover Online provides teachers with pre-designed individual lessons or entire unit plans. Students use the tool to complete individualized, level-appropriate readings or activities assigned by the teacher. Activities and assignments are organized by singular interest topics or pre-designed unit plans.  Both teachers and students can customize their search interests and queue future lessons, units, and activities. Teachers can assign students interactive activities or reading assignments based on the student’s Lexile reading level. Students can then complete these assignments or activities at their own pace within KDO, and are free to explore other Kids Discover content based on their own interests.",,,https://www.twitter.com/kids_discover,https://www.facebook.com/kidsdiscover
Lalilo,https://www.crunchbase.com/organization/lalilo,https://www.lalilo.com,"EdTech, Education, Reading Apps, Software, Training","Apps, Education, Software",Lalilo is a literacy web-based app for K-2 teachers willing to differentiate reading instructions.,"Lalilo is a literacy web-based app for K-2 teachers willing to differentiate reading instructions. It builds a revolutionary A.I-based learning software that helps every child learn how to read, while also empowering teachers to personalize learning in classrooms. The Lalilo website is accessible on tablets, iPads, and computers. Lalilo was founded on 2016 and is based in San Francisco, California.",https://www.linkedin.com/company/lalilo/,,https://www.twitter.com/laliloapp,https://www.facebook.com/laliloapp/
LiquidText,https://www.crunchbase.com/organization/liquidtext,http://www.liquidtext.net,"Document Management, E-Learning, EdTech, Education, Mobile, Reading Apps, Software","Apps, Education, Information Technology, Mobile, Software","LiquidText improves the reading experience by allowing users to better understand, synthesize, visualize, and collaborate over digital text.","LiquidText is a multi-touch document manipulation system that offers a flexible environment for active reading to improve the way people read, annotate, and research. With LiquidText, users can squeeze a document to compare disparate areas, create comments that reflect relationships between different parts of a document, and many other interactions that target knowledge worker and student reading needs. LiquidText was founded on 2012 and is headquartered in New York, New York.",https://www.linkedin.com/company/liquidtext,Pledge 1%,https://twitter.com/liquidtextcorp,https://www.facebook.com/LiquidText
Literably,https://www.crunchbase.com/organization/literably,https://literably.com,"EdTech, Education, Reading Apps","Apps, Education, Software",Literably is a K-8 literacy assessment system that sends results to teachers after students read out loud into a device.,"Literably is a literacy assessment system that screens K-8 students for reading difficulties, monitors their progress as readers, and diagnoses skill gaps. Literably's mobile and web apps allow schools to administer assessments online that otherwise are administered manually. As a result, teachers can spend much less time testing and more time teaching.",,,http://twitter.com/Literably,
Literator,https://www.crunchbase.com/organization/literator,http://www.literatorapp.com,"EdTech, Education, Primary Education, Reading Apps","Apps, Education, Software",Literator is an EdTech platform that guides K-12 schools in direct instruction and making data-driven decisions.,"Literator guides teachers in direct instruction and real-time data collection, which has been proven to be the most effective method of teaching students how to read. Literator guides teachers in teaching skills that are personalized to each student's specific needs, while help administrators make data-driven decisions. Literator's free app is used in over 4,000 schools around the world, and currently conducting paid pilots in multiple states across the US.",https://www.linkedin.com/company/literator,,https://twitter.com/Literatorapp,https://www.facebook.com/literatorapp/
Litsy,https://www.crunchbase.com/organization/litsy,http://litsy.com/,"Reading Apps, Social","Apps, Community and Lifestyle, Software",Litsy is a mobile app where people can share and discover their favorite books.,"Litsy is a place to share and discover your favorite books with your favorite people. The Litsy community is a groundswell of passionate readers, authors, celebrities, and more. Share bookish moments with Quotes, Reviews, and Blurbs. Measure Litfluence to discover your “bookprint” in the world. Explore recommendations from readers, not algorithms.",,,https://twitter.com/getlitsy,
Lulu,https://www.crunchbase.com/organization/lulu-2,http://www.onlulu.com,"Apps, Publishing, Reading Apps","Apps, Content and Publishing, Media and Entertainment, Software","Lulu is a private app for girls to read and create reviews about the guys they know based on their romantic, personal and sexual appeal.",Lulu is the smart girl's app for private reviews and recommendations of guys. Onlulu.com was acquired by Berez Media -  a marketing and technology firm for marketers and agencies.,https://www.linkedin.com/company/lulu-inc/about/,,http://twitter.com/on_lulu,https://www.facebook.com/luluapp
Madefire,https://www.crunchbase.com/organization/madefire,http://madefire.com,"Information Technology, Mobile, Reading Apps","Apps, Information Technology, Mobile, Software",Madefire provides Motion Book Tool that delivers a reimagined collaboration experience for the storytellers and writers behind the stories.,"Madefire has developed a proprietary Motion Book Tool that delivers a reimagined collaboration experience for the storytellers, stylists, innovators and writers behind the stories.  Their goal is to give creators the freedom to escape from the traditional confines of 21 static pages, and create a new world of words, pictures, motion and sound. The Madefire app unites the artistry of comics and graphic novels with the iPad’s groundbreaking interactive capabilities. The app offers a continuous flow of new episodes and original titles from some of the world’s most renowned storytellers, including comics book legend Dave Gibbons, with his new title “Treatment.”",https://www.linkedin.com/company/3235622,,http://twitter.com/madefire,http://www.facebook.com/Madefire/226004180774924
MagicBox,https://www.crunchbase.com/organization/magicbox,https://www.getmagicbox.com/,"Digital Media, Mobile, Reading Apps, SaaS","Apps, Media and Entertainment, Mobile, Software","MagicBox is a SaaS based tool empowering publishers to package, sell, manage, & distribute their digital contents.","MagicBox is a Leading SaaS based mobile distribution platform for publishers to securely package, sell, manage, & distribute their digital contents across multiple platforms – both online and offline.  MagicBox empowers publishers to create interactive and media-rich digital content themselves with just a few clicks and without any need of technical expertise or expensive outsourcing. It also offers a one stop platform to sell digital content to their customers using its e-commerce content store, handle license management as well as deliver content to students on white-labeled interactive reading apps that they can use on their PCs, smartphones or any tablets. In addition, It offers an advance assessment tool for publishers, schools and teachers to create online assessments inside the books or as a stand-alone exercise for students. Since its launch in late 2013, MagicBox has generated significant traction in the industry and has close to 1 million users.",https://www.linkedin.com/company/magic-edtech/,,https://twitter.com/magicedtech,https://www.facebook.com/MagicEdtech/
MeeGenius,https://www.crunchbase.com/organization/meegenius,http://www.meegenius.com,"Digital Media, Publishing, Reading Apps","Apps, Content and Publishing, Media and Entertainment, Software",MeeGenius is a reading app that digitalizes children’s stories and adds features such as word highlighting and audio playback.,"MeeGenius is a reading application for the iPhone, iPad, iTouch, Google TV, Google Chrome Web Store, and the Web. Launched in April 2010 by Wandy Yeap Hoh and David Park after 16 months of research and development, MeeGenius digitizes children's stories, classic and new, and adds features such as word highlighting and audio playback for easy read-along. Also available on certain platforms are text and audio personalization tools, which further engage young readers.",http://www.linkedin.com/company/meegenius-inc.,,http://twitter.com/meegenius,http://www.facebook.com/meegenius
Nanits Universe Ltd.,https://www.crunchbase.com/organization/nanits-universe-ltd,https://www.nanitsuniverse.com,"Android, Apps, Comics, Content Creators, Internet, iOS, Mobile, Music, Reading Apps, Software","Apps, Consumer Goods, Internet Services, Media and Entertainment, Mobile, Music and Audio, Platforms, Software","We bring a revolutionary tool for simple reading, publishing and distribution of digital comics.","Nanits brings comic books to life! This revolutionary platform makes the comic reading experience richer than ever. Original soundtracks, illusion of 3D depth, and page free scrolling - everything that you expect from real digital comics in the 21st century, a modern, fully digital experience. For indie comic book artists, Nanits offers a new solution to create and distribute digital comics - Nanits Composer. The new tool allows artists to upload their digital comics, overlay them onto an interactive, visual storyboard and add an original produced soundtrack from the Nanits Universe bank. Once approved, the comic is published and available immediately on the Nanits Reader iOS or Android application. The artist has the opportunity to earn up to 70% of the sales of their digital comic books on the Nanits Reader application.  ",https://www.linkedin.com/company/nanits-universe-ltd-/?originalSubdomain=cz,,https://twitter.com/NanitsOfficial,https://facebook.com/nanitsofficial/
PlaBook,https://www.crunchbase.com/organization/plabook,http://www.plabook.com/,Reading Apps,"Apps, Software","PlaBook is created to meet the needs of the next generation for reading, learning, and entertainment.","PlaBook is created to meet the needs of the next generation for reading, learning, and entertainment.",,,,
Plasmyd,https://www.crunchbase.com/organization/plasmyd,http://plasmyd.com,"Reading Apps, Search Engine, Web Browsers","Apps, Internet Services, Software","A new way to read, organize and annotate scientific papers in your browser.","A new way to read, organize and annotate scientific papers in your browser.",,,http://twitter.com/plasmyd,
